conference,title,abstract
ACM CCS 2009,Attacking cryptographic schemes based on &quot;perturbation polynomials&quot;.,"We show attacks on several cryptographic schemes that have recently been proposed for achieving various security goals in sensor networks. Roughly speaking, these schemes all use ""perturbation polynomials"" to add ""noise"" to polynomialbased systems that offer information-theoretic security, in an attempt to increase the resilience threshold while maintaining efficiency. We show that the heuristic security arguments given for these modified schemes do not hold, and that they can be completely broken once we allow even a slight extension of the parameters beyond those achieved by the underlying information-theoretic schemes."
ACM CCS 2009,On achieving good operating points on an ROC plane using stochastic anomaly score prediction.,"ROC curves have historically been used to evaluate the accuracy of Intrusion Detection Systems (IDSs). In this paper, we argue that a real-time IDS' input changes considerably over time and ROC curves generated using fixed, time-invariant classification thresholds do not characterize the best accuracy that an IDS can achieve. To address this problem, we propose a simple, generic and adaptive technique to achieve good ROC operating points for any given IDS. The proposed technique stochastically predicts the next anomaly score of an IDS and the anomaly classification threshold is then set as a function of the predicted score. We first perform statistical and information-theoretic analyses of network- and host-based IDSs' anomaly scores to reveal a consistent time correlation structure during benign activity periods. We model the observed correlation structure using Markov chains and then use this model to predict and adapt an IDS' classification threshold. The proposed adaptive thresholding module is incorporated into six prominent network- and host-based Anomaly Detection Systems (ADSs). These adaptive ADSs are evaluated on public and labeled attack datasets. We show that, while reducing the need for manual threshold configuration and having very low-complexity, adaptive thresholding enables the ADSs to achieve considerably higher accuracies on the ROC plane."
ACM CCS 2009,CoSP - a general framework for computational soundness proofs.,"We describe CoSP, a general framework for conducting computational soundness proofs of symbolic models and for embedding these proofs into formal calculi. CoSP considers arbitrary equational theories and computational implementations, and it abstracts away many details that are not crucial for proving computational soundness, such as message scheduling, corruption models, and even the internal structure of a protocol. CoSP enables soundness results, in the sense of preservation of trace properties, to be proven in a conceptually modular and generic way: proving x cryptographic primitives sound for y calculi only requires x + y proofs (instead of x • y proofs without this framework), and the process of embedding calculi is conceptually decoupled from computational soundness proofs of cryptographic primitives. We exemplify the usefulness of CoSP by proving the first computational soundness result for the full-fledged applied π-calculus under active attacks. Concretely, we embed the applied π-calculus into CoSP and give a sound implementation of public-key encryption and digital signatures."
ACM CCS 2009,An efficient forward private RFID protocol.,"Radio Frequency IDentifiers (RFID) are low-cost pervasive devices used in various settings for identification purposes: although they have originally been introduced to ease the supply chain management, they are already used in many other applications. Some of these applications need secure identification and ad-hoc authentication protocols have to be designed for that purpose. But the intrusion of RFID in the life of end-users might additionally require a higher level of user-privacy. Such security and privacy requirements conflict with the highly constrained environment of RFID systems. Ohkubo, Suzuki, and Kinoshita first proposed an appealing RFID protocol that meets the highest privacy requirements. However, their scheme and its known variants suffer from limitations in terms of computational complexity and provable security which this paper aims to address. We propose a novel forward private authentication scheme built upon less computationally expensive cryptographic ingredients, namely pseudo-random generators and universal hash functions instead of one way hash functions. In contrast with existing schemes, we provide security proofs of our construction in the standard model instead of the random oracle model."
ACM CCS 2009,Anonymous credentials on a standard java card.,"Secure identity tokens such as Electronic Identity (eID) cards are emerging everywhere. At the same time user-centric identity management gains acceptance. Anonymous credential schemes are the optimal realization of user-centricity. However, on inexpensive hardware platforms, typically used for eID cards, these schemes could not be made to meet the necessary requirements such as future-proof key lengths and transaction times on the order of 10 seconds. The reasons for this is the need for the hardware platform to be standardized and certified. Therefore an implementation is only possible as a Java Card applet. This results in severe restrictions: little memory (transient and persistent), an 8-bit CPU, and access to hardware acceleration for cryptographic operations only by defined interfaces such as RSA encryption operations."
ACM CCS 2009,Reactive noninterference.,"Many programs operate reactively--patiently waiting for user input, running for a while producing output, and eventually returning to a state where they are ready to accept another input (or occasionally diverging). When a reactive program communicates with multiple parties, we would like to be sure that it can be given secret information by one without leaking it to others."
ACM CCS 2009,XCS - cross channel scripting and its impact on web applications.,"We study the security of embedded web servers used in consumer electronic devices, such as security cameras and photo frames, and for IT infrastructure, such as wireless access points and lights-out management systems. All the devices we examine turn out to be vulnerable to a variety of web attacks, including cross site scripting (XSS) and cross site request forgery (CSRF). In addition, we show that consumer electronics are particularly vulnerable to a nasty form of persistent XSS where a non-web channel such as NFS or SNMP is used to inject a malicious script. This script is later used to attack an unsuspecting user who connects to the device's web server. We refer to web attacks which are mounted through a non-web channel as cross channel scripting (XCS). We propose a client-side defense against certain XCS which we implement as a browser extension."
ACM CCS 2009,HAIL - a high-availability and integrity layer for cloud storage.,"We introduce HAIL (High-Availability and Integrity Layer), a distributed cryptographic system that allows a set of servers to prove to a client that a stored file is intact and retrievable. HAIL strengthens, formally unifies, and streamlines distinct approaches from the cryptographic and distributed-systems communities. Proofs in HAIL are efficiently computable by servers and highly compact---typically tens or hundreds of bytes, irrespective of file size. HAIL cryptographically verifies and reactively reallocates file shares. It is robust against an active, mobile adversary, i.e., one that may progressively corrupt the full set of servers. We propose a strong, formal adversarial model for HAIL, and rigorous analysis and parameter choices. We show how HAIL improves on the security and efficiency of existing tools, like Proofs of Retrievability (PORs) deployed on individual servers. We also report on a prototype implementation."
ACM CCS 2009,Dispatcher - enabling active botnet infiltration using automatic protocol reverse-engineering.,"Automatic protocol reverse-engineering is important for many security applications, including the analysis and defense against botnets. Understanding the command-and-control (C&C) protocol used by a botnet is crucial for anticipating its repertoire of nefarious activity and to enable active botnet infiltration. Frequently, security analysts need to rewrite messages sent and received by a bot in order to contain malicious activity and to provide the botmaster with an illusion of successful and unhampered operation. To enable such rewriting, we need detailed information about the intent and structure of the messages in both directions of the communication despite the fact that we generally only have access to the implementation of one endpoint, namely the bot binary. Current techniques cannot enable such rewriting. In this paper, we propose techniques to extract the format of protocol messages sent by an application that implements a protocol specification, and to infer the field semantics for messages both sent and received by the application. Our techniques enable applications such as rewriting the C&C messages for active botnet infiltration. We implement our techniques into Dispatcher, a tool to extract the message format and field semantics of both received and sent messages. We use Dispatcher to analyze MegaD, a prevalent spam botnet employing a hitherto undocumented C&C protocol, and show that the protocol information extracted by Dispatcher can be used to rewrite the C&C messages."
ACM CCS 2009,Oblivious transfer with access control.,"We present a protocol for anonymous access to a database where the different records have different access control permissions. These permissions could be attributes, roles, or rights that the user needs to have in order to access the record. Our protocol offers maximal security guarantees for both the database and the user, namely (1) only authorized users can access the record; (2) the database provider does not learn which record the user accesses; and (3) the database provider does not learn which attributes or roles the user has when she accesses the database."
ACM CCS 2009,Mapping kernel objects to enable systematic integrity checking.,"Dynamic kernel data have become an attractive target for kernel-mode malware. However, previous solutions for checking kernel integrity either limit themselves to code and static data or can only inspect a fraction of dynamic data, resulting in limited protection. Our study shows that previous solutions may reach only 28% of the dynamic kernel data and thus may fail to identify function pointers manipulated by many kernel-mode malware."
ACM CCS 2009,On the difficulty of software-based attestation of embedded devices.,"Device attestation is an essential feature in many security protocols and applications. The lack of dedicated hardware and the impossibility to physically access devices to be attested, makes attestation of embedded devices, in applications such as Wireless Sensor Networks, a prominent challenge. Several software-based attestation techniques have been proposed that either rely on tight time constraints or on the lack of free space to store malicious code. This paper investigates the shortcomings of existing software-based attestation techniques. We first present two generic attacks, one based on a return-oriented rootkit} and the other on code compression. We further describe specific attacks on two existing proposals, namely SWATT and ICE-based schemes, and argue about the difficulty of fixing them. All attacks presented in this paper were implemented and validated on commodity sensors."
ACM CCS 2009,Certificateless onion routing.,"Onion routing protocols allow users to establish anonymous channels to preserve their privacy over a public network. Several protocols implementing this primitive have been proposed in recent years, and TOR, a real-life implementation, provides an onion routing service to thousands of users over the internet."
ACM CCS 2009,Improving privacy and security in multi-authority attribute-based encryption.,"Attribute based encryption (ABE) [13] determines decryption ability based on a user's attributes. In a multi-authority ABE scheme, multiple attribute-authorities monitor different sets of attributes and issue corresponding decryption keys to users, and encryptors can require that a user obtain keys for appropriate attributes from each authority before decrypting a message. Chase [5] gave a multi-authority ABE scheme using the concepts of a trusted central authority (CA) and global identifiers (GID). However, the CA in that construction has the power to decrypt every ciphertext, which seems somehow contradictory to the original goal of distributing control over many potentially untrusted authorities. Moreover, in that construction, the use of a consistent GID allowed the authorities to combine their information to build a full profile with all of a user's attributes, which unnecessarily compromises the privacy of the user. In this paper, we propose a solution which removes the trusted central authority, and protects the users' privacy by preventing the authorities from pooling their information on particular users, thus making ABE more usable in practice."
ACM CCS 2009,Multiple password interference in text passwords and click-based graphical passwords.,"The underlying issues relating to the usability and security of multiple passwords are largely unexplored. However, we know that people generally have difficulty remembering multiple passwords. This reduces security since users reuse the same password for different systems or reveal other passwords as they try to log in. We report on a laboratory study comparing recall of multiple text passwords with recall of multiple click-based graphical passwords. In a one-hour session (short-term), we found that participants in the graphical password condition coped significantly better than those in the text password condition. In particular, they made fewer errors when recalling their passwords, did not resort to creating passwords directly related to account names, and did not use similar passwords across multiple accounts. After two weeks, participants in the two conditions had recall success rates that were not statistically different from each other, but those with text passwords made more recall errors than participants with graphical passwords. In our study, click-based graphical passwords were significantly less susceptible to multiple password interference in the short-term, while having comparable usability to text passwords in most other respects."
ACM CCS 2009,Robust signatures for kernel data structures.,"Kernel-mode rootkits hide objects such as processes and threads using a technique known as Direct Kernel Object Manipulation (DKOM). Many forensic analysis tools attempt to detect these hidden objects by scanning kernel memory with handmade signatures; however, such signatures are brittle and rely on non-essential features of these data structures, making them easy to evade. In this paper, we present an automated mechanism for generating signatures for kernel data structures and show that these signatures are robust: attempts to evade the signature by modifying the structure contents will cause the OS to consider the object invalid. Using dynamic analysis, we profile the target data structure to determine commonly used fields, and we then fuzz those fields to determine which are essential to the correct operation of the OS. These fields form the basis of a signature for the data structure. In our experiments, our new signature matched the accuracy of existing scanners for traditional malware and found processes hidden with our prototype rootkit that all current signatures missed. Our techniques significantly increase the difficulty of hiding objects from signature scanning."
ACM CCS 2009,As-awareness in Tor path selection.,"Tor is an anonymous communications network with thousands of router nodes worldwide. An intuition reflected in much of the literature on anonymous communications is that, as an anonymity network grows, it becomes more secure against a given observer because the observer will see less of the network. In particular, as the Tor network grows from volunteers operating relays all over the world, it becomes less and less likely for a single autonomous system (AS) to be able to observe both ends of an anonymous connection. Yet, as the network continues to grow significantly, no analysis has been done to determine if this intuition is correct. Further, modifications to Tor's path selection algorithm to help clients avoid an AS-level observer have not been proposed and analyzed."
ACM CCS 2009,On lightweight mobile phone application certification.,"Users have begun downloading an increasingly large number of mobile phone applications in response to advancements in handsets and wireless networks. The increased number of applications results in a greater chance of installing Trojans and similar malware. In this paper, we propose the Kirin security service for Android, which performs lightweight certification of applications to mitigate malware at install time. Kirin certification uses security rules, which are templates designed to conservatively match undesirable properties in security configuration bundled with applications. We use a variant of security requirements engineering techniques to perform an in-depth security analysis of Android to produce a set of rules that match malware characteristics. In a sample of 311 of the most popular applications downloaded from the official Android Market, Kirin and our rules found 5 applications that implement dangerous functionality and therefore should be installed with extreme caution. Upon close inspection, another five applications asserted dangerous rights, but were within the scope of reasonable functional needs. These results indicate that security configuration bundled with Android applications provides practical means of detecting malware."
ACM CCS 2009,Dynamic provable data possession.,"We consider the problem of efficiently proving the integrity of data stored at untrusted servers. In the provable data possession (PDP) model, the client preprocesses the data and then sends it to an untrusted server for storage, while keeping a small amount of meta-data. The client later asks the server to prove that the stored data has not been tampered with or deleted (without downloading the actual data). However, the original PDP scheme applies only to static (or append-only) files."
ACM CCS 2009,A security-preserving compiler for distributed programs - from information-flow policies to cryptographic mechanisms.,"We enforce information flow policies in programs that run at multiple locations, with diverse levels of security."
ACM CCS 2009,A probabilistic approach to hybrid role mining.,"Role mining algorithms address an important access control problem: configuring a role-based access control system. Given a direct assignment of users to permissions, role mining discovers a set of roles together with an assignment of users to roles. The results should closely agree with the direct assignment. Moreover, the roles should be understandable from the business perspective in that they reflect functional roles within the enterprise. This requires hybrid role mining methods that work with both direct assignments and business information from the enterprise."
ACM CCS 2009,On non-cooperative location privacy - a game-theoretic analysis.,"In mobile networks, authentication is a required primitive for the majority of security protocols. However, an adversary can track the location of mobile nodes by monitoring pseudonyms used for authentication. A frequently proposed solution to protect location privacy suggests that mobile nodes collectively change their pseudonyms in regions called mix zones. Because this approach is costly, self-interested mobile nodes might decide not to cooperate and could thus jeopardize the achievable location privacy. In this paper, we analyze the non-cooperative behavior of mobile nodes by using a game-theoretic model, where each player aims at maximizing its location privacy at a minimum cost. We first analyze the Nash equilibria in n-player complete information games. Because mobile nodes in a privacy-sensitive system do not know their opponents' payoffs, we then consider incomplete information games. We establish that symmetric Bayesian-Nash equilibria exist with simple threshold strategies in n-player games and derive the equilibrium strategies. By means of numerical results, we show that mobile nodes become selfish when the cost of changing pseudonyms is small, whereas they cooperate more when the cost of changing pseudonyms increases. Finally, we design a protocol - the PseudoGame protocol - based on the results of our analysis."
ACM CCS 2009,Battle of Botcraft - fighting bots in online games with human observational proofs.,"The abuse of online games by automated programs, known as game bots, for gaining unfair advantages has plagued millions of participating players with escalating severity in recent years. The current methods for distinguishing bots and humans are based on human interactive proofs (HIPs), such as CAPTCHAs. However, HIP-based approaches have inherent drawbacks. In particular, they are too obtrusive to be tolerated by human players in a gaming context. In this paper, we propose a non-interactive approach based on human observational proofs (HOPs) for continuous game bot detection. HOPs differentiate bots from human players by passively monitoring input actions that are difficult for current bots to perform in a human-like manner. We collect a series of user-input traces in one of the most popular online games, World of Warcraft. Based on the traces, we characterize the game playing behaviors of bots and humans. Then, we develop a HOP-based game bot defense system that analyzes user-input actions with a cascade-correlation neural network to distinguish bots from humans. The HOP system is effective in capturing current game bots, which raises the bar against game exploits and forces a determined adversary to build more complicated game bots for detection evasion in the future."
ACM CCS 2009,Multi-party off-the-record messaging.,"Most cryptographic algorithms provide a means for secret and authentic communication. However, under many circumstances, the ability to repudiate messages or deny a conversation is no less important than secrecy and authenticity. For whistleblowers, informants, political dissidents and journalists --- to name a few --- it is most important to have means for deniable conversation, where electronic communication must mimic face-to-face private meetings. Off-the-Record Messaging, proposed in 2004 by Borisov, Goldberg and Brewer, and its subsequent improvements, simulate private two-party meetings. Despite some attempts, the multi-party scenario remains unresolved."
ACM CCS 2009,Large-scale malware indexing using function-call graphs.,"A major challenge of the anti-virus (AV) industry is how to effectively process the huge influx of malware samples they receive every day. One possible solution to this problem is to quickly determine if a new malware sample is similar to any previously-seen malware program. In this paper, we design, implement and evaluate a malware database management system called SMIT (Symantec Malware Indexing Tree) that can efficiently make such determination based on malware's function-call graphs, which is a structural representation known to be less susceptible to instruction-level obfuscations commonly employed by malware writers to evade detection of AV software. Because each malware program is represented as a graph, the problem of searching for the most similar malware program in a database to a given malware sample is cast into a nearest-neighbor search problem in a graph database. To speed up this search, we have developed an efficient method to compute graph similarity that exploits structural and instruction-level information in the underlying malware programs, and a multi-resolution indexing scheme that uses a computationally economical feature vector for early pruning and resorts to a more accurate but computationally more expensive graph similarity function only when it needs to pinpoint the most similar neighbors. Results of a comprehensive performance study of the SMIT prototype using a database of more than 100,000 malware demonstrate the effective pruning power and scalability of its nearest neighbor search mechanisms."
ACM CCS 2009,Fides - remote anomaly-based cheat detection using client emulation.,"As a result of physically owning the client machine, cheaters in online games currently have the upper-hand when it comes to avoiding detection. To address this problem and turn the table on cheaters, this paper presents Fides, an anomaly-based cheat detection approach that remotely validates game execution. With Fides, a server-side Controller specifies how and when a client-side Auditor measures the game. To accurately validate measurements, the Controller partially emulates the client and collaborates with the server. This paper examines a range of cheat methods and initial measurements that counter them, showing that a Fides prototype is able to efficiently detect several existing cheats, including one state-of-the-art cheat that is advertised as ""undetectable""."
