conference,title,abstract
ACM CCS 2009,"Hey, you, get off of my cloud - exploring information leakage in third-party compute clouds.","Third-party cloud computing represents the promise of outsourcing as applied to computation. Services, such as Microsoft's Azure and Amazon's EC2, allow users to instantiate virtual machines (VMs) on demand and thus purchase precisely the capacity they require when they require it. In turn, the use of virtualization allows third-party cloud providers to maximize the utilization of their sunk capital costs by multiplexing many customer VMs across a shared physical infrastructure. However, in this paper, we show that this approach can also introduce new vulnerabilities. Using the Amazon EC2 service as a case study, we show that it is possible to map the internal cloud infrastructure, identify where a particular target VM is likely to reside, and then instantiate new VMs until one is placed co-resident with the target. We explore how such placement can then be used to mount cross-VM side-channel attacks to extract information from a target VM on the same machine."
ACM CCS 2009,Secure in-VM monitoring using hardware virtualization.,"Kernel-level attacks or rootkits can compromise the security of an operating system by executing with the privilege of the kernel. Current approaches use virtualization to gain higher privilege over these attacks, and isolate security tools from the untrusted guest VM by moving them out and placing them in a separate trusted VM. Although out-of-VM isolation can help ensure security, the added overhead of world-switches between the guest VMs for each invocation of the monitor makes this approach unsuitable for many applications, especially fine-grained monitoring. In this paper, we present Secure In-VM Monitoring (SIM), a general-purpose framework that enables security monitoring applications to be placed back in the untrusted guest VM for efficiency without sacrificing the security guarantees provided by running them outside of the VM. We utilize contemporary hardware memory protection and hardware virtualization features available in recent processors to create a hypervisor protected address space where a monitor can execute and access data in native speeds and to which execution is transferred in a controlled manner that does not require hypervisor involvement. We have developed a prototype into KVM utilizing Intel VT hardware virtualization technology. We have also developed two representative applications for the Windows OS that monitor system calls and process creations. Our microbenchmarks show at least 10 times performance improvement in invocation of a monitor inside SIM over a monitor residing in another trusted VM. With a systematic security analysis of SIM against a number of possible threats, we show that SIM provides at least the same security guarantees as what can be achieved by out-of-VM monitors."
ACM CCS 2009,Can they hear me now? - a security analysis of law enforcement wiretaps.,"Although modern communications services are susceptible to third-party eavesdropping via a wide range of possible techniques, law enforcement agencies in the US and other countries generally use one of two technologies when they conduct legally-authorized interception of telephones and other communications traffic. The most common of these, designed to comply with the 1994 Communications Assistance for Law Enforcement Act(CALEA), use a standard interface provided in network switches."
ACM CCS 2009,A metadata calculus for secure information sharing.,"In both commercial and defense sectors a compelling need is emerging for rapid, yet secure, dissemination of information to the concerned actors. Traditional approaches to information sharing that rely on security labels (e.g., Multi-Level Security (MLS)) suffer from at least two major drawbacks. First, static security labels do not account for tactical information whose value decays over time. Second, MLS-like approaches have often ignored information transform semantics when deducing security labels (e.g., output security label = max over all input security labels). While MLS-like label deduction appears to be conservative, we argue that this approach can result in both underestimation and overestimation of security labels. We contend that overestimation may adversely throttle information flows, while underestimation incites information misuse and leakage."
ACM CCS 2009,Your botnet is my botnet - analysis of a botnet takeover.,"Botnets, networks of malware-infected machines that are controlled by an adversary, are the root cause of a large number of security problems on the Internet. A particularly sophisticated and insidious type of bot is Torpig, a malware program that is designed to harvest sensitive information (such as bank account and credit card data) from its victims. In this paper, we report on our efforts to take control of the Torpig botnet and study its operations for a period of ten days. During this time, we observed more than 180 thousand infections and recorded almost 70 GB of data that the bots collected. While botnets have been ""hijacked"" and studied previously, the Torpig botnet exhibits certain properties that make the analysis of the data particularly interesting. First, it is possible (with reasonable accuracy) to identify unique bot infections and relate that number to the more than 1.2 million IP addresses that contacted our command and control server. Second, the Torpig botnet is large, targets a variety of applications, and gathers a rich and diverse set of data from the infected victims. This data provides a new understanding of the type and amount of personal information that is stolen by botnets."
ACM CCS 2009,On voting machine design for verification and testability.,"We present an approach for the design and analysis of an electronic voting machine based on a novel combination of formal verification and systematic testing. The system was designed specifically to enable verification and testing. In our architecture, the voting machine is a finite-state transducer that implements the bare essentials required for an election. We formally specify how each component of the machine is intended to work and formally verify that a Verilog implementation of our design meets this specification. However, it is more challenging to verify that the composition of these components will behave as a voter would expect, because formalizing human expectations is difficult. We show how systematic testing can be used to address this issue, and in particular to verify that the machine will behave correctly on election day."
ACM CCS 2009,On cellular botnets - measuring the impact of malicious devices on a cellular network core.,"The vast expansion of interconnectivity with the Internet and the rapid evolution of highly-capable but largely insecure mobile devices threatens cellular networks. In this paper, we characterize the impact of the large scale compromise and coordination of mobile phones in attacks against the core of these networks. Through a combination of measurement, simulation and analysis, we demonstrate the ability of a botnet composed of as few as 11,750 compromised mobile phones to degrade service to area-code sized regions by 93%. As such attacks are accomplished through the execution of network service requests and not a constant stream of phone calls, users are unlikely to be aware of their occurrence. We then investigate a number of significant network bottlenecks, their impact on the density of compromised nodes per base station and how they can be avoided. We conclude by discussing a number of countermeasures that may help to partially mitigate the threats posed by such attacks."
ACM CCS 2009,The bayesian traffic analysis of mix networks.,"This work casts the traffic analysis of anonymity systems, and in particular mix networks, in the context of Bayesian inference. A generative probabilistic model of mix network architectures is presented, that incorporates a number of attack techniques in the traffic analysis literature. We use the model to build an Markov Chain Monte Carlo inference engine, that calculates the probabilities of who is talking to whom given an observation of network traces. We provide a thorough evaluation of its correctness and performance, and confirm that mix networks with realistic parameters are secure. This approach enables us to apply established information theoretic anonymity metrics on complex mix networks, and extract information from anonymised traffic traces optimally."
ACM CCS 2009,Membership-concealing overlay networks.,"We introduce the concept of membership-concealing overlay networks (MCONs), which hide the real-world identities of participants. We argue that while membership concealment is orthogonal to anonymity and censorship resistance, pseudonymous communication and censorship resistance become much easier if done over a membership-concealing network. We formalize the concept of membership concealment, discuss a number of attacks against existing systems and present real-world attack results. We then propose three proof-of-concept MCON designs that resist those attacks: one that is more efficient, another that is more robust to membership churn, and a third that balances efficiency and robustness. We show theoretical and simulation results demonstrating the feasibility and performance of our schemes."
ACM CCS 2009,Ripley - automatically securing web 2.0 applications through replicated execution.,"Rich Internet applications are becoming increasingly distributed, as demonstrated by the popularity of AJAX or Web 2.0 applications such as Facebook, Google Maps, Hotmail and many others. A typical multi-tier AJAX application consists, at least, of a server-side component implemented in Java J2EE, PHP or ASP.NET and a client-side component running JavaScript. The resulting application is more responsive because computation has moved closer to the client, avoiding unnecessary network round trips for frequent user actions."
ACM CCS 2009,Countering kernel rootkits with lightweight hook protection.,"Kernel rootkits have posed serious security threats due to their stealthy manner. To hide their presence and activities, many rootkits hijack control flows by modifying control data or hooks in the kernel space. A critical step towards eliminating rootkits is to protect such hooks from being hijacked. However, it remains a challenge because there exist a large number of widely-scattered kernel hooks and many of them could be dynamically allocated from kernel heap and co-located together with other kernel data. In addition, there is a lack of flexible commodity hardware support, leading to the socalled protection granularity gap -- kernel hook protection requires byte-level granularity but commodity hardware only provides page level protection."
ACM CCS 2009,Behavior based software theft detection.,"Along with the burst of open source projects, software theft (or plagiarism) has become a very serious threat to the healthiness of software industry. Software birthmark, which represents the unique characteristics of a program, can be used for software theft detection. We propose a system call dependence graph based software birthmark called SCDG birthmark, and examine how well it reflects unique behavioral characteristics of a program. To our knowledge, our detection system based on SCDG birthmark is the first one that is capable of detecting software component theft where only partial code is stolen. We demonstrate the strength of our birthmark against various evasion techniques, including those based on different compilers and different compiler optimization levels as well as two state-of-the-art obfuscation tools. Unlike the existing work that were evaluated through small or toy software, we also evaluate our birthmark on a set of large software. Our results show that SCDG birthmark is very practical and effective in detecting software theft that even adopts advanced evasion techniques."
ACM CCS 2009,Learning your identity and disease from research papers - information leaks in genome wide association study.,"Genome-wide association studies (GWAS) aim at discovering the association between genetic variations, particularly single-nucleotide polymorphism (SNP), and common diseases, which is well recognized to be one of the most important and active areas in biomedical research. Also renowned is the privacy implication of such studies, which has been brought into the limelight by the recent attack proposed by Homer et al. Homer's attack demonstrates that it is possible to identify a GWAS participant from the allele frequencies of a large number of SNPs. Such a threat, unfortunately, was found in our research to be significantly understated. In this paper, we show that individuals can actually be identified from even a relatively small set of statistics, as those routinely published in GWAS papers. We present two attacks. The first one extends Homer's attack with a much more powerful test statistic, based on the correlations among different SNPs described by coefficient of determination (r2). This attack can determine the presence of an individual from the statistics related to a couple of hundred SNPs. The second attack can lead to complete disclosure of hundreds of participants' SNPs, through analyzing the information derived from published statistics. We also found that those attacks can succeed even when the precisions of the statistics are low and part of data is missing. We evaluated our attacks on the real human genomes and concluded that such threats are completely realistic."
ACM CCS 2009,Privacy-preserving genomic computation through program specialization.,"In this paper, we present a new approach to performing important classes of genomic computations (e.g., search for homologous genes) that makes a significant step towards privacy protection in this domain. Our approach leverages a key property of the human genome, namely that the vast majority of it is shared across humans (and hence public), and consequently relatively little of it is sensitive. Based on this observation, we propose a privacy-protection framework that partitions a genomic computation, distributing the part on sensitive data to the data provider and the part on the pubic data to the user of the data. Such a partition is achieved through program specialization that enables a biocomputing program to perform a concrete execution on public data and a symbolic execution on sensitive data. As a result, the program is simplified into an efficient query program that takes only sensitive genetic data as inputs. We prove the effectiveness of our techniques on a set of dynamic programming algorithms common in genomic computing. We develop a program transformation tool that automatically instruments a legacy program for specialization operations. We also demonstrate that our techniques can greatly facilitate secure multi-party computations on large biocomputing problems."
ACM CCS 2009,Feeling-based location privacy protection for location-based services.,"Anonymous location information may be correlated with restricted spaces such as home and office for subject re-identification. This makes it a great challenge to provide location privacy protection for users of location-based services. Existing work adopts traditional K-anonymity model and ensures that each location disclosed in service requests is a spatial region that has been visited by at least K users. This strategy requires a user to specify an appropriate value of K in order to achieve a desired level of privacy protection. This is problematic because privacy is about feeling, and it is awkward for one to scale her feeling using a number. In this paper, we propose a feeling-based privacy model. The model allows a user to express her privacy requirement by specifying a public region, which the user would feel comfortable if the region is reported as her location. The popularity of the public region, measured using entropy based on its visitors' footprints inside it, is then used as the user's desired level of privacy protection. With this model in place, we present a novel technique that allows a user's location information to be reported as accurate as possible while providing her sufficient location privacy protection. The new technique supports trajectory cloaking and can be used in application scenarios where a user needs to make frequent location updates along a trajectory that cannot be predicted. In addition to evaluating the effectiveness of the proposed technique under various conditions through simulation, we have also implemented an experimental system for location privacy-aware uses of location-based services."
ACM CCS 2009,Filter-resistant code injection on ARM.,"Code injections attacks are one of the most powerful and important classes of attacks on software. In such attacks, the attacker sends malicious input to a software application, where it is stored in memory. The malicious input is chosen in such a way that its representation in memory is also a valid representation of a machine code program that performs actions chosen by the attacker. The attacker then triggers a bug in the application to divert the control flow to this injected machine code. A typical action of the injected code is to launch a command interpreter shell, and hence the malicious input is often called shellcode."
conference,title,abstract
ACM CCS 2009,Attacking cryptographic schemes based on &quot;perturbation polynomials&quot;.,"We show attacks on several cryptographic schemes that have recently been proposed for achieving various security goals in sensor networks. Roughly speaking, these schemes all use ""perturbation polynomials"" to add ""noise"" to polynomialbased systems that offer information-theoretic security, in an attempt to increase the resilience threshold while maintaining efficiency. We show that the heuristic security arguments given for these modified schemes do not hold, and that they can be completely broken once we allow even a slight extension of the parameters beyond those achieved by the underlying information-theoretic schemes."
ACM CCS 2009,On achieving good operating points on an ROC plane using stochastic anomaly score prediction.,"ROC curves have historically been used to evaluate the accuracy of Intrusion Detection Systems (IDSs). In this paper, we argue that a real-time IDS' input changes considerably over time and ROC curves generated using fixed, time-invariant classification thresholds do not characterize the best accuracy that an IDS can achieve. To address this problem, we propose a simple, generic and adaptive technique to achieve good ROC operating points for any given IDS. The proposed technique stochastically predicts the next anomaly score of an IDS and the anomaly classification threshold is then set as a function of the predicted score. We first perform statistical and information-theoretic analyses of network- and host-based IDSs' anomaly scores to reveal a consistent time correlation structure during benign activity periods. We model the observed correlation structure using Markov chains and then use this model to predict and adapt an IDS' classification threshold. The proposed adaptive thresholding module is incorporated into six prominent network- and host-based Anomaly Detection Systems (ADSs). These adaptive ADSs are evaluated on public and labeled attack datasets. We show that, while reducing the need for manual threshold configuration and having very low-complexity, adaptive thresholding enables the ADSs to achieve considerably higher accuracies on the ROC plane."
ACM CCS 2009,CoSP - a general framework for computational soundness proofs.,"We describe CoSP, a general framework for conducting computational soundness proofs of symbolic models and for embedding these proofs into formal calculi. CoSP considers arbitrary equational theories and computational implementations, and it abstracts away many details that are not crucial for proving computational soundness, such as message scheduling, corruption models, and even the internal structure of a protocol. CoSP enables soundness results, in the sense of preservation of trace properties, to be proven in a conceptually modular and generic way: proving x cryptographic primitives sound for y calculi only requires x + y proofs (instead of x • y proofs without this framework), and the process of embedding calculi is conceptually decoupled from computational soundness proofs of cryptographic primitives. We exemplify the usefulness of CoSP by proving the first computational soundness result for the full-fledged applied π-calculus under active attacks. Concretely, we embed the applied π-calculus into CoSP and give a sound implementation of public-key encryption and digital signatures."
ACM CCS 2009,An efficient forward private RFID protocol.,"Radio Frequency IDentifiers (RFID) are low-cost pervasive devices used in various settings for identification purposes: although they have originally been introduced to ease the supply chain management, they are already used in many other applications. Some of these applications need secure identification and ad-hoc authentication protocols have to be designed for that purpose. But the intrusion of RFID in the life of end-users might additionally require a higher level of user-privacy. Such security and privacy requirements conflict with the highly constrained environment of RFID systems. Ohkubo, Suzuki, and Kinoshita first proposed an appealing RFID protocol that meets the highest privacy requirements. However, their scheme and its known variants suffer from limitations in terms of computational complexity and provable security which this paper aims to address. We propose a novel forward private authentication scheme built upon less computationally expensive cryptographic ingredients, namely pseudo-random generators and universal hash functions instead of one way hash functions. In contrast with existing schemes, we provide security proofs of our construction in the standard model instead of the random oracle model."
ACM CCS 2009,Anonymous credentials on a standard java card.,"Secure identity tokens such as Electronic Identity (eID) cards are emerging everywhere. At the same time user-centric identity management gains acceptance. Anonymous credential schemes are the optimal realization of user-centricity. However, on inexpensive hardware platforms, typically used for eID cards, these schemes could not be made to meet the necessary requirements such as future-proof key lengths and transaction times on the order of 10 seconds. The reasons for this is the need for the hardware platform to be standardized and certified. Therefore an implementation is only possible as a Java Card applet. This results in severe restrictions: little memory (transient and persistent), an 8-bit CPU, and access to hardware acceleration for cryptographic operations only by defined interfaces such as RSA encryption operations."
ACM CCS 2009,Reactive noninterference.,"Many programs operate reactively--patiently waiting for user input, running for a while producing output, and eventually returning to a state where they are ready to accept another input (or occasionally diverging). When a reactive program communicates with multiple parties, we would like to be sure that it can be given secret information by one without leaking it to others."
ACM CCS 2009,XCS - cross channel scripting and its impact on web applications.,"We study the security of embedded web servers used in consumer electronic devices, such as security cameras and photo frames, and for IT infrastructure, such as wireless access points and lights-out management systems. All the devices we examine turn out to be vulnerable to a variety of web attacks, including cross site scripting (XSS) and cross site request forgery (CSRF). In addition, we show that consumer electronics are particularly vulnerable to a nasty form of persistent XSS where a non-web channel such as NFS or SNMP is used to inject a malicious script. This script is later used to attack an unsuspecting user who connects to the device's web server. We refer to web attacks which are mounted through a non-web channel as cross channel scripting (XCS). We propose a client-side defense against certain XCS which we implement as a browser extension."
ACM CCS 2009,HAIL - a high-availability and integrity layer for cloud storage.,"We introduce HAIL (High-Availability and Integrity Layer), a distributed cryptographic system that allows a set of servers to prove to a client that a stored file is intact and retrievable. HAIL strengthens, formally unifies, and streamlines distinct approaches from the cryptographic and distributed-systems communities. Proofs in HAIL are efficiently computable by servers and highly compact---typically tens or hundreds of bytes, irrespective of file size. HAIL cryptographically verifies and reactively reallocates file shares. It is robust against an active, mobile adversary, i.e., one that may progressively corrupt the full set of servers. We propose a strong, formal adversarial model for HAIL, and rigorous analysis and parameter choices. We show how HAIL improves on the security and efficiency of existing tools, like Proofs of Retrievability (PORs) deployed on individual servers. We also report on a prototype implementation."
