conference,title,abstract
ACM CCS 2009,Dispatcher - enabling active botnet infiltration using automatic protocol reverse-engineering.,"Automatic protocol reverse-engineering is important for many security applications, including the analysis and defense against botnets. Understanding the command-and-control (C&C) protocol used by a botnet is crucial for anticipating its repertoire of nefarious activity and to enable active botnet infiltration. Frequently, security analysts need to rewrite messages sent and received by a bot in order to contain malicious activity and to provide the botmaster with an illusion of successful and unhampered operation. To enable such rewriting, we need detailed information about the intent and structure of the messages in both directions of the communication despite the fact that we generally only have access to the implementation of one endpoint, namely the bot binary. Current techniques cannot enable such rewriting. In this paper, we propose techniques to extract the format of protocol messages sent by an application that implements a protocol specification, and to infer the field semantics for messages both sent and received by the application. Our techniques enable applications such as rewriting the C&C messages for active botnet infiltration. We implement our techniques into Dispatcher, a tool to extract the message format and field semantics of both received and sent messages. We use Dispatcher to analyze MegaD, a prevalent spam botnet employing a hitherto undocumented C&C protocol, and show that the protocol information extracted by Dispatcher can be used to rewrite the C&C messages."
ACM CCS 2009,Oblivious transfer with access control.,"We present a protocol for anonymous access to a database where the different records have different access control permissions. These permissions could be attributes, roles, or rights that the user needs to have in order to access the record. Our protocol offers maximal security guarantees for both the database and the user, namely (1) only authorized users can access the record; (2) the database provider does not learn which record the user accesses; and (3) the database provider does not learn which attributes or roles the user has when she accesses the database."
ACM CCS 2009,Mapping kernel objects to enable systematic integrity checking.,"Dynamic kernel data have become an attractive target for kernel-mode malware. However, previous solutions for checking kernel integrity either limit themselves to code and static data or can only inspect a fraction of dynamic data, resulting in limited protection. Our study shows that previous solutions may reach only 28% of the dynamic kernel data and thus may fail to identify function pointers manipulated by many kernel-mode malware."
ACM CCS 2009,On the difficulty of software-based attestation of embedded devices.,"Device attestation is an essential feature in many security protocols and applications. The lack of dedicated hardware and the impossibility to physically access devices to be attested, makes attestation of embedded devices, in applications such as Wireless Sensor Networks, a prominent challenge. Several software-based attestation techniques have been proposed that either rely on tight time constraints or on the lack of free space to store malicious code. This paper investigates the shortcomings of existing software-based attestation techniques. We first present two generic attacks, one based on a return-oriented rootkit} and the other on code compression. We further describe specific attacks on two existing proposals, namely SWATT and ICE-based schemes, and argue about the difficulty of fixing them. All attacks presented in this paper were implemented and validated on commodity sensors."
ACM CCS 2009,Certificateless onion routing.,"Onion routing protocols allow users to establish anonymous channels to preserve their privacy over a public network. Several protocols implementing this primitive have been proposed in recent years, and TOR, a real-life implementation, provides an onion routing service to thousands of users over the internet."
ACM CCS 2009,Improving privacy and security in multi-authority attribute-based encryption.,"Attribute based encryption (ABE) [13] determines decryption ability based on a user's attributes. In a multi-authority ABE scheme, multiple attribute-authorities monitor different sets of attributes and issue corresponding decryption keys to users, and encryptors can require that a user obtain keys for appropriate attributes from each authority before decrypting a message. Chase [5] gave a multi-authority ABE scheme using the concepts of a trusted central authority (CA) and global identifiers (GID). However, the CA in that construction has the power to decrypt every ciphertext, which seems somehow contradictory to the original goal of distributing control over many potentially untrusted authorities. Moreover, in that construction, the use of a consistent GID allowed the authorities to combine their information to build a full profile with all of a user's attributes, which unnecessarily compromises the privacy of the user. In this paper, we propose a solution which removes the trusted central authority, and protects the users' privacy by preventing the authorities from pooling their information on particular users, thus making ABE more usable in practice."
ACM CCS 2009,Multiple password interference in text passwords and click-based graphical passwords.,"The underlying issues relating to the usability and security of multiple passwords are largely unexplored. However, we know that people generally have difficulty remembering multiple passwords. This reduces security since users reuse the same password for different systems or reveal other passwords as they try to log in. We report on a laboratory study comparing recall of multiple text passwords with recall of multiple click-based graphical passwords. In a one-hour session (short-term), we found that participants in the graphical password condition coped significantly better than those in the text password condition. In particular, they made fewer errors when recalling their passwords, did not resort to creating passwords directly related to account names, and did not use similar passwords across multiple accounts. After two weeks, participants in the two conditions had recall success rates that were not statistically different from each other, but those with text passwords made more recall errors than participants with graphical passwords. In our study, click-based graphical passwords were significantly less susceptible to multiple password interference in the short-term, while having comparable usability to text passwords in most other respects."
ACM CCS 2009,Robust signatures for kernel data structures.,"Kernel-mode rootkits hide objects such as processes and threads using a technique known as Direct Kernel Object Manipulation (DKOM). Many forensic analysis tools attempt to detect these hidden objects by scanning kernel memory with handmade signatures; however, such signatures are brittle and rely on non-essential features of these data structures, making them easy to evade. In this paper, we present an automated mechanism for generating signatures for kernel data structures and show that these signatures are robust: attempts to evade the signature by modifying the structure contents will cause the OS to consider the object invalid. Using dynamic analysis, we profile the target data structure to determine commonly used fields, and we then fuzz those fields to determine which are essential to the correct operation of the OS. These fields form the basis of a signature for the data structure. In our experiments, our new signature matched the accuracy of existing scanners for traditional malware and found processes hidden with our prototype rootkit that all current signatures missed. Our techniques significantly increase the difficulty of hiding objects from signature scanning."
ACM CCS 2009,As-awareness in Tor path selection.,"Tor is an anonymous communications network with thousands of router nodes worldwide. An intuition reflected in much of the literature on anonymous communications is that, as an anonymity network grows, it becomes more secure against a given observer because the observer will see less of the network. In particular, as the Tor network grows from volunteers operating relays all over the world, it becomes less and less likely for a single autonomous system (AS) to be able to observe both ends of an anonymous connection. Yet, as the network continues to grow significantly, no analysis has been done to determine if this intuition is correct. Further, modifications to Tor's path selection algorithm to help clients avoid an AS-level observer have not been proposed and analyzed."
ACM CCS 2009,On lightweight mobile phone application certification.,"Users have begun downloading an increasingly large number of mobile phone applications in response to advancements in handsets and wireless networks. The increased number of applications results in a greater chance of installing Trojans and similar malware. In this paper, we propose the Kirin security service for Android, which performs lightweight certification of applications to mitigate malware at install time. Kirin certification uses security rules, which are templates designed to conservatively match undesirable properties in security configuration bundled with applications. We use a variant of security requirements engineering techniques to perform an in-depth security analysis of Android to produce a set of rules that match malware characteristics. In a sample of 311 of the most popular applications downloaded from the official Android Market, Kirin and our rules found 5 applications that implement dangerous functionality and therefore should be installed with extreme caution. Upon close inspection, another five applications asserted dangerous rights, but were within the scope of reasonable functional needs. These results indicate that security configuration bundled with Android applications provides practical means of detecting malware."
ACM CCS 2009,Dynamic provable data possession.,"We consider the problem of efficiently proving the integrity of data stored at untrusted servers. In the provable data possession (PDP) model, the client preprocesses the data and then sends it to an untrusted server for storage, while keeping a small amount of meta-data. The client later asks the server to prove that the stored data has not been tampered with or deleted (without downloading the actual data). However, the original PDP scheme applies only to static (or append-only) files."
ACM CCS 2009,A security-preserving compiler for distributed programs - from information-flow policies to cryptographic mechanisms.,"We enforce information flow policies in programs that run at multiple locations, with diverse levels of security."
ACM CCS 2009,A probabilistic approach to hybrid role mining.,"Role mining algorithms address an important access control problem: configuring a role-based access control system. Given a direct assignment of users to permissions, role mining discovers a set of roles together with an assignment of users to roles. The results should closely agree with the direct assignment. Moreover, the roles should be understandable from the business perspective in that they reflect functional roles within the enterprise. This requires hybrid role mining methods that work with both direct assignments and business information from the enterprise."
ACM CCS 2009,On non-cooperative location privacy - a game-theoretic analysis.,"In mobile networks, authentication is a required primitive for the majority of security protocols. However, an adversary can track the location of mobile nodes by monitoring pseudonyms used for authentication. A frequently proposed solution to protect location privacy suggests that mobile nodes collectively change their pseudonyms in regions called mix zones. Because this approach is costly, self-interested mobile nodes might decide not to cooperate and could thus jeopardize the achievable location privacy. In this paper, we analyze the non-cooperative behavior of mobile nodes by using a game-theoretic model, where each player aims at maximizing its location privacy at a minimum cost. We first analyze the Nash equilibria in n-player complete information games. Because mobile nodes in a privacy-sensitive system do not know their opponents' payoffs, we then consider incomplete information games. We establish that symmetric Bayesian-Nash equilibria exist with simple threshold strategies in n-player games and derive the equilibrium strategies. By means of numerical results, we show that mobile nodes become selfish when the cost of changing pseudonyms is small, whereas they cooperate more when the cost of changing pseudonyms increases. Finally, we design a protocol - the PseudoGame protocol - based on the results of our analysis."
ACM CCS 2009,Battle of Botcraft - fighting bots in online games with human observational proofs.,"The abuse of online games by automated programs, known as game bots, for gaining unfair advantages has plagued millions of participating players with escalating severity in recent years. The current methods for distinguishing bots and humans are based on human interactive proofs (HIPs), such as CAPTCHAs. However, HIP-based approaches have inherent drawbacks. In particular, they are too obtrusive to be tolerated by human players in a gaming context. In this paper, we propose a non-interactive approach based on human observational proofs (HOPs) for continuous game bot detection. HOPs differentiate bots from human players by passively monitoring input actions that are difficult for current bots to perform in a human-like manner. We collect a series of user-input traces in one of the most popular online games, World of Warcraft. Based on the traces, we characterize the game playing behaviors of bots and humans. Then, we develop a HOP-based game bot defense system that analyzes user-input actions with a cascade-correlation neural network to distinguish bots from humans. The HOP system is effective in capturing current game bots, which raises the bar against game exploits and forces a determined adversary to build more complicated game bots for detection evasion in the future."
ACM CCS 2009,Multi-party off-the-record messaging.,"Most cryptographic algorithms provide a means for secret and authentic communication. However, under many circumstances, the ability to repudiate messages or deny a conversation is no less important than secrecy and authenticity. For whistleblowers, informants, political dissidents and journalists --- to name a few --- it is most important to have means for deniable conversation, where electronic communication must mimic face-to-face private meetings. Off-the-Record Messaging, proposed in 2004 by Borisov, Goldberg and Brewer, and its subsequent improvements, simulate private two-party meetings. Despite some attempts, the multi-party scenario remains unresolved."
ACM CCS 2009,Large-scale malware indexing using function-call graphs.,"A major challenge of the anti-virus (AV) industry is how to effectively process the huge influx of malware samples they receive every day. One possible solution to this problem is to quickly determine if a new malware sample is similar to any previously-seen malware program. In this paper, we design, implement and evaluate a malware database management system called SMIT (Symantec Malware Indexing Tree) that can efficiently make such determination based on malware's function-call graphs, which is a structural representation known to be less susceptible to instruction-level obfuscations commonly employed by malware writers to evade detection of AV software. Because each malware program is represented as a graph, the problem of searching for the most similar malware program in a database to a given malware sample is cast into a nearest-neighbor search problem in a graph database. To speed up this search, we have developed an efficient method to compute graph similarity that exploits structural and instruction-level information in the underlying malware programs, and a multi-resolution indexing scheme that uses a computationally economical feature vector for early pruning and resorts to a more accurate but computationally more expensive graph similarity function only when it needs to pinpoint the most similar neighbors. Results of a comprehensive performance study of the SMIT prototype using a database of more than 100,000 malware demonstrate the effective pruning power and scalability of its nearest neighbor search mechanisms."
ACM CCS 2009,Fides - remote anomaly-based cheat detection using client emulation.,"As a result of physically owning the client machine, cheaters in online games currently have the upper-hand when it comes to avoiding detection. To address this problem and turn the table on cheaters, this paper presents Fides, an anomaly-based cheat detection approach that remotely validates game execution. With Fides, a server-side Controller specifies how and when a client-side Auditor measures the game. To accurately validate measurements, the Controller partially emulates the client and collaborates with the server. This paper examines a range of cheat methods and initial measurements that counter them, showing that a Fides prototype is able to efficiently detect several existing cheats, including one state-of-the-art cheat that is advertised as ""undetectable""."
ACM CCS 2009,"EPC RFID tag security weaknesses and defenses - passport cards, enhanced drivers licenses, and beyond.","EPC (Electronic Product Code) tags are industry-standard RFID devices poised to supplant optical barcodes in many applications. We explore the systemic risks and challenges created by the increasingly common use of EPC for security applications. As a central case study, we examine the recently issued United States Passport Card and Washington State ""enhanced drivers license"" (WA EDL), both of which incorporate Gen-2 EPC tags. We measure multiple weaknesses, including susceptibility to cloning, extended read ranges, and the ability to remotely kill a WA EDL. We study the implications of these vulnerabilities to overall system security, and offer suggestions for improvement. We demonstrate anti-cloning techniques for off-the-shelf EPC tags, overcoming practical challenges in a previous proposal to co-opt the EPC ""kill"" command to achieve tag authentication. Our paper fills a vacuum of experimentally grounded evaluation of and guidance for security applications for EPC tags not just in identity documents, but more broadly in the authentication of objects and people."
ACM CCS 2009,Computational soundness for key exchange protocols with symmetric encryption.,"Formal analysis of security protocols based on symbolic models has been very successful in finding flaws in published protocols and proving protocols secure, using automated tools. An important question is whether this kind of formal analysis implies security guarantees in the strong sense of modern cryptography. Initiated by the seminal work of Abadi and Rogaway, this question has been investigated and numerous positive results showing this so-called computational soundness of formal analysis have been obtained. However, for the case of active adversaries and protocols that use symmetric encryption computational soundness has remained a challenge."
ACM CCS 2009,Efficient pseudorandom functions from the decisional linear assumption and weaker variants.,"In this paper, we generalize Naor and Reingold's construction of pseudorandom functions under the DDH Assumption [22] to yield a construction of pseudorandom functions under the decisional k-Linear Assumption, for each k › 1. The decisional Linear Assumption was first introduced by Boneh, Boyen, and Shacham in [5] as an alternative assumption for settings where the DDH problem is easy, such as bilinear groups. Shacham [25] and Hofheinz and Kiltz [16] independently introduced the generalized decisional k-Linear Assumptions and showed that the decisional (k+1)-Linear problem is hard for generic groups even when the decisional k-Linear problem is easy. It is thus desirable to have constructions of cryptographic primitives based on the decisional k-Linear Assumption instead of DDH. Not surprisingly, one must pay a small price for added security: as k increases, our constructed functions become slightly less efficient to compute and the key size increases (quadratically in k)."
ACM CCS 2009,Finding bugs in exceptional situations of JNI programs.,"Software flaws in native methods may defeat Java's guarantees of safety and security. One common kind of flaws in native methods results from the discrepancy on how exceptions are handled in Java and in native methods. Unlike exceptions in Java, exceptions raised in the native code through the Java Native Interface (JNI) are not controlled by the Java Virtual Machine (JVM). Only after the native code finishes execution will the JVM's mechanism for exceptions take over. This discrepancy makes handling of JNI exceptions an error prone process and can cause serious security flaws in software written using the JNI."
ACM CCS 2009,A new cell counter based attack against tor.,"Various low-latency anonymous communication systems such as Tor and Anoymizer have been designed to provide anonymity service for users. In order to hide the communication of users, many anonymity systems pack the application data into equal-sized cells (e.g., 512 bytes for Tor, a known real-world, circuit-based low-latency anonymous communication network). In this paper, we investigate a new cell counter based attack against Tor, which allows the attacker to confirm anonymous communication relationship among users very quickly. In this attack, by marginally varying the counter of cells in the target traffic at the malicious exit onion router, the attacker can embed a secret signal into the variation of cell counter of the target traffic. The embedded signal will be carried along with the target traffic and arrive at the malicious entry onion router. Then an accomplice of the attacker at the malicious entry onion router will detect the embedded signal based on the received cells and confirm the communication relationship among users. We have implemented this attack against Tor and our experimental data validate its feasibility and effectiveness. There are several unique features of this attack. First, this attack is highly efficient and can confirm very short communication sessions with only tens of cells. Second, this attack is effective and its detection rate approaches 100% with a very low false positive rate. Third, it is possible to implement the attack in a way that appears to be very difficult for honest participants to detect (e.g. using our hopping-based signal embedding)."
ACM CCS 2009,False data injection attacks against state estimation in electric power grids.,"A power grid is a complex system connecting electric power generators to consumers through power transmission and distribution networks across a large geographical area. System monitoring is necessary to ensure the reliable operation of power grids, and state estimation is used in system monitoring to best estimate the power grid state through analysis of meter measurements and power system models. Various techniques have been developed to detect and identify bad measurements, including the interacting bad measurements introduced by arbitrary, non-random causes. At first glance, it seems that these techniques can also defeat malicious measurements injected by attackers."
ACM CCS 2009,"RFID privacy - relation between two notions, minimal condition, and efficient construction.","Privacy of RFID systems is receiving increasing attention in the RFID community. Basically, there are two kinds of RFID privacy notions: one based on the indistinguishability of two tags, denoted as ind-privacy, and the other based on the unpredictability of the output of a protocol, denoted as unp-privacy. In this paper, the definition of unp-privacy is refined and the relation between the two notions is clarified: it is proven that ind-privacy is weaker than unp-privacy. Moreover, the minimal (necessary and sufficient)condition on RFID tags to achieve unp-privacy is determined. It is shown that if an RFID system has strong (or weak) unp-privacy then the computational power of an RFID tag can be used to construct a pseudorandom function family provided that the RFID system is complete and sound. On the other hand, if each tag is able to compute a pseudorandom function, then the tags can be used to construct an RFID system with strong (or weak) unp-privacy. In this sense, a pseudorandom function family is the minimal requirement on an RFID tag's computational power for enforcing strong RFID system privacy. Finally, a new RFID protocol is proposed to satisfy the minimal requirement, which also outperforms the state-of-the-art RFID protocols in terms of computational cost and communication overhead."
