conference,title,abstract
ACM CCS 2009,Ripley - automatically securing web 2.0 applications through replicated execution.,"Rich Internet applications are becoming increasingly distributed, as demonstrated by the popularity of AJAX or Web 2.0 applications such as Facebook, Google Maps, Hotmail and many others. A typical multi-tier AJAX application consists, at least, of a server-side component implemented in Java J2EE, PHP or ASP.NET and a client-side component running JavaScript. The resulting application is more responsive because computation has moved closer to the client, avoiding unnecessary network round trips for frequent user actions."
ACM CCS 2009,Countering kernel rootkits with lightweight hook protection.,"Kernel rootkits have posed serious security threats due to their stealthy manner. To hide their presence and activities, many rootkits hijack control flows by modifying control data or hooks in the kernel space. A critical step towards eliminating rootkits is to protect such hooks from being hijacked. However, it remains a challenge because there exist a large number of widely-scattered kernel hooks and many of them could be dynamically allocated from kernel heap and co-located together with other kernel data. In addition, there is a lack of flexible commodity hardware support, leading to the socalled protection granularity gap -- kernel hook protection requires byte-level granularity but commodity hardware only provides page level protection."
ACM CCS 2009,Behavior based software theft detection.,"Along with the burst of open source projects, software theft (or plagiarism) has become a very serious threat to the healthiness of software industry. Software birthmark, which represents the unique characteristics of a program, can be used for software theft detection. We propose a system call dependence graph based software birthmark called SCDG birthmark, and examine how well it reflects unique behavioral characteristics of a program. To our knowledge, our detection system based on SCDG birthmark is the first one that is capable of detecting software component theft where only partial code is stolen. We demonstrate the strength of our birthmark against various evasion techniques, including those based on different compilers and different compiler optimization levels as well as two state-of-the-art obfuscation tools. Unlike the existing work that were evaluated through small or toy software, we also evaluate our birthmark on a set of large software. Our results show that SCDG birthmark is very practical and effective in detecting software theft that even adopts advanced evasion techniques."
ACM CCS 2009,Learning your identity and disease from research papers - information leaks in genome wide association study.,"Genome-wide association studies (GWAS) aim at discovering the association between genetic variations, particularly single-nucleotide polymorphism (SNP), and common diseases, which is well recognized to be one of the most important and active areas in biomedical research. Also renowned is the privacy implication of such studies, which has been brought into the limelight by the recent attack proposed by Homer et al. Homer's attack demonstrates that it is possible to identify a GWAS participant from the allele frequencies of a large number of SNPs. Such a threat, unfortunately, was found in our research to be significantly understated. In this paper, we show that individuals can actually be identified from even a relatively small set of statistics, as those routinely published in GWAS papers. We present two attacks. The first one extends Homer's attack with a much more powerful test statistic, based on the correlations among different SNPs described by coefficient of determination (r2). This attack can determine the presence of an individual from the statistics related to a couple of hundred SNPs. The second attack can lead to complete disclosure of hundreds of participants' SNPs, through analyzing the information derived from published statistics. We also found that those attacks can succeed even when the precisions of the statistics are low and part of data is missing. We evaluated our attacks on the real human genomes and concluded that such threats are completely realistic."
ACM CCS 2009,Privacy-preserving genomic computation through program specialization.,"In this paper, we present a new approach to performing important classes of genomic computations (e.g., search for homologous genes) that makes a significant step towards privacy protection in this domain. Our approach leverages a key property of the human genome, namely that the vast majority of it is shared across humans (and hence public), and consequently relatively little of it is sensitive. Based on this observation, we propose a privacy-protection framework that partitions a genomic computation, distributing the part on sensitive data to the data provider and the part on the pubic data to the user of the data. Such a partition is achieved through program specialization that enables a biocomputing program to perform a concrete execution on public data and a symbolic execution on sensitive data. As a result, the program is simplified into an efficient query program that takes only sensitive genetic data as inputs. We prove the effectiveness of our techniques on a set of dynamic programming algorithms common in genomic computing. We develop a program transformation tool that automatically instruments a legacy program for specialization operations. We also demonstrate that our techniques can greatly facilitate secure multi-party computations on large biocomputing problems."
ACM CCS 2009,Feeling-based location privacy protection for location-based services.,"Anonymous location information may be correlated with restricted spaces such as home and office for subject re-identification. This makes it a great challenge to provide location privacy protection for users of location-based services. Existing work adopts traditional K-anonymity model and ensures that each location disclosed in service requests is a spatial region that has been visited by at least K users. This strategy requires a user to specify an appropriate value of K in order to achieve a desired level of privacy protection. This is problematic because privacy is about feeling, and it is awkward for one to scale her feeling using a number. In this paper, we propose a feeling-based privacy model. The model allows a user to express her privacy requirement by specifying a public region, which the user would feel comfortable if the region is reported as her location. The popularity of the public region, measured using entropy based on its visitors' footprints inside it, is then used as the user's desired level of privacy protection. With this model in place, we present a novel technique that allows a user's location information to be reported as accurate as possible while providing her sufficient location privacy protection. The new technique supports trajectory cloaking and can be used in application scenarios where a user needs to make frequent location updates along a trajectory that cannot be predicted. In addition to evaluating the effectiveness of the proposed technique under various conditions through simulation, we have also implemented an experimental system for location privacy-aware uses of location-based services."
ACM CCS 2009,Filter-resistant code injection on ARM.,"Code injections attacks are one of the most powerful and important classes of attacks on software. In such attacks, the attacker sends malicious input to a software application, where it is stored in memory. The malicious input is chosen in such a way that its representation in memory is also a valid representation of a machine code program that performs actions chosen by the attacker. The attacker then triggers a bug in the application to divert the control flow to this injected machine code. A typical action of the injected code is to launch a command interpreter shell, and hence the malicious input is often called shellcode."
conference,title,abstract
ACM CCS 2009,Attacking cryptographic schemes based on &quot;perturbation polynomials&quot;.,"We show attacks on several cryptographic schemes that have recently been proposed for achieving various security goals in sensor networks. Roughly speaking, these schemes all use ""perturbation polynomials"" to add ""noise"" to polynomialbased systems that offer information-theoretic security, in an attempt to increase the resilience threshold while maintaining efficiency. We show that the heuristic security arguments given for these modified schemes do not hold, and that they can be completely broken once we allow even a slight extension of the parameters beyond those achieved by the underlying information-theoretic schemes."
ACM CCS 2009,On achieving good operating points on an ROC plane using stochastic anomaly score prediction.,"ROC curves have historically been used to evaluate the accuracy of Intrusion Detection Systems (IDSs). In this paper, we argue that a real-time IDS' input changes considerably over time and ROC curves generated using fixed, time-invariant classification thresholds do not characterize the best accuracy that an IDS can achieve. To address this problem, we propose a simple, generic and adaptive technique to achieve good ROC operating points for any given IDS. The proposed technique stochastically predicts the next anomaly score of an IDS and the anomaly classification threshold is then set as a function of the predicted score. We first perform statistical and information-theoretic analyses of network- and host-based IDSs' anomaly scores to reveal a consistent time correlation structure during benign activity periods. We model the observed correlation structure using Markov chains and then use this model to predict and adapt an IDS' classification threshold. The proposed adaptive thresholding module is incorporated into six prominent network- and host-based Anomaly Detection Systems (ADSs). These adaptive ADSs are evaluated on public and labeled attack datasets. We show that, while reducing the need for manual threshold configuration and having very low-complexity, adaptive thresholding enables the ADSs to achieve considerably higher accuracies on the ROC plane."
ACM CCS 2009,CoSP - a general framework for computational soundness proofs.,"We describe CoSP, a general framework for conducting computational soundness proofs of symbolic models and for embedding these proofs into formal calculi. CoSP considers arbitrary equational theories and computational implementations, and it abstracts away many details that are not crucial for proving computational soundness, such as message scheduling, corruption models, and even the internal structure of a protocol. CoSP enables soundness results, in the sense of preservation of trace properties, to be proven in a conceptually modular and generic way: proving x cryptographic primitives sound for y calculi only requires x + y proofs (instead of x • y proofs without this framework), and the process of embedding calculi is conceptually decoupled from computational soundness proofs of cryptographic primitives. We exemplify the usefulness of CoSP by proving the first computational soundness result for the full-fledged applied π-calculus under active attacks. Concretely, we embed the applied π-calculus into CoSP and give a sound implementation of public-key encryption and digital signatures."
ACM CCS 2009,An efficient forward private RFID protocol.,"Radio Frequency IDentifiers (RFID) are low-cost pervasive devices used in various settings for identification purposes: although they have originally been introduced to ease the supply chain management, they are already used in many other applications. Some of these applications need secure identification and ad-hoc authentication protocols have to be designed for that purpose. But the intrusion of RFID in the life of end-users might additionally require a higher level of user-privacy. Such security and privacy requirements conflict with the highly constrained environment of RFID systems. Ohkubo, Suzuki, and Kinoshita first proposed an appealing RFID protocol that meets the highest privacy requirements. However, their scheme and its known variants suffer from limitations in terms of computational complexity and provable security which this paper aims to address. We propose a novel forward private authentication scheme built upon less computationally expensive cryptographic ingredients, namely pseudo-random generators and universal hash functions instead of one way hash functions. In contrast with existing schemes, we provide security proofs of our construction in the standard model instead of the random oracle model."
ACM CCS 2009,Anonymous credentials on a standard java card.,"Secure identity tokens such as Electronic Identity (eID) cards are emerging everywhere. At the same time user-centric identity management gains acceptance. Anonymous credential schemes are the optimal realization of user-centricity. However, on inexpensive hardware platforms, typically used for eID cards, these schemes could not be made to meet the necessary requirements such as future-proof key lengths and transaction times on the order of 10 seconds. The reasons for this is the need for the hardware platform to be standardized and certified. Therefore an implementation is only possible as a Java Card applet. This results in severe restrictions: little memory (transient and persistent), an 8-bit CPU, and access to hardware acceleration for cryptographic operations only by defined interfaces such as RSA encryption operations."
ACM CCS 2009,Reactive noninterference.,"Many programs operate reactively--patiently waiting for user input, running for a while producing output, and eventually returning to a state where they are ready to accept another input (or occasionally diverging). When a reactive program communicates with multiple parties, we would like to be sure that it can be given secret information by one without leaking it to others."
ACM CCS 2009,XCS - cross channel scripting and its impact on web applications.,"We study the security of embedded web servers used in consumer electronic devices, such as security cameras and photo frames, and for IT infrastructure, such as wireless access points and lights-out management systems. All the devices we examine turn out to be vulnerable to a variety of web attacks, including cross site scripting (XSS) and cross site request forgery (CSRF). In addition, we show that consumer electronics are particularly vulnerable to a nasty form of persistent XSS where a non-web channel such as NFS or SNMP is used to inject a malicious script. This script is later used to attack an unsuspecting user who connects to the device's web server. We refer to web attacks which are mounted through a non-web channel as cross channel scripting (XCS). We propose a client-side defense against certain XCS which we implement as a browser extension."
ACM CCS 2009,HAIL - a high-availability and integrity layer for cloud storage.,"We introduce HAIL (High-Availability and Integrity Layer), a distributed cryptographic system that allows a set of servers to prove to a client that a stored file is intact and retrievable. HAIL strengthens, formally unifies, and streamlines distinct approaches from the cryptographic and distributed-systems communities. Proofs in HAIL are efficiently computable by servers and highly compact---typically tens or hundreds of bytes, irrespective of file size. HAIL cryptographically verifies and reactively reallocates file shares. It is robust against an active, mobile adversary, i.e., one that may progressively corrupt the full set of servers. We propose a strong, formal adversarial model for HAIL, and rigorous analysis and parameter choices. We show how HAIL improves on the security and efficiency of existing tools, like Proofs of Retrievability (PORs) deployed on individual servers. We also report on a prototype implementation."
ACM CCS 2009,Dispatcher - enabling active botnet infiltration using automatic protocol reverse-engineering.,"Automatic protocol reverse-engineering is important for many security applications, including the analysis and defense against botnets. Understanding the command-and-control (C&C) protocol used by a botnet is crucial for anticipating its repertoire of nefarious activity and to enable active botnet infiltration. Frequently, security analysts need to rewrite messages sent and received by a bot in order to contain malicious activity and to provide the botmaster with an illusion of successful and unhampered operation. To enable such rewriting, we need detailed information about the intent and structure of the messages in both directions of the communication despite the fact that we generally only have access to the implementation of one endpoint, namely the bot binary. Current techniques cannot enable such rewriting. In this paper, we propose techniques to extract the format of protocol messages sent by an application that implements a protocol specification, and to infer the field semantics for messages both sent and received by the application. Our techniques enable applications such as rewriting the C&C messages for active botnet infiltration. We implement our techniques into Dispatcher, a tool to extract the message format and field semantics of both received and sent messages. We use Dispatcher to analyze MegaD, a prevalent spam botnet employing a hitherto undocumented C&C protocol, and show that the protocol information extracted by Dispatcher can be used to rewrite the C&C messages."
ACM CCS 2009,Oblivious transfer with access control.,"We present a protocol for anonymous access to a database where the different records have different access control permissions. These permissions could be attributes, roles, or rights that the user needs to have in order to access the record. Our protocol offers maximal security guarantees for both the database and the user, namely (1) only authorized users can access the record; (2) the database provider does not learn which record the user accesses; and (3) the database provider does not learn which attributes or roles the user has when she accesses the database."
ACM CCS 2009,Mapping kernel objects to enable systematic integrity checking.,"Dynamic kernel data have become an attractive target for kernel-mode malware. However, previous solutions for checking kernel integrity either limit themselves to code and static data or can only inspect a fraction of dynamic data, resulting in limited protection. Our study shows that previous solutions may reach only 28% of the dynamic kernel data and thus may fail to identify function pointers manipulated by many kernel-mode malware."
ACM CCS 2009,On the difficulty of software-based attestation of embedded devices.,"Device attestation is an essential feature in many security protocols and applications. The lack of dedicated hardware and the impossibility to physically access devices to be attested, makes attestation of embedded devices, in applications such as Wireless Sensor Networks, a prominent challenge. Several software-based attestation techniques have been proposed that either rely on tight time constraints or on the lack of free space to store malicious code. This paper investigates the shortcomings of existing software-based attestation techniques. We first present two generic attacks, one based on a return-oriented rootkit} and the other on code compression. We further describe specific attacks on two existing proposals, namely SWATT and ICE-based schemes, and argue about the difficulty of fixing them. All attacks presented in this paper were implemented and validated on commodity sensors."
ACM CCS 2009,Certificateless onion routing.,"Onion routing protocols allow users to establish anonymous channels to preserve their privacy over a public network. Several protocols implementing this primitive have been proposed in recent years, and TOR, a real-life implementation, provides an onion routing service to thousands of users over the internet."
ACM CCS 2009,Improving privacy and security in multi-authority attribute-based encryption.,"Attribute based encryption (ABE) [13] determines decryption ability based on a user's attributes. In a multi-authority ABE scheme, multiple attribute-authorities monitor different sets of attributes and issue corresponding decryption keys to users, and encryptors can require that a user obtain keys for appropriate attributes from each authority before decrypting a message. Chase [5] gave a multi-authority ABE scheme using the concepts of a trusted central authority (CA) and global identifiers (GID). However, the CA in that construction has the power to decrypt every ciphertext, which seems somehow contradictory to the original goal of distributing control over many potentially untrusted authorities. Moreover, in that construction, the use of a consistent GID allowed the authorities to combine their information to build a full profile with all of a user's attributes, which unnecessarily compromises the privacy of the user. In this paper, we propose a solution which removes the trusted central authority, and protects the users' privacy by preventing the authorities from pooling their information on particular users, thus making ABE more usable in practice."
ACM CCS 2009,Multiple password interference in text passwords and click-based graphical passwords.,"The underlying issues relating to the usability and security of multiple passwords are largely unexplored. However, we know that people generally have difficulty remembering multiple passwords. This reduces security since users reuse the same password for different systems or reveal other passwords as they try to log in. We report on a laboratory study comparing recall of multiple text passwords with recall of multiple click-based graphical passwords. In a one-hour session (short-term), we found that participants in the graphical password condition coped significantly better than those in the text password condition. In particular, they made fewer errors when recalling their passwords, did not resort to creating passwords directly related to account names, and did not use similar passwords across multiple accounts. After two weeks, participants in the two conditions had recall success rates that were not statistically different from each other, but those with text passwords made more recall errors than participants with graphical passwords. In our study, click-based graphical passwords were significantly less susceptible to multiple password interference in the short-term, while having comparable usability to text passwords in most other respects."
ACM CCS 2009,Robust signatures for kernel data structures.,"Kernel-mode rootkits hide objects such as processes and threads using a technique known as Direct Kernel Object Manipulation (DKOM). Many forensic analysis tools attempt to detect these hidden objects by scanning kernel memory with handmade signatures; however, such signatures are brittle and rely on non-essential features of these data structures, making them easy to evade. In this paper, we present an automated mechanism for generating signatures for kernel data structures and show that these signatures are robust: attempts to evade the signature by modifying the structure contents will cause the OS to consider the object invalid. Using dynamic analysis, we profile the target data structure to determine commonly used fields, and we then fuzz those fields to determine which are essential to the correct operation of the OS. These fields form the basis of a signature for the data structure. In our experiments, our new signature matched the accuracy of existing scanners for traditional malware and found processes hidden with our prototype rootkit that all current signatures missed. Our techniques significantly increase the difficulty of hiding objects from signature scanning."
ACM CCS 2009,As-awareness in Tor path selection.,"Tor is an anonymous communications network with thousands of router nodes worldwide. An intuition reflected in much of the literature on anonymous communications is that, as an anonymity network grows, it becomes more secure against a given observer because the observer will see less of the network. In particular, as the Tor network grows from volunteers operating relays all over the world, it becomes less and less likely for a single autonomous system (AS) to be able to observe both ends of an anonymous connection. Yet, as the network continues to grow significantly, no analysis has been done to determine if this intuition is correct. Further, modifications to Tor's path selection algorithm to help clients avoid an AS-level observer have not been proposed and analyzed."
