conference,title,abstract
symp2010,Joe-E: A Security-Oriented Subset of Java,"We present Joe-E, a language designed to support thedevelopment of secure software systems. Joe-E is a subsetof Java that makes it easier to architect and implement pro-grams with strong security properties that can be checkedduring a security review. It enables programmers to ap-ply the principle of least privilege to their programs; imple-ment application-specific reference monitors that cannot bebypassed; introduce and use domain-specific security ab-stractions; safely execute and interact with untrusted code;and build secure, extensible systems. Joe-E demonstrateshow it is possible to achieve the strong security propertiesof an object-capability language while retaining the fea-tures and feel of a mainstream object-oriented language.Additionally, we present ways in which Java’s static typesafety complements object-capability analysis and permitsadditional security properties to be verified statically, com-pared with previous object-capability languages which relyon runtime checks. In this paper, we describe the designand implementation of Joe-E and its advantages for secu-rity and auditability over standard Java. We demonstratehow Joe-E can be used to develop systems with novel secu-rity properties that would be difficult or impossible to en-sure otherwise, including a web application platform thatprovides transparent, transactional object persistence andcan safely host multiple mutually-distrustful applications ina single JVM."
symp2010,Preventing Capability Leaks in Secure JavaScript Subsets,"Publishers wish to sandbox third-party advertisementsto protect themselves from malicious advertisements. Onepromising approach, used by ADsafe, Dojo Secure, andJacaranda, sandboxes advertisements by statically verify-ing that their JavaScript conforms to a safe subset of thelanguage. These systems blacklist known dangerous proper-ties that would let advertisements escape the sandbox. Un-fortunately, this approach does not prevent advertisementsfrom accessing new methods added to the built-in prototypeobjects by the hosting page. In this paper, we show that one-third of the Alexa US Top 100 web sites would be exploitableby an ADsafe-verified advertisement. We propose an im-proved statically verified JavaScript subset that whitelistsknown-safe properties using namespaces. Our approachmaintains the expressiveness and performance of static ver-ification while improving security."
symp2010,Binary Code Extraction and Interface Identification for Security Applications,"Binary code reuse is the process of automatically identi-fying the interface and extracting the instructions anddata dependencies of a code fragment from an exe-cutable program, so that it is self-contained and can bereused by external code. Binary code reuse is useful fora number of security applications, including reusing theproprietary cryptographic or unpacking functions froma malware sample and for rewriting a network dialog.In this paper we conduct the first systematic study of au-tomated binary code reuse and its security applications.The main challenge in binary code reuse is under-standing the code fragment’s interface. We propose anovel technique to identify the prototype of an undoc-umented code fragment directly from the program’s bi-nary, without access to source code or symbol informa-tion. Further, we must also extract the code itself fromthe binary so that it is self-contained and can be easilyreused in another program. We design and implement atool that uses a combination of dynamic and static anal-ysis to automatically identify the prototype and extractthe instructions of an assembly function into a form thatcan be reused by other C code. The extracted functioncan be run independently of the rest of the program’sfunctionality and shared with other users.We apply our approach to scenarios that include ex-tracting the encryption and decryption routines frommalware samples, and show that these routines can bereused by a network proxy to decrypt encrypted traf-fic on the network. This allows the network proxy torewrite the malware’s encrypted traffic by combining theextracted encryption and decryption functions with thesession keys and the protocol grammar. We also showthat we can reuse a code fragment from an unpackingfunction for the unpacking routine for a different sampleof the same family, even if the code fragment is not acomplete function."
symp2010,Automatic Reverse Engineering of Data Structures from Binary Execution,"With only the binary executable of a program, it isuseful to discover the program’s data structures and infertheir syntactic and semantic definitions. Such knowledge ishighly valuable in a variety of security and forensic applica-tions. Although there exist efforts in program data structureinference, the existing solutions are not suitable for ourtargeted application scenarios. In this paper, we proposea reverse engineering technique to automatically revealprogram data structures from binaries. Our technique,called REWARDS, is based on dynamic analysis. Morespecifically, each memory location accessed by the programis tagged with a timestamped type attribute. Following theprogram’s runtime data flow, this attribute is propagatedto other memory locations and registers that share thesame type. During the propagation, a variable’s type getsresolved if it is involved in a type-revealing execution pointor “type sink”. More importantly, besides the forwardtype propagation, REWARDS involves a backward typeresolution procedure where the types of some previouslyaccessed variables get recursively resolved starting from atype sink. This procedure is constrained by the timestampsof relevant memory locations to disambiguate variables re-using the same memory location. In addition, REWARDS isable to reconstruct in-memory data structure layout basedon the type information derived. We demonstrate thatREWARDS provides unique benefits to two applications:memory image forensics and binary fuzzing for vulnerabil-ity discovery."
symp2010,Efficient Detection of Split Personalities in Malware,"Malware is the root cause of many security threats onthe Internet. To cope with the thousands of new malwaresamples that are discovered every day, security compa-nies and analysts rely on automated tools to extract theruntime behavior of malicious programs. Of course, mal-ware authors are aware of these tools and increasinglytry to thwart their analysis techniques. To this end, mal-ware code is often equipped with checks that look for ev-idence of emulated or virtualized analysis environments.When such evidence is found, the malware program be-haves differently or crashes, thus showing a different“personality” than on a real system.Recent work has introduced transparent analysis plat-forms (such as Ether or Cobra) that make it signif-icantly more difficult for malware programs to detecttheir presence. Others have proposed techniques to iden-tify and bypass checks introduced by malware authors.Both approaches are often successful in exposing theruntime behavior of malware even when the maliciouscode attempts to thwart analysis efforts. However, thesetechniques induce significant performance overhead, es-pecially for fine-grained analysis. Unfortunately, thismakes them unsuitable for the analysis of current high-volume malware feeds.In this paper, we present a technique that efficientlydetects when a malware program behaves differently inan emulated analysis environment and on an uninstru-mented reference host. The basic idea is simple: we justcompare the runtime behavior of a sample in our anal-ysis system and on a reference machine. However, ob-taining a robust and efficient comparison is very difficult.In particular, our approach consists of recording the in-teractions of the malware with the operating system inone run and using this information to deterministicallyreplay the program in our analysis environment. Our ex-periments demonstrate that, by using our approach, onecan efficiently detect malware samples that use a varietyof techniques to identify emulated analysis environments."
