conference,title,abstract
ACM CCS 2017,Fast Private Set Intersection from Homomorphic Encryption.,"Private Set Intersection (PSI) is a cryptographic technique that allows two parties to compute the intersection of their sets without revealing anything except the intersection. We use fully homomorphic encryption to construct a fast PSI protocol with a small communication overhead that works particularly well when one of the two sets is much smaller than the other, and is secure against semi-honest adversaries."
ACM CCS 2017,PeGaSus - Data-Adaptive Differentially Private Stream Processing.,"Individuals are continually observed by an ever-increasing number of sensors that make up the Internet of Things. The resulting streams of data, which are analyzed in real time, can reveal sensitive personal information about individuals. Hence, there is an urgent need for stream processing solutions that can analyze these data in real time with provable guarantees of privacy and low error."
ACM CCS 2017,Practical Attacks Against Graph-based Clustering.,"Graph modeling allows numerous security problems to be tackled in a general way, however, little work has been done to understand their ability to withstand adversarial attacks. We design and evaluate two novel graph attacks against a state-of-the-art network-level, graph-based detection system. Our work highlights areas in adversarial machine learning that have not yet been addressed, specifically: graph-based clustering techniques, and a global feature space where realistic attackers without perfect knowledge must be accounted for (by the defenders) in order to be practical. Even though less informed attackers can evade graph clustering with low cost, we show that some practical defenses are possible."
ACM CCS 2017,Client-side Name Collision Vulnerability in the New gTLD Era - A Systematic Study.,"The recent unprecedented delegation of new generic top-level domains (gTLDs) has exacerbated an existing, but fallow, problem called name collisions. One concrete exploit of such problem was discovered recently, which targets internal namespaces and enables Man in the Middle (MitM) attacks against end-user devices from anywhere on the Internet. Analysis of the underlying problem shows that it is not specific to any single service protocol, but little attention has been paid to understand the vulnerability status and the defense solution space at the service level. In this paper, we perform the first systematic study of the robustness of internal network services under name collision attacks."
ACM CCS 2017,Mass Discovery of Android Traffic Imprints through Instantiated Partial Execution.,"Monitoring network behaviors of mobile applications, controlling their resource access and detecting potentially harmful apps are becoming increasingly important for the security protection within today's organizational, ISP and carriers. For this purpose, apps need to be identified from their communication, based upon their individual traffic signatures (called imprints in our research). Creating imprints for a large number of apps is nontrivial, due to the challenges in comprehensively analyzing their network activities at a large scale, for millions of apps on today's rapidly-growing app marketplaces. Prior research relies on automatic exploration of an app's user interfaces (UIs) to trigger its network activities, which is less likely to scale given the cost of the operation (at least 5 minutes per app) and its effectiveness (limited coverage of an app's behaviors)."
ACM CCS 2017,Standardizing Bad Cryptographic Practice - A Teardown of the IEEE Standard for Protecting Electronic-design Intellectual Property.,"We provide an analysis of IEEE standard P1735, which describes methods for encrypting electronic-design intellectual property (IP), as well as the management of access rights for such IP. We find a surprising number of cryptographic mistakes in the standard. In the most egregious cases, these mistakes enable attack vectors that allow us to recover the entire underlying plaintext IP. Some of these attack vectors are well-known, e.g. padding-oracle attacks. Others are new, and are made possible by the need to support the typical uses of the underlying IP; in particular, the need for commercial system-on-chip (SoC) tools to synthesize multiple pieces of IP into a fully specified chip design and to provide syntax errors. We exploit these mistakes in a variety of ways, leveraging a commercial SoC tool as a black-box oracle."
ACM CCS 2017,Viden - Attacker Identification on In-Vehicle Networks.,"Various defense schemes --- which determine the presence of an attack on the in-vehicle network --- have recently been proposed. However, they fail to identify which Electronic Control Unit (ECU) actually mounted the attack. Clearly, pinpointing the attacker ECU is essential for fast/efficient forensic, isolation, security patch, etc. To meet this need, we propose a novel scheme, called Viden (Voltage-based attacker identification), which can identify the attacker ECU by measuring and utilizing voltages on the in-vehicle network. The first phase of Viden, called ACK learning, determines whether or not the measured voltage signals really originate from the genuine message transmitter. Viden then exploits the voltage measurements to construct and update the transmitter ECUs' voltage profiles as their fingerprints. It finally uses the voltage profiles to identify the attacker ECU. Since Viden adapts its profiles to changes inside/outside of the vehicle, it can pinpoint the attacker ECU under various conditions. Moreover, its efficiency and design-compliance with modern in-vehicle network implementations make Viden practical and easily deployable. Our extensive experimental evaluations on both a CAN bus prototype and two real vehicles have shown that Viden can accurately fingerprint ECUs based solely on voltage measurements and thus identify the attacker ECU with a low false identification rate of 0.2%."
ACM CCS 2017,Fairness in an Unfair World - Fair Multiparty Computation from Public Bulletin Boards.,"Secure multiparty computation allows mutually distrusting parties to compute a function on their private inputs such that nothing but the function output is revealed. Achieving fairness --- that all parties learn the output or no one does -- is a long studied problem with known impossibility results in the standard model if a majority of parties are dishonest. We present a new model for achieving fairness in MPC against dishonest majority by using public bulletin boards implemented via existing infrastructure such as blockchains or Google's certificate transparency logs. We present both theoretical and practical constructions using either witness encryption or trusted hardware (such as Intel SGX). Unlike previous works that either penalize an aborting party or achieve weaker notions such as $\Delta$-fairness, we achieve complete fairness using existing infrastructure."
ACM CCS 2017,DIFUZE - Interface Aware Fuzzing for Kernel Drivers.,"Device drivers are an essential part in modern Unix-like systems to handle operations on physical devices, from hard disks and printers to digital cameras and Bluetooth speakers. The surge of new hardware, particularly on mobile devices, introduces an explosive growth of device drivers in system kernels. Many such drivers are provided by third-party developers, which are susceptible to security vulnerabilities and lack proper vetting. Unfortunately, the complex input data structures for device drivers render traditional analysis tools, such as fuzz testing, less effective, and so far, research on kernel driver security is comparatively sparse. In this paper, we present DIFUZE, an interface-aware fuzzing tool to automatically generate valid inputs and trigger the execution of the kernel drivers. We leverage static analysis to compose correctly-structured input in the userspace to explore kernel drivers. DIFUZE is fully automatic, ranging from identifying driver handlers, to mapping to device file names, to constructing complex argument instances. We evaluate our approach on seven modern Android smartphones. The results show that DIFUZE can effectively identify kernel driver bugs, and reports 32 previously unknown vulnerabilities, including flaws that lead to arbitrary code execution."
ACM CCS 2017,A Type System for Privacy Properties.,Mature push button tools have emerged for checking trace properties (e.g. secrecy or authentication) of security protocols. The case of indistinguishability-based privacy properties (e.g. ballot privacy or anonymity) is more complex and constitutes an active research topic with several recent propositions of techniques and tools.
ACM CCS 2017,A Comprehensive Symbolic Analysis of TLS 1.3.,"The TLS protocol is intended to enable secure end-to-end communication over insecure networks, including the Internet. Unfortunately, this goal has been thwarted a number of times throughout the protocol's tumultuous lifetime, resulting in the need for a new version of the protocol, namely TLS 1.3. Over the past three years, in an unprecedented joint design effort with the academic community, the TLS Working Group has been working tirelessly to enhance the security of TLS."
ACM CCS 2017,Evading Classifiers by Morphing in the Dark.,"Learning-based systems have been shown to be vulnerable to evasion through adversarial data manipulation. These attacks have been studied under assumptions that the adversary has certain knowledge of either the target model internals, its training dataset or at least classification scores it assigns to input samples. In this paper, we investigate a much more constrained and realistic attack scenario wherein the target classifier is minimally exposed to the adversary, revealing only its final classification decision (e.g., reject or accept an input sample). Moreover, the adversary can only manipulate malicious samples using a blackbox morpher. That is, the adversary has to evade the targeted classifier by morphing malicious samples ""in the dark"". We present a scoring mechanism that can assign a real-value score which reflects evasion progress to each sample based on the limited information available. Leveraging on such scoring mechanism, we propose an evasion method -- EvadeHC? and evaluate it against two PDF malware detectors, namely PDFRate and Hidost. The experimental evaluation demonstrates that the proposed evasion attacks are effective, attaining 100% evasion rate on the evaluation dataset. Interestingly, EvadeHC outperforms the known classifier evasion techniques that operate based on classification scores output by the classifiers. Although our evaluations are conducted on PDF malware classifiers, the proposed approaches are domain agnostic and are of wider application to other learning-based systems."
ACM CCS 2017,Use Privacy in Data-Driven Systems - Theory and Experiments with Machine Learnt Programs.,"This paper presents an approach to formalizing and enforcing a class of use privacy properties in data-driven systems. In contrast to prior work, we focus on use restrictions on proxies (i.e. strong predictors) of protected information types. Our definition relates proxy use to intermediate computations that occur in a program, and identify two essential properties that characterize this behavior: 1) its result is strongly associated with the protected information type in question, and 2) it is likely to causally affect the final output of the program. For a specific instantiation of this definition, we present a program analysis technique that detects instances of proxy use in a model, and provides a witness that identifies which parts of the corresponding program exhibit the behavior. Recognizing that not all instances of proxy use of a protected information type are inappropriate, we make use of a normative judgment oracle that makes this inappropriateness determination for a given witness. Our repair algorithm uses the witness of an inappropriate proxy use to transform the model into one that provably does not exhibit proxy use, while avoiding changes that unduly affect classification accuracy. Using a corpus of social datasets, our evaluation shows that these algorithms are able to detect proxy use instances that would be difficult to find using existing techniques, and subsequently remove them while maintaining acceptable classification performance."
ACM CCS 2017,Keep me Updated - An Empirical Study of Third-Party Library Updatability on Android.,Third-party libraries in Android apps have repeatedly been shown to be hazards to the users' privacy and an amplification of their host apps' attack surface. A particularly aggravating factor to this situation is that the libraries' version included in apps are very often outdated.
ACM CCS 2017,Scaling ORAM for Secure Computation.,"We design and implement a Distributed Oblivious Random Access Memory (DORAM) data structure that is optimized for use in two-party secure computation protocols. We improve upon the access time of previous constructions by a factor of up to ten, their memory overhead by a factor of one hundred or more, and their initialization time by a factor of thousands. We are able to instantiate ORAMs that hold 234 bytes, and perform operations on them in seconds, which was not previously feasible with any implemented scheme."
ACM CCS 2017,"Betrayal, Distrust, and Rationality - Smart Counter-Collusion Contracts for Verifiable Cloud Computing.","Cloud computing has become an irreversible trend. Together comes the pressing need for verifiability, to assure the client the correctness of computation outsourced to the cloud. Existing verifiable computation techniques all have a high overhead, thus if being deployed in the clouds, would render cloud computing more expensive than the on-premises counterpart. To achieve verifiability at a reasonable cost, we leverage game theory and propose a smart contract based solution. In a nutshell, a client lets two clouds compute the same task, and uses smart contracts to stimulate tension, betrayal and distrust between the clouds, so that rational clouds will not collude and cheat. In the absence of collusion, verification of correctness can be done easily by crosschecking the results from the two clouds. We provide a formal analysis of the games induced by the contracts, and prove that the contracts will be effective under certain reasonable assumptions. By resorting to game theory and smart contracts, we are able to avoid heavy cryptographic protocols. The client only needs to pay two clouds to compute in the clear, and a small transaction fee to use the smart contracts. We also conducted a feasibility study that involves implementing the contracts in Solidity and running them on the official Ethereum network."
ACM CCS 2017,TinyOLE - Efficient Actively Secure Two-Party Computation from Oblivious Linear Function Evaluation.,"We introduce a new approach to actively secure two-party computation based on so-called oblivious linear function evaluation (OLE), a natural generalisation of oblivious transfer (OT) and a special case of the notion of oblivious polynomial evaluation introduced by Naor and Pinkas at STOC 1999. OLE works over a finite field F. In an OLE the sender inputs two field elements a ƒ F and b ƒ F, and the receiver inputs a field element x ∈ F and learns only ƒx) = ax + b. Our protocol can evaluate an arithmetic circuit over a finite field F given black-box access to OLE for F. The protocol is unconditionally secure and consumes only a constant number of OLEs per multiplication gate. An OLE over a field F of size O(2κ) be implemented with communication O(κ). This gives a protocol with communication complexity O(C κ) for large enough fields, where C is an arithmetic circuit computing the desired function."
ACM CCS 2017,DeepLog - Anomaly Detection and Diagnosis from System Logs through Deep Learning.,"Anomaly detection is a critical step towards building a secure and trustworthy system. The primary purpose of a system log is to record system states and significant events at various critical points to help debug system failures and perform root cause analysis. Such log data is universally available in nearly all computer systems. Log data is an important and valuable resource for understanding system status and performance issues; therefore, the various system logs are naturally excellent source of information for online monitoring and anomaly detection. We propose DeepLog, a deep neural network model utilizing Long Short-Term Memory (LSTM), to model a system log as a natural language sequence. This allows DeepLog to automatically learn log patterns from normal execution, and detect anomalies when log patterns deviate from the model trained from log data under normal execution. In addition, we demonstrate how to incrementally update the DeepLog model in an online fashion so that it can adapt to new log patterns over time. Furthermore, DeepLog constructs workflows from the underlying system log so that once an anomaly is detected, users can diagnose the detected anomaly and perform root cause analysis effectively. Extensive experimental evaluations over large log data have shown that DeepLog has outperformed other existing log-based anomaly detection methods based on traditional data mining methodologies."
ACM CCS 2017,Identifying Open-Source License Violation and 1-day Security Risk at Large Scale.,"With millions of apps available to users, the mobile app market is rapidly becoming very crowded. Given the intense competition, the time to market is a critical factor for the success and profitability of an app. In order to shorten the development cycle, developers often focus their efforts on the unique features and workflows of their apps and rely on third-party Open Source Software (OSS) for the common features. Unfortunately, despite their benefits, careless use of OSS can introduce significant legal and security risks, which if ignored can not only jeopardize security and privacy of end users, but can also cause app developers high financial loss. However, tracking OSS components, their versions, and interdependencies can be very tedious and error-prone, particularly if an OSS is imported with little to no knowledge of its provenance."
ACM CCS 2017,Side-Channel Attacks on BLISS Lattice-Based Signatures - Exploiting Branch Tracing against strongSwan and Electromagnetic Emanations in Microcontrollers.,"In this paper, we investigate the security of the BLISS lattice-based signature scheme, one of the most promising candidates for postquantum-secure signatures, against side-channel attacks. Several works have been devoted to its efficient implementation on various platforms, from desktop CPUs to microcontrollers and FPGAs, and more recent papers have also considered its security against certain types of physical attacks, notably fault injection and cache attacks. We turn to more traditional side-channel analysis, and describe several attacks that can yield a full key recovery."
ACM CCS 2017,Distributed Measurement with Private Set-Union Cardinality.,"This paper introduces a cryptographic protocol for efficiently aggregating a count of unique items across a set of data parties privately - that is, without exposing any information other than the count. Our protocol allows for more secure and useful statistics gathering in privacy-preserving distributed systems such as anonymity networks; for example, it allows operators of anonymity networks such as Tor to securely answer the questions: how many unique users are using the distributed service? and how many hidden services are being accessed?. We formally prove the correctness and security of our protocol in the Universal Composability framework against an active adversary that compromises all but one of the aggregation parties. We also show that the protocol provides security against adaptive corruption of the data parties, which prevents them from being victims of targeted compromise. To ensure safe measurements, we also show how the output can satisfy differential privacy."
ACM CCS 2017,Verifying Security Policies in Multi-agent Workflows with Loops.,"We consider the automatic verification of information flow security policies of web-based workflows, such as conference submission systems like EasyChair. Our workflow description language allows for loops, non-deterministic choice, and an unbounded number of participating agents. The information flow policies are specified in a temporal logic for hyperproperties. We show that the verification problem can be reduced to the satisfiability of a formula of first-order linear-time temporal logic, and provide decidability results for relevant classes of workflows and specifications. We report on experimental results obtained with an implementation of our approach on a series of benchmarks."
ACM CCS 2017,IRON - Functional Encryption using Intel SGX.,"Functional encryption (FE) is an extremely powerful cryptographic mechanism that lets an authorized entity compute on encrypted data, and learn the results in the clear. However, all current cryptographic instantiations for general FE are too impractical to be implemented. We construct IRON, a provably secure, and practical FE system using Intel's recent Software Guard Extensions (SGX). We show that IRON can be applied to complex functionalities, and even for simple functions, outperforms the best known cryptographic schemes. We argue security by modeling FE in the context of hardware elements, and prove that IRON satisfies the security model."
ACM CCS 2017,JITGuard - Hardening Just-in-time Compilers with SGX.,"Memory-corruption vulnerabilities pose a serious threat to modern computer security. Attackers exploit these vulnerabilities to manipulate code and data of vulnerable applications to generate malicious behavior by means of code-injection and code-reuse attacks. Researchers already demonstrated the power of data-only attacks by disclosing secret data such as cryptographic keys in the past. A large body of literature has investigated defenses against code-injection, code-reuse, and data-only attacks. Unfortunately, most of these defenses are tailored towards statically generated code and their adaption to dynamic code comes with the price of security or performance penalties. However, many common applications, like browsers and document viewers, embed just-in-time compilers to generate dynamic code. The contribution of this paper is twofold: first, we propose a generic data-only attack against JIT compilers, dubbed DOJITA. In contrast to previous data-only attacks that aimed at disclosing secret data, DOJITA enables arbitrary code-execution. Second, we propose JITGuard, a novel defense to mitigate code-injection, code-reuse, and data-only attacks against just-in-time compilers (including DOJITA). JITGuard utilizes Intel's Software Guard Extensions (SGX) to provide a secure environment for emitting the dynamic code to a secret region, which is only known to the JIT compiler, and hence, inaccessible to the attacker. Our proposal is the first solution leveraging SGX to protect the security critical JIT compiler operations, and tackles a number of difficult challenges. As proof of concept we implemented JITGuard for Firefox's JIT compiler SpiderMonkey. Our evaluation shows reasonable overhead of 9.8% for common benchmarks."
ACM CCS 2017,Quantifying the Pressure of Legal Risks on Third-party Vulnerability Research.,"Product vendors and vulnerability researchers work with the same underlying artifacts, but can be motivated by goals that are distinct and, at times, disjoint. This potential for conflict, coupled with the legal instruments available to product vendors (e.g., EULAs, DMCA, CFAA, etc.) drive a broad concern that there are ""chilling effects"" that dissuade vulnerability researchers from vigorously evaluating product security. Indeed, there are well-known examples of legal action taken against individual researchers. However, these are inherently anecdotal in nature and skeptics of the chilling-effects hypothesis argue that there is no systematic evidence to justify such concerns. This paper is motivated by precisely this tussle. We present some of the first work to address this issue on a quantitative and empirical footing, illuminating the sentiments of both product vendors and vulnerability researchers. First, we canvas a range of product companies for explicit permission to conduct security assessments and thus characterize the degree to which the broad software vendor community is supportive of vulnerability research activities and how this varies based on the nature of the researcher. Second, we conduct an online sentiment survey of vulnerability researchers to understand the extent to which they have abstract concerns or concrete experience with legal threats and the extent to which this mindset shapes their choices."
ACM CCS 2017,May the Fourth Be With You - A Microarchitectural Side Channel Attack on Several Real-World Applications of Curve25519.,"In recent years, applications increasingly adopt security primitives designed with better countermeasures against side channel attacks. A concrete example is Libgcrypt's implementation of ECDH encryption with Curve25519. The implementation employs the Montgomery ladder scalar-by-point multiplication, uses the unified, branchless Montgomery double-and-add formula and implements a constant-time argument swap within the ladder. However, Libgcrypt's field arithmetic operations are not implemented in a constant-time side-channel-resistant fashion."
