conference,title,abstract
ACM CCS 2017,No-Match Attacks and Robust Partnering Definitions - Defining Trivial Attacks for Security Protocols is Not Trivial.,"An essential cornerstone of the definition of security for key exchange protocols is the notion of partnering. The de-facto standard definition of partnering is that of (partial) matching conversations (MC), which essentially states that two processes are partnered if every message sent by the first is actually received by the second and vice versa. We show that proving security under MC-based definitions is error-prone. To this end, we introduce no-match attacks, a new class of attacks that renders many existing security proofs invalid. We show that no-match attacks are often hard to avoid in MC-based security definitions without a) modifications of the original protocol or b) resorting to the use of cryptographic primitives with special properties. Finally, we show several ways to thwart no-match attacks. Most notably and as one of our major contributions, we provide a conceptually new definition of partnering that circumvents the problems of a MC-based partnering notion while preserving all its advantages. Our new notion of partnering not only makes security definitions for key exchange model practice much more closely. In contrast to many other security notions of key exchange it also adheres to the high standards of good cryptographic definitions: it is general, supports cryptographic intuition, allows for efficient falsification, and provides a fundamental composition property that MC-based notions lack."
ACM CCS 2017,Unleashing the Walking Dead - Understanding Cross-App Remote Infections on Mobile WebViews.,"As a critical feature for enhancing user experience, cross-app URL invocation has been reported to cause unauthorized execution of app components. Although protection has already been put in place, little has been done to understand the security risks of navigating an app's WebView through an URL, a legitimate need for displaying the app's UI during cross-app interactions. In our research, we found that the current design of such cross-WebView navigation actually opens the door to a cross-app remote infection, allowing a remote adversary to spread malicious web content across different apps' WebView instances and acquire stealthy and persistent control of these apps. This new threat, dubbed Cross-App WebView Infection (XAWI), enables a series of multi-app, colluding attacks never thought before, with significant real world impacts. Particularly, we found that the remote adversary can collectively utilize multiple infected apps' individual capabilities to escalate his privileges on a mobile device or orchestrate a highly realistic remote Phishing attack (e.g., running a malicious script in Chrome to stealthily change Twitter's WebView to fake Twitter's own login UI). We show that the adversary can easily find such attack ""building blocks"" (popular apps whose WebViews can be redirected by another app) through an automatic fuzz, and discovered about 7.4% of the most popular apps subject to the XAWI attacks, including Facebook, Twitter, Amazon and others. Our study reveals the contention between the demand for convenient cross-WebView communication and the need for security control on the channel, and makes the first step toward building OS-level protection to safeguard this fast-growing technology."
ACM CCS 2017,A Framework for Constructing Fast MPC over Arithmetic Circuits with Malicious Adversaries and an Honest-Majority.,"Protocols for secure multiparty computation enable a set of parties to compute a function of their inputs without revealing anything but the output. The security properties of the protocol must be preserved in the presence of adversarial behavior. The two classic adversary models considered are semi-honest (where the adversary follows the protocol specification but tries to learn more than allowed by examining the protocol transcript) and malicious (where the adversary may follow any arbitrary attack strategy). Protocols for semi-honest adversaries are often far more efficient, but in many cases the security guarantees are not strong enough."
ACM CCS 2017,Oblivious Neural Network Predictions via MiniONN Transformations.,"Machine learning models hosted in a cloud service are increasingly popular but risk privacy: clients sending prediction requests to the service need to disclose potentially sensitive information. In this paper, we explore the problem of privacy-preserving predictions: after each prediction, the server learns nothing about clients' input and clients learn nothing about the model."
ACM CCS 2017,Don&apos;t Let One Rotten Apple Spoil the Whole Barrel - Towards Automated Detection of Shadowed Domains.,"Domain names have been exploited for illicit online activities for decades. In the past, miscreants mostly registered new domains for their attacks. However, the domains registered for malicious purposes can be deterred by existing reputation and blacklisting systems. In response to the arms race, miscreants have recently adopted a new strategy, called domain shadowing, to build their attack infrastructures. Specifically, instead of registering new domains, miscreants are beginning to compromise legitimate ones and spawn malicious subdomains under them. This has rendered almost all existing countermeasures ineffective and fragile because subdomains inherit the trust of their apex domains, and attackers can virtually spawn an infinite number of shadowed domains."
ACM CCS 2017,PtrSplit - Supporting General Pointers in Automatic Program Partitioning.,"Partitioning a security-sensitive application into least-privileged components and putting each into a separate protection domain have long been a goal of security practitioners and researchers. However, a stumbling block to automatically partitioning C/C++ applications is the presence of pointers in these applications. Pointers make calculating data dependence, a key step in program partitioning, difficult and hard to scale; furthermore, C/C++ pointers do not carry bounds information, making it impossible to automatically marshall and unmarshall pointer data when they are sent across the boundary of partitions. In this paper, we propose a set of techniques for supporting general pointers in automatic program partitioning. Our system, called PtrSplit, constructs a Program Dependence Graph (PDG) for tracking data and control dependencies in the input program and employs a parameter-tree approach for representing data of pointer types; this approach is modular and avoids global pointer analysis. Furthermore, it performs selective pointer bounds tracking to enable automatic marshalling/unmarshalling of pointer data, even when there is circularity and arbitrary aliasing. As a result, PtrSplit can automatically generate executable partitions for C applications that contain arbitrary pointers."
ACM CCS 2017,VibWrite - Towards Finger-input Authentication on Ubiquitous Surfaces via Physical Vibration.,"The goal of this work is to enable user authentication via finger inputs on ubiquitous surfaces leveraging low-cost physical vibration. We propose VibWrite that extends finger-input authentication beyond touch screens to any solid surface for smart access systems (e.g., access to apartments, vehicles or smart appliances). It integrates passcode, behavioral and physiological characteristics, and surface dependency together to provide a low-cost, tangible and enhanced security solution. VibWrite builds upon a touch sensing technique with vibration signals that can operate on surfaces constructed from a broad range of materials. It is significantly different from traditional password-based approaches, which only authenticate the password itself rather than the legitimate user, and the behavioral biometrics-based solutions, which usually involve specific or expensive hardware (e.g., touch screen or fingerprint reader), incurring privacy concerns and suffering from smudge attacks. VibWrite is based on new algorithms to discriminate fine-grained finger inputs and supports three independent passcode secrets including PIN number, lock pattern, and simple gestures by extracting unique features in the frequency domain to capture both behavioral and physiological characteristics such as contacting area, touching force, and etc. VibWrite is implemented using a single pair of low-cost vibration motor and receiver that can be easily attached to any surface (e.g., a door panel, a desk or an appliance). Our extensive experiments demonstrate that VibWrite can authenticate users with high accuracy (e.g., over 95% within two trials), low false positive rate (e.g., less 3%) and is robust to various types of attacks."
ACM CCS 2017,Hindsight - Understanding the Evolution of UI Vulnerabilities in Mobile Browsers.,"Much of recent research on mobile security has focused on malicious applications. Although mobile devices have powerful browsers that are commonly used by users and are vulnerable to at least as many attacks as their desktop counterparts, mobile web security has not received the attention that it deserves from the community. In particular, there is no longitudinal study that investigates the evolution of mobile browser vulnerabilities over the diverse set of browsers that are available out there. In this paper, we undertake the first such study, focusing on UI vulnerabilities among mobile browsers. We investigate and quantify vulnerabilities to 27 UI-related attacks---compiled from previous work and augmented with new variations of our own---across 128 browser families and 2,324 individual browser versions spanning a period of more than 5 years. In the process, we collect an extensive dataset of browser versions, old and new, from multiple sources. We also design and implement a browser-agnostic testing framework, called Hindsight, to automatically expose browsers to attacks and evaluate their vulnerabilities. We use Hindsight to conduct the tens of thousands of individual attacks that were needed for this study. We discover that 98.6% of the tested browsers are vulnerable to at least one of our attacks and that the average mobile web browser is becoming less secure with each passing year. Overall, our findings support the conclusion that mobile web security has been ignored by the community and must receive more attention."
ACM CCS 2017,Concurrency and Privacy with Payment-Channel Networks.,"Permissionless blockchains protocols such as Bitcoin are inherently limited in transaction throughput and latency. Current efforts to address this key issue focus on off-chain payment channels that can be combined in a Payment-Channel Network (PCN) to enable an unlimited number of payments without requiring to access the blockchain other than to register the initial and final capacity of each channel. While this approach paves the way for low latency and high throughput of payments, its deployment in practice raises several privacy concerns as well as technical challenges related to the inherently concurrent nature of payments that have not been sufficiently studied so far. In this work, we lay the foundations for privacy and concurrency in PCNs, presenting a formal definition in the Universal Composability framework as well as practical and provably secure solutions. In particular, we present Fulgor and Rayo. Fulgor is the first payment protocol for PCNs that provides provable privacy guarantees for PCNs and is fully compatible with the Bitcoin scripting system. However, Fulgor is a blocking protocol and therefore prone to deadlocks of concurrent payments as in currently available PCNs. Instead, Rayo is the first protocol for PCNs that enforces non-blocking progress (i.e., at least one of the concurrent payments terminates). We show through a new impossibility result that non-blocking progress necessarily comes at the cost of weaker privacy. At the core of Fulgor and Rayo is Multi-Hop HTLC, a new smart contract, compatible with the Bitcoin scripting system, that provides conditional payments while reducing running time and communication overhead with respect to previous approaches. Our performance evaluation of Fulgor and Rayo shows that a payment with 10 intermediate users takes as few as 5 seconds, thereby demonstrating their feasibility to be deployed in practice."
ACM CCS 2017,A Touch of Evil - High-Assurance Cryptographic Hardware from Untrusted Components.,"The semiconductor industry is fully globalized and integrated circuits (ICs) are commonly defined, designed and fabricated in different premises across the world. This reduces production costs, but also exposes ICs to supply chain attacks, where insiders introduce malicious circuitry into the final products. Additionally, despite extensive post-fabrication testing, it is not uncommon for ICs with subtle fabrication errors to make it into production systems. While many systems may be able to tolerate a few byzantine components, this is not the case for cryptographic hardware, storing and computing on confidential data. For this reason, many error and backdoor detection techniques have been proposed over the years. So far all attempts have been either quickly circumvented, or come with unrealistically high manufacturing costs and complexity."
ACM CCS 2017,MagNet - A Two-Pronged Defense against Adversarial Examples.,"Deep learning has shown impressive performance on hard perceptual problems. However, researchers found deep learning systems to be vulnerable to small, specially crafted perturbations that are imperceptible to humans. Such perturbations cause deep learning systems to mis-classify adversarial examples, with potentially disastrous consequences where safety or security is crucial. Prior defenses against adversarial examples either targeted specific attacks or were shown to be ineffective."
ACM CCS 2017,SafeConfig&apos;17 - Applying the Scientific Method to Active Cyber Defense Research.,The focus of this workshop is the application of scientific practices to cyber security research. The objective of this workshop is examine the implementation of science practices in cyber defense research and understand the ramification of tradeoffs between simplifications to obtain interpretable results vs. observational studies of systems in the wild where the results can lead to ambiguous interpretations. The research papers accepted addressed a wide variety of technical questions in the cyber domain and the maturity of the work spanned the range of initial ideas and proofs of concept to mature work that is ready for operational implementation. Papers were evaluated for the reproducibility of the work as represented by the documentation of methods and testing environments.
ACM CCS 2017,Why Do Developers Get Password Storage Wrong? - A Qualitative Usability Study.,"Passwords are still a mainstay of various security systems, as well as the cause of many usability issues. For end-users, many of these issues have been studied extensively, highlighting problems and informing design decisions for better policies and motivating research into alternatives. However, end-users are not the only ones who have usability problems with passwords! Developers who are tasked with writing the code by which passwords are stored must do so securely. Yet history has shown that this complex task often fails due to human error with catastrophic results. While an end-user who selects a bad password can have dire consequences, the consequences of a developer who forgets to hash and salt a password database can lead to far larger problems. In this paper we present a first qualitative usability study with 20 computer science students to discover how developers deal with password storage and to inform research into aiding developers in the creation of secure password systems."
ACM CCS 2017,Compressive Traffic Analysis - A New Paradigm for Scalable Traffic Analysis.,"Traffic analysis is the practice of inferring sensitive information from communication patterns, particularly packet timings and packet sizes. Traffic analysis is increasingly becoming relevant to security and privacy with the growing use of encryption and other evasion techniques that render content-based analysis of network traffic impossible. The literature has investigated traffic analysis for various application scenarios, from tracking stepping stone cybercriminals to compromising anonymity systems."
ACM CCS 2017,The Waterfall of Liberty - Decoy Routing Circumvention that Resists Routing Attacks.,"Decoy routing is an emerging approach for censorship circumvention in which circumvention is implemented with help from a number of volunteer Internet autonomous systems, called decoy ASes. Recent studies on decoy routing consider all decoy routing systems to be susceptible to a fundamental attack -- regardless of their specific designs--in which the censors re-route traffic around decoy ASes, thereby preventing censored users from using such systems. In this paper, we propose a new architecture for decoy routing that, by design, is significantly stronger to rerouting attacks compared to all previous designs. Unlike previous designs, our new architecture operates decoy routers only on the downstream traffic of the censored users; therefore we call it downstream-only decoy routing. As we demonstrate through Internet-scale BGP simulations, downstream-only decoy routing offers significantly stronger resistance to rerouting attacks, which is intuitively because a (censoring) ISP has much less control on the downstream BGP routes of its traffic."
ACM CCS 2017,The Return of Coppersmith&apos;s Attack - Practical Factorization of Widely Used RSA Moduli.,"We report on our discovery of an algorithmic flaw in the construction of primes for RSA key generation in a widely-used library of a major manufacturer of cryptographic hardware. The primes generated by the library suffer from a significant loss of entropy. We propose a practical factorization method for various key lengths including 1024 and 2048 bits. Our method requires no additional information except for the value of the public modulus and does not depend on a weak or a faulty random number generator. We devised an extension of Coppersmith's factorization attack utilizing an alternative form of the primes in question. The library in question is found in NIST FIPS 140-2 and CC~EAL~5+ certified devices used for a wide range of real-world applications, including identity cards, passports, Trusted Platform Modules, PGP and tokens for authentication or software signing. As the relevant library code was introduced in 2012 at the latest (and probably earlier), the impacted devices are now widespread. Tens of thousands of such keys were directly identified, many with significant impacts, especially for electronic identity documents, software signing, Trusted Computing and PGP. We estimate the number of affected devices to be in the order of at least tens of millions."
ACM CCS 2017,A Stitch in Time - Supporting Android Developers in WritingSecure Code.,"Despite security advice in the official documentation and an extensive body of security research about vulnerabilities and exploits, many developers still fail to write secure Android applications. Frequently, Android developers fail to adhere to security best practices, leaving applications vulnerable to a multitude of attacks. We point out the advantage of a low-time-cost tool both to teach better secure coding and to improve app security. Using the FixDroid IDE plug-in, we show that professional and hobby app developers can work with and learn from an in-environment tool without it impacting their normal work; and by performing studies with both students and professional developers, we identify key UI requirements and demonstrate that code delivered with such a tool by developers previously inexperienced in security contains significantly less security problems. Perfecting and adding such tools to the Android development environment is an essential step in getting both security and privacy for the next generation of apps."
ACM CCS 2017,POISED - Spotting Twitter Spam Off the Beaten Paths.,"Cybercriminals have found in online social networks a propitious medium to spread spam and malicious content. Existing techniques for detecting spam include predicting the trustworthiness of accounts and analyzing the content of these messages. However, advanced attackers can still successfully evade these defenses."
ACM CCS 2017,How Unique is Your .onion? - An Analysis of the Fingerprintability of Tor Onion Services.,"Recent studies have shown that Tor onion (hidden) service websites are particularly vulnerable to website fingerprinting attacks due to their limited number and sensitive nature. In this work we present a multi-level feature analysis of onion site fingerprintability, considering three state-of-the-art website fingerprinting methods and 482 Tor onion services, making this the largest analysis of this kind completed on onion services to date."
ACM CCS 2017,Back to the Drawing Board - Revisiting the Design of Optimal Location Privacy-preserving Mechanisms.,"In the last years we have witnessed the appearance of a variety of strategies to design optimal location privacy-preserving mechanisms, in terms of maximizing the adversary's expected error with respect to the users' whereabouts. In this work, we take a closer look at the defenses created by these strategies and show that, even though they are indeed optimal in terms of adversary's correctness, not all of them offer the same protection when looking at other dimensions of privacy. To avoid ""bad"" choices, we argue that the search for optimal mechanisms must be guided by complementary criteria. We provide two example auxiliary metrics that help in this regard: the conditional entropy, that captures an information-theoretic aspect of the problem; and the worst-case quality loss, that ensures that the output of the mechanism always provides a minimum utility to the users. We describe a new mechanism that maximizes the conditional entropy and is optimal in terms of average adversary error, and compare its performance with previously proposed optimal mechanisms using two real datasets. Our empirical results confirm that no mechanism fares well on every privacy criteria simultaneously, making apparent the need for considering multiple privacy dimensions to have a good understanding of the privacy protection a mechanism provides."
ACM CCS 2017,Let&apos;s Go in for a Closer Look - Observing Passwords in Their Natural Habitat.,"Text passwords---a frequent vector for account compromise, yet still ubiquitous---have been studied for decades by researchers attempting to determine how to coerce users to create passwords that are hard for attackers to guess but still easy for users to type and memorize. Most studies examine one password or a small number of passwords per user, and studies often rely on passwords created solely for the purpose of the study or on passwords protecting low-value accounts. These limitations severely constrain our understanding of password security in practice, including the extent and nature of password reuse, password behaviors specific to categories of accounts (e.g., financial websites), and the effect of password managers and other privacy tools."
ACM CCS 2017,Deemon - Detecting CSRF with Dynamic Analysis and Property Graphs.,"Cross-Site Request Forgery (CSRF) vulnerabilities are a severe class of web vulnerabilities that have received only marginal attention from the research and security testing communities. While much effort has been spent on countermeasures and detection of XSS and SQLi, to date, the detection of CSRF vulnerabilities is still performed predominantly manually."
ACM CCS 2017,To BLISS-B or not to be - Attacking strongSwan&apos;s Implementation of Post-Quantum Signatures.,"In the search for post-quantum secure alternatives to RSA and ECC, lattice-based cryptography appears to be an attractive and efficient option. A particularly interesting lattice-based signature scheme is BLISS, offering key and signature sizes in the range of RSA moduli. A range of works on efficient implementations of BLISS is available, and the scheme has seen a first real-world adoption in strongSwan, an IPsec-based VPN suite. In contrast, the implementation-security aspects of BLISS, and lattice-based cryptography in general, are still largely unexplored."
ACM CCS 2017,SlowFuzz - Automated Domain-Independent Detection of Algorithmic Complexity Vulnerabilities.,"Algorithmic complexity vulnerabilities occur when the worst-case time/space complexity of an application is significantly higher than the respective average case for particular user-controlled inputs. When such conditions are met, an attacker can launch Denial-of-Service attacks against a vulnerable application by providing inputs that trigger the worst-case behavior. Such attacks have been known to have serious effects on production systems, take down entire websites, or lead to bypasses of Web Application Firewalls."
