conference,title,abstract
ACM CCS 2010,BLADE - an attack-agnostic approach for preventing drive-by malware infections.,"Web-based surreptitious malware infections (i.e., drive-by downloads) have become the primary method used to deliver malicious software onto computers across the Internet. To address this threat, we present a browser independent operating system kernel extension designed to eliminate driveby malware installations. The BLADE (Block All Drive-by download Exploits) system asserts that all executable files delivered through browser downloads must result from explicit user consent and transparently redirects every unconsented browser download into a nonexecutable secure zone of disk. BLADE thwarts the ability of browser-based exploits to surreptitiously download and execute malicious content by remapping to the file system only those browser downloads to which a programmatically inferred user-consent is correlated, BLADE provides its protection without explicit knowledge of any exploits and is thus resilient against code obfuscation and zero-day threats that directly contribute to the pervasiveness of today's drive-by malware. We present the design of our BLADE prototype implementation for the Microsoft Windows platform, and report results from as extensive empirical evaluation of its effectiveness on popular browsers. Our evaluation includes multiple versions of IE and Firefox, against 1,934 active malicious URLs, representing a broad spectrum of web-based exploits not plaguing the Internet. BLADE successfully blocked all drive-by malware install attempts with zero false positives and a 3% worst-case performance cost."
ACM CCS 2010,On the soundness of authenticate-then-encrypt - formalizing the malleability of symmetric encryption.,"A communication channel from an honest sender A to an honest receiver B can be described as a system with three interfaces labeled A, B, and E (the adversary), respectively, where the security properties of the channel are characterized by the capabilities provided at the E-interface."
ACM CCS 2010,Protecting location privacy against inference attacks.,"GPS-enabled mobile devices are a quickly growing market and users are starting to share their location information with each other through services such as Google Latitude. Location information, however, is very privacy-sensitive since it can be used to infer activities, preferences, relationships, and other personal information, and thus access to it must be carefully protected. We provide a formal definition of location privacy that incorporates an adversary's ability to predict location and discuss possible implementation of access control mechanisms that satisfy this definition. To support our reasoning, we analyze a preliminary data set to evaluate the accuracy of location prediction."
ACM CCS 2010,Abstraction by set-membership - verifying security protocols and web services with databases.,"The abstraction and over-approximation of protocols and web services by a set of Horn clauses is a very successful method in practice. It has however limitations for protocols and web services that are based on databases of keys, contracts, or even access rights, where revocation is possible, so that the set of true facts does not monotonically grow with state transitions. We extend the scope of these over-approximation methods by defining a new way of abstraction that can handle such databases, and we formally prove that the abstraction is sound. We realize a translator from a convenient specification language to standard Horn clauses and use the verifier ProVerif and the theorem prover SPASS to solve them. We show by a number of examples that this approach is practically feasible for wide variety of verification problems of security protocols and web services"
ACM CCS 2010,Designs to account for trust in social network-based sybil defenses.,"Social network-based Sybil defenses exploit the trust exhibited in social graphs to detect Sybil nodes that disrupt an algorithmic property (i.e., the fast mixing) in these graphs. The performance of these defenses depends on the quality of the algorithmic property and assuming a strong trust model in the underlying graph. While it is natural to think of trust value associated with the social graphs, Sybil defenses have used the social graphs without this consideration. In this paper we study paramagnetic designs to tune the performance of Sybil defenses by accounting for trust in social graphs and modeling the trust as modified random walks. Our designs are motivated by the observed relationship between the algorithmic property required for the defenses to perform well and a hypothesized trust value in the underlying graphs."
ACM CCS 2010,"Secure encounter-based social networks - requirements, challenges, and designs.","In this paper we outline requirements, challenges, and designs for encounter-based mobile social networks, where relationships are based on a temporarily shared location. To illustrate the challenges we examine a recently proposed design, SMILE, against a set of functional and security requirements. We show that SMILE is vulnerable to several attacks such as impersonation, collusion, and privacy breaching, even though it was built with the explicit goal of resisting some of those attacks. With this in mind, we construct a flexible framework for secure mobile social networks, and describe how to use it in order to construct several networks which offer somewhat different security properties. Each of the designs is then examined against the ideal requirements where some are shown to outperform previous work."
ACM CCS 2010,DieHarder - securing the heap.,"Heap-based attacks depend on a combination of memory management error and an exploitable memory allocator. Many allocators include ad hoc countermeasures against particular exploits but their effectiveness against future exploits has been uncertain. This paper presents the first formal treatment of the impact of allocator design on security. It analyzes a range of widely-deployed memory allocators, including those used by Windows, Linux, FreeBSD and OpenBSD, and shows that they remain vulnerable to attack. It them presents DieHarder, a new allocator whose design was guided by this analysis. DieHarder provides the highest degree of security from heap-based attacks of any practical allocator of which we are aware while imposing modest performance overhead. In particular, the Firefox web browser runs as fast with DieHarder as with the Linux allocator."
ACM CCS 2010,Secure online banking on untrusted computers.,"Frauds and attacks for online banking are increasing quickly. The major platform for current online banking, personal computer, has become untrusted especially under malware attacks. In this study, we design a smart card-based solution called secure online banking companion (SOBC) to address this problem. Portability and cost are also highly considered in the design. We have implemented a prototype of the solution on a Java Card simulator, which shows the solution can be implemented easily using current smart card technologies."
ACM CCS 2010,iFriendU - leveraging 3-cliques to enhance infiltration attacks in online social networks.,"Online Social Networks (OSNs) such as Facebook have become ubiquitous in the past few years, counting hundreds of millions of people as members. OSNs allow users to form friendship relationships, join groups, communicate and share information with friends. The tremendous popularity of OSNs has naturally made them an appealing target for privacy compromising attacks. In this abstract we propose a novel attack against tightly knit OSN communities. Such (artificial) communities consist of users that know well each other and that are reluctant to accept other users as friends. Becoming a member of such a community may be only a first milestone for the attacker. Harvesting private information of members of such communities and following up with offline attacks may be the longer term benefit."
ACM CCS 2010,Modeling attacks on physical unclonable functions.,"We show in this paper how several proposed Physical Unclonable Functions (PUFs) can be broken by numerical modeling attacks. Given a set of challenge-response pairs (CRPs) of a PUF, our attacks construct a computer algorithm which behaves indistinguishably from the original PUF on almost all CRPs. This algorithm can subsequently impersonate the PUF, and can be cloned and distributed arbitrarily. This breaks the security of essentially all applications and protocols that are based on the respective PUF. The PUFs we attacked successfully include standard Arbited PUFs and Ring Oscillator PUFs of arbitrary sizes, and XO Arbiter PUFs, Lightweight Secure PUFs, and Feed-Forward Arbiter PUFs of up to a given size and complexity. Our attacks are based upon various machine learning techniques including Logistic Regression and Evolution Strategies. Our work leads to new design requirements for secure electrical PUFs, and will be useful to PUF designers and attackers alike."
ACM CCS 2010,Worry-free encryption - functional encryption with public keys.,"In this work, we put forward the notion of Worry-Free Encryption. This allows Alice to encrypt confidential information under Bob's public key and send it to him, without having to worry about whether Bob has the authority to actually access this information. This is done by encrypting the message under a hidden access policy that only allows Bob to decrypt if his credentials satisfy the policy. Our notion can be seen as a functional encryption scheme but in a public-key setting. As such, we are able to insist that even if the credential authority is corrupted, it should not be able to compromise the security of any honest user."
ACM CCS 2010,Demonstrating cognitive packet network resilience to worm attacks.,"The need for network stability and reliability has led to the growth of autonomic networks that can provide more stable and more reliable communications via on-line measurement, learning and adaptation. A promising architecture is the Cognitive Packet Network (CPN) that rapidly adapts to varying network conditions and user requirements using QoS driven reinforcement learning algorithms that drive the routing control. Contrary to conventional mechanisms, the users rather than the nodes, control the routing by specifying their desired QoS requirements (QoS Goals), such as Minimum Delay, Maximum Bandwidth, Minimum Cost, etc., and the network then routes each user's traffic individually based on their specific needs and on a ""glocal"" view. In CPN the user has the ability to explore the network for its own needs, and evaluate its own impact on the network as a whole and vice-versa, and then take appropriate decisions. CPN routing has been evaluated extensively under normal operating conditions and has proven to be very adaptive to network changes such as congestion. Here we show how CPN can respond and survive to catastrophic node failures caused by the spread of network worms. This survival is based on two complementary approaches that are run concurrently: one the one hand, each user attempts to concurrently and adaptively avoid paths which are infected, and secondly patching algorithms are continuously run to repair the network. Experiments show that this approach assures the stability of network communications throughout the course of an attack."
ACM CCS 2010,Survivable key compromise in software update systems.,"Today's software update systems have little or no defense against key compromise. As a result, key compromises have put millions of software update clients at risk. Here we identify three classes of information whose authenticity and integrity are critical for secure software updates. Analyzing existing software update systems with our framework, we find their ability to communicate this information securely in the event of a key compromise to be weak or nonexistent. We also find that the security problems in current software update systems are compounded by inadequate trust revocation mechanisms. We identify core security principles that allow software update systems to survive key compromise. Using these ideas, we design and implement TUF, a software update framework that increases resilience to key compromise."
ACM CCS 2010,Losing control of the internet - using the data plane to attack the control plane.,"In this work, we introduce the Coordinated Cross Plane Session Termination, or CXPST, attack, a distributed denial of service attack that attacks the control plane of the Internet. CXPST extends previous work that demonstrates a vulnerability in routers that allows an adversary to disconnect a pair of routers using only data plane traffic. By carefully choosing BGP sessions to terminate, CXPST generates a surge of BGP updates that are seen by nearly all core routers on the Internet. This surge of updates surpasses the computational capacity of affected routers, crippling their ability to make routing decisions"
ACM CCS 2010,Size-based scheduling - a recipe for DDOS?,"Internet traffic measurements have shown that the majority of the Internet's flows are short, while a small percentage of the largest flows are responsible for most of the bytes. To exploit this property for performance improvement in routers and Web servers, several studies have proposed size-based schedulings to offer preferential treatment to the shortest flows. In this work, we present analytical and simulation results which confirm that size-based scheduling will ease the task of launching DDOS attacks on the Internet."
ACM CCS 2010,Robusta - taming the native beast of the JVM.,"Java applications often need to incorporate native-code components for efficiency and for reusing legacy code. However, it is well known that the use of native code defeats Java's security model. We describe the design and implementation of Robusta, a complete framework that provides safety and security to native code in Java applications. Starting from software-based fault isolation (SFI), Robusta isolates native code into a sandbox where dynamic linking/loading of libraries in supported and unsafe system modification and confidentiality violations are prevented. It also mediates native system calls according to a security policy by connecting to Java's security manager. Our prototype implementation of Robusta is based onNative Client and OpenJDK. Experiments in this prototype demonstrate Robusta is effective and efficient, with modest runtime overhead on a set of JNI benchmark programs. Robusta can be used to sandbox native libraries used in Java's system classes to prevent attackers from exploiting bugs in the libraries. It can also enable trustworthy execution of mobile Java programs with native libraries. The design of Robusta should also be applicable when other type-safe languages (e.g., C#, Python) want to ensure safe interoperation with native libraries"
ACM CCS 2010,Developing security protocols by refinement.,"We propose a development method for security protocols based on stepwise refinement. Our refinement strategy guides the transformation of abstract security goals into protocols that are secure when operating over an insecure channel controlled by a Dolev-Yao-style intruder. The refinement steps successively introduce local states, an intruder, communication channels with security properties, and cryptographic operations realizing these channels. The abstractions used provide insights on how the protocols work and foster the development of families of protocols sharing a common structure and properties. In contrast to post-hoc verification methods, protocols are developed together with their correctness proofs. We have implemented our method in Isabelle/HOL and used it to develop different entity authentication and key transport protocols."
ACM CCS 2010,In God we trust all others we monitor.,"Modern x86 platforms offer stealth capabilities, that are exploited by rootkits to hide malicious code as shown by the rootkit evolution. Recently, security researchers discovered a very powerful execution environment for rootkits that is isolated from the actual x86 host platform. According to the capabilities of the isolated environment the researches called it ""ring -3"". Security mechanisms, such as antivirus software, cannot reveal ""ring -3"" rootkits, since they are executed in the operating system which makes them unable to access ""ring -3""."
ACM CCS 2010,User-friendly matching protocol for online social networks.,"In this paper, we outline a privacy-preserving matching protocol for OSN (online social network) users to find their potential friends. With the proposed protocol, a logged-in user can match her profile with that of an off-line stranger, while both profiles are maximally protected. Our solution successfully eliminates the requirement of ""out-of-band"" communication channels, which is one of the biggest obstacles facing cryptographic solutions for OSNs."
ACM CCS 2010,An improved algorithm for tor circuit scheduling.,"Tor is a popular anonymity-preserving network, consisting of routers run by volunteers all around the world. It protects Internet users' privacy by relaying their network traffic through a series of routers, thus concealing the linkage between the sender and the recipient. Despite the advantage of Tor's anonymizing capabilities, it also brings extra latency, which discourages more users from joining the network."
ACM CCS 2010,Hierarchical attribute-based encryption for fine-grained access control in cloud storage services.,"Cloud computing, as an emerging computing paradigm, enables users to remotely store their data into a cloud so as to enjoy scalable services on-demand. Especially for small and medium-sized enterprises with limited budgets, they can achieve cost savings and productivity enhancements by using cloud-based services to manage projects, to make collaborations, and the like. However, allowing cloud service providers (CSPs), which are not in the same trusted domains as enterprise users, to take care of confidential data, may raise potential security and privacy issues. To keep the sensitive user data confidential against untrusted CSPs, a natural way is to apply cryptographic approaches, by disclosing decryption keys only to authorized users. However, when enterprise users outsource confidential data for sharing on cloud servers, the adopted encryption system should not only support fine-grained access control, but also provide high performance, full delegation, and scalability, so as to best serve the needs of accessing data anytime and anywhere, delegating within enterprises, and achieving a dynamic set of users. In this paper, we propose a scheme to help enterprises to efficiently share confidential data on cloud servers. We achieve this goal by first combining the hierarchical identity-based encryption (HIBE) system and the ciphertext-policy attribute-based encryption (CP-ABE) system, and then making a performance-expressivity tradeoff, finally applying proxy re-encryption and lazy re-encryption to our scheme."
ACM CCS 2010,In search of an anonymous and secure lookup - attacks on structured peer-to-peer anonymous communication systems.,"The ability to locate random relays is a key challenge for peer-to-peer (P2P) anonymous communication systems. Earlier attempts like Salsa and AP3 used distributes hash table lookups to locate relays, but the lack of anonymity in their lookup mechanisms enables an adversary to infer the path structure and compromise used anonymity. NISAN and Torsk are state-of-the-art systems for P2P anonymous communication. Their designs include mechanisms that are specifically tailored to mitigate information leak attacks. NISAN proposes to add anonymity into the lookup mechanism itself, while Torsk proposes the use of secret buddy nodes to anonymize the lookup initiator. In this paper, we attack the key mechanisms that hide the relationship between a lookup initiator and its selected relays in NISAN and Torsk. We present passive attacks on the NISAN lookup and show that it is not as anonymous as previously thought. We analyze three circuit construction mechanisms for anonymous communication using the NISAN lookup, and show that the information leaks in the NISAN lookup lead to a significant reduction in user anonymity. We also propose active attacks on Torsk that defeat its secret buddy mechanism and consequently compromise user anonymity. Our results are backed up by probabilistic modeling and extensive simulations. Our study motivates the search for a DHT lookup mechanism that is both secure and anonymous."
ACM CCS 2010,Secure dynamic code generation against spraying.,"DCG (Dynamic Code Generation) technologies have found widely applications in the Web 2.0 era, Dion Blazakis recently presented a Flash JIT-Spraying attack against Adobe Flash Player that easily circumvented DEP and ASLR protection mechanisms built in modern operating systems. We have generalized and extended JIT Spraying into DCG Spraying. Based our analyses on this abstract model of DCG Spraying, we have found that all mainstream DCG implementations (Java/ JavaScript/ Flash/ .Net/ SilverLight) are vulnerable against DCG Spraying attack, and none of the existing ad hoc defenses such as compilation optimization, random NOP padding and constant splitting provides effective protection. Furthermore, we propose a new protection method, INSeRT, which combines randomization of intrinsic elements of machine instructions and randomly planted special trapping snippets. INSeRT practically renders the ""sprayed code"" ineffective, while alerts the host program of ongoing attacking attempts. We implemented a prototype of INSeRT on the V8 JavaScript engine, and the performance overhead is less than 5%, which should be acceptable in practical application."
ACM CCS 2010,Testing metrics for password creation policies by attacking large sets of revealed passwords.,"In this paper we attempt to determine the effectiveness of using entropy, as defined in NIST SP800-63, as a measurement of the security provided by various password creation policies. This is accomplished by modeling the success rate of current password cracking techniques against real user passwords. These data sets were collected from several different websites, the largest one containing over 32 million passwords. This focus on actual attack methodologies and real user passwords quite possibly makes this one of the largest studies on password security to date. In addition we examine what these results mean for standard password creation policies, such as minimum password length, and character set requirements."
ACM CCS 2010,Security analysis of India&apos;s electronic voting machines.,"Elections in India are conducted almost exclusively using electronic voting machines developed over the past two decades by a pair of government-owned companies. These devices, known in India as EVMs, have been praised for their simple design, ease of use, and reliability, but recently they have also been criticized following widespread reports of election irregularities. Despite this criticism, many details of the machines' design have never been publicly disclosed, and they have not been subjected to a rigorous, independent security evaluation. In this paper, we present a security analysis of a real Indian EVM obtained from an anonymous source. We describe the machine's design and operation in detail, and we evaluate its security in light of relevant election procedures. We conclude that in spite of the machines' simplicity and minimal software trusted computing base, they are vulnerable to serious attacks that can alter election results and violate the secrecy of the ballot. We demonstrate two attacks, implemented using custom hardware, which could be carried out by dishonest election insiders or other criminals with only brief physical access to the machines. This case study carries important lessons for Indian elections and for electronic voting security more generally."
ACM CCS 2010,Mimimorphism - a new approach to binary code obfuscation.,"Binary obfuscation plays an essential role in evading malware static analysis and detection. The widely used code obfuscation techniques, such as polymorphism and metamorphism, focus on evading syntax based detection. However, statistic test and semantic analysis techniques have been developed to thwart their evasion attempts. More recent binary obfuscation techniques are divided in their purposes of attacking either statistical or semantic approach, but not both. In this paper, we introduce mimimorphism, a novel binary obfuscation technique with the potential of evading both statistical and semantic detections. Mimimorphic malware uses instruction-syntax-aware high-order mimic functions to transform its binary into mimicry executables that exhibit high similarity to benign programs in terms of statistical properties and semantic characteristics. We implement a prototype of the mimimorphic engine on the Intel x86 platform, and evaluate its capability of evading statistical anomaly detection and semantic analysis detection techniques. Our experimental results demonstrate that the mimicry executables are indistinguishable from benign programs in terms of byte frequency distribution and entropy, as well as control flow fingerprint."
