conference,title,abstract
ACM CCS 2010,Fingerprinting websites using remote traffic analysis.,"Recent work has shown that traffic analysis of data carried on encrypted tunnels can be used to recover important semantic information. As one example, attackers can find out which website, or which page on a website, a user is accessing simply by monitoring the traffic patterns. We show that traffic analysis is a much greater threat to privacy than previously thought, as such attacks can be carried out remotely. In particular, we show that, to perform traffic analysis, adversaries do not need to directly observe the traffic patterns. Instead, they can send probes from a far-off vantage point that exploit a queuing side channel in routers."
ACM CCS 2010,@spam - the underground on 140 characters or less.,"In this work we present a characterization of spam on Twitter. We find that 8% of 25 million URLs posted to the site point to phishing, malware, and scams listed on popular blacklists. We analyze the accounts that send spam and find evidence that it originates from previously legitimate accounts that have been compromised and are now being puppeteered by spammers. Using clickthrough data, we analyze spammers' use of features unique to Twitter and the degree that they affect the success of spam. We find that Twitter is a highly successful platform for coercing users to visit spam pages, with a clickthrough rate of 0.13%, compared to much lower rates previously reported for email spam. We group spam URLs into campaigns and identify trends that uniquely distinguish phishing, malware, and spam, to gain an insight into the underlying techniques used to attract users."
ACM CCS 2010,A new framework for efficient password-based authenticated key exchange.,"Protocols for password-based authenticated key exchange (PAKE) allow two users who share only a short, low-entropy password to agree on a cryptographically strong session key. The challenge in designing such protocols is that they must be immune to off-line dictionary attacks in which an eavesdropping adversary exhaustively enumerates the dictionary of likely passwords in an attempt to match a password to the set of observed transcripts."
ACM CCS 2010,On pairing constrained wireless devices based on secrecy of auxiliary channels - the case of acoustic eavesdropping.,"Secure ""pairing"" of wireless devices based on auxiliary or out-of-band (OOB) - audio, visual or tactile - communication is a well-established research direction. Lack of good quality interfaces on or physical access to certain constrained devices (e.g., headsets, access points, medical implants) makes pairing a challenging problem in practice. Prior work shows that pairing of constrained devices based on authenticated OOB (A-OOB) channels can be prone to human errors that eventually translate into man-in-the-middle attacks. An alternative and more usable solution is to use OOB channel(s) that are authenticated as well as secret (AS-OOB). AS-OOB pairing can be achieved by simply transmitting the key or a short password over the AS-OOB channel, avoiding potential serious human errors."
ACM CCS 2010,Efficient sensor node authentication via 3GPP mobile communication networks.,"Energy efficiency is one of important issues in the resource constrained wireless sensor network. In this paper, we propose the authentication and key agreement protocol that efficiently reduces the overall computational and communication costs in the next generation converged network. The enhanced security procedures are operated through the mobile network in order to maximize the lifetime of the sensor networks and to apply the combined capabilities of both networks."
ACM CCS 2010,DIFC programs by automatic instrumentation.,"Decentralized information flow control (DIFC) operating systems provide applications with mechanisms for enforcing information flow policies for their data. However, significant obstacles keep such operating systems from achieving widespread adoption. One key obstacle is that DIFC operating systems provide only low-level mechanisms for allowing application programmers to enforce their desired policies. It can be difficult for the programmer to ensure that their use of these mechanisms enforces their high-level policies, while at the same time not breaking the underlying functionality of their application. These are issues both for programmers who would develop new applications for a DIFC operating system and for programmers who would port existing applications to a DIFC operating system. Our work significantly eases these tasks. We present as automatic technique that takes as input a program with no DIFC code, and two policies: one that specifies prohibited information flows and one that specifies flows that must be allowed. Our technique then produces a new version of the input program that satisfies the two policies. To evaluate out technique, we implemented it in an automatic tool, called Swim (for Secure What I Mean), and applied it to a set of real-world programs and policies. The results of our evaluation demonstrate that the technique is sufficiently expressive to produce programs for real-world policies, and that it can produce such programs efficiently. It thus represents a significant contribution towards developing systems with strong end-to-end information flow guarantees."
ACM CCS 2010,TASTY - tool for automating secure two-party computations.,"Secure two-party computation allows two untrusting parties to jointly compute an arbitrary function on their respective private inputs while revealing no information beyond the outcome. Existing cryptographic compilers can automatically generate secure computation protocols from high-level specifications, but are often limited in their use and efficiency of generated protocols as they are based on either garbled circuits or (additively) homomorphic encryption only."
ACM CCS 2010,Rendezvous tunnel for anonymous publishing.,"Many anonymous peer-to-peer (P2P) file sharing systems have been proposed in recent years. One problem that remains open is how to protect the anonymity of all participating users, namely, reader, server and publisher. In this work we propose a novel solution for a P2P file sharing system. Our solution provides overall anonymity to all participating users."
ACM CCS 2010,Protecting browsers from cross-origin CSS attacks.,"Cross-origin CSS attacks use style sheet import to steal confidential information from a victim website, hijacking a user's existing authenticated session; existing XSS defenses are ineffective. We show how to conduct these attacks with any browser, even if JavaScript is disabled, and propose a client-side defense with little or no impact on the vast majority of web sites. We have implemented and deployed defenses in Firefox, Google Chrome, and Safari. Our defense proposal has also been adopted by Opera."
ACM CCS 2010,Exploiting social networking sites for spam.,"In the ongoing arms race between spammers and the multi-million dollar anti-spam industry, the number of unsolicited e-mail messages (better known as ""spam"") and phishing has increased heavily in the last decade. In this paper, we show that our novel friend-in-the-middle attack on social networking sites (SNSs) can be used to harvest social data in an automated fashion. This social data can then be exploited for large-scale attacks such as context-aware spam and social-phishing. We prove the feasibility of our attack exemplarily on Facebook and identify possible consequences based on a mathematical model and simulations. Alarmingly, all major SNSs are vulnerable to our attack as they fail to secure the network layer appropriately."
ACM CCS 2010,Mobile location tracking in metro areas - malnets and others.,"Digital wireless radios broadcast identification numbers that uniquely identify them. As has been previously observed, given the ubiquity with which people carry smartphones with their embedded WiFi radios powered on, comes the ability to track individuals' movements. The ability to use wireless radios for positioning has been previously observed and developed in to useful products. In these systems a user willingly geolocates themselves by providing identifiers to infrastructure hardware. In this paper we consider the converse question: what rates of monitoring by smartphones devices in a given metropolitan area are necessary to achieve different levels of involuntary geolocation. While previous work has looked at countermeasure that attempt to maintain privacy, no work has attempted to quantify the problem and risks. Using appropriate simulations we give the first quantitative support for the number and conditions of tracking devices necessary to track the locations of non-participant individuals in urban environments. We provide evidence that a small, but not insignificant, number of mobile devices can be used to track a majority of users during a significant fraction of their travel with current devices. We conclude that in the immediate future, malnets would require relatively high infection rates to pose a significant threat, but that voluntary networks, with perceived benefit can probably achieve the usage rates necessary to track individual movements of non-subscribed users to a high-degree of accuracy. Our results also suggest ubiquitous deployment of 802.11n in smartphones would make geolocation feasible by malnets"
ACM CCS 2010,An implementation of event and filter confidentiality in pub/sub systems and its application to e-health.,"The publish/subscribe model offers a loosely-coupled communication paradigm where applications interact indirectly and asynchronously. Publisher applications generate events that are forwarded to subscriber applications by a network of brokers. Subscribers register by specifying filters that brokers match against events as part of the routing process. Brokers might be deployed on untrusted servers where malicious entities can get access to events and filters. Supporting confidentiality of events and filters in this setting is still an open challenge. First of all, it is desirable that publishers and subscribers do not share secret keys, such a requirement being against the loose-coupling of the model. Second, brokers need to route events by matching encrypted events against encrypted filters. This should be possible even with very complex filters. Existing solutions do not fully address these issues. This work describes the implementation of a novel schema that supports (i) confidentiality for events and filters; (ii) filters that express very complex constraints on events even if brokers are not able to access any information on both events and filters; (iii) and finally, does not require publishers and subscribers to share keys. We then describe an e-Health application scenario for monitoring patients with chronic diseases and show how our encryption schema can be used to provide confidentiality of the patients' personal and medical data, and control who can receive the patients' data and under which conditions."
ACM CCS 2010,Privacy and robustness for data aggregation in wireless sensor networks.,No abstract available.
ACM CCS 2010,An empirical study of privacy-violating information flows in JavaScript web applications.,"The dynamic nature of JavaScript web applications has given rise to the possibility of privacy violating information flows. We present an empirical study of the prevalence of such flows on a large number of popular websites. We have (1) designed an expressive, fine-grained information flow policy language that allows us to specify and detect different kinds of privacy-violating flows in JavaScript code,(2) implemented a new rewriting-based JavaScript information flow engine within the Chrome browser, and (3) used the enhanced browser to conduct a large-scale empirical study over the Alexa global top 50,000 websites of four privacy-violating flows: cookie stealing, location hijacking, history sniffing, and behavior tracking. Our survey shows that several popular sites, including Alexa global top-100 sites, use privacy-violating flows to exfiltrate information about users' browsing behavior. Our findings show that steps must be taken to mitigate the privacy threat from covert flows in browsers."
ACM CCS 2010,Recruiting new tor relays with BRAIDS.,"Tor, a distributed Internet anonymizing system, relies on volunteers who run dedicated relays. Other than altruism, these volunteers have no incentive to run relays, causing a large disparity between the number of users and available relays. We introduce BRAIDS, a set of practical mechanisms that encourages users to run Tor relays, allowing them to earn credits redeemable for improved performance of both interactive and non-interactive Tor traffic. These performance incentives will allow Tor to support increasing resource demands with almost no loss in anonymity: BRAIDS is robust to well-known attacks. Using a simulation of 20,300 Tor nodes, we show that BRAIDS allows relays to achieve 75% lower latency than non-relays for interactive traffic, and 90% higher bandwidth utilization for non-interactive traffic."
ACM CCS 2010,Designing router scheduling policies - a privacy perspective.,"We examine a queuing side channel which results from a shared resource between two users in the context of packet networks. We consider the scenario where one of them is a legitimate user and the other is an attacker who is trying to learn about the former's activities. We show that the waiting time of an adversary sending a small but frequent probe stream to the shared resource (e.g., a router) is highly correlated with traffic pattern of the user."
ACM CCS 2010,Secure text processing with applications to private DNA matching.,"Motivated by the problem of private DNA matching, we consider the design of efficient protocols for secure text processing. Here, informally, a party P1 holds a text T and a party P2 holds a pattern p and some additional information y, and P2 wants to learn {f(T,j,y)} for all locations j where p is found as a substring in T. (In particular, this generalizes the basic pattern matching problem.) We aim for protocols with full security against a malicious P2 that also preserve privacy against a malicious P1 (i.e., one-sided security). We show how to modify Yao's garbled circuit approach to obtain a protocol where the size of the garbled circuit is linear in the number of occurrences of p in T (rather than linear in $|T|$). Along the way we show a new keyword search protocol that may be of independent interest."
ACM CCS 2010,CRAFT - a new secure congestion control architecture.,"Congestion control algorithms seek to optimally utilize network resources by allocating a certain rate for each user. However, malicious clients can disregard the congestion control algorithms implemented at the clients and induce congestion at bottleneck links. Thus, in an adversarial environment, the network must enforce the congestion control algorithm in order to attain the optimal network utilization offered by the algorithm. Prior work protects only a single link incident on the enforcement routers neglecting damage inflicted upon other downstream links. We present CRAFT, a capability-based scheme to secure all downstream links of a deploying router. Our goal is to enforce a network-wide congestion control algorithm on all flows. As a reference design, we develop techniques to enforce the TCP congestion control. Our design regulates all flows to share bandwidth resources in a TCP-fair manner by emulating the TCP state machine in a CRAFT router. As a result, once a flow passes a single CRAFT router, it is TCP-fair on all downstream links of that router."
ACM CCS 2010,Trail of bytes - efficient support for forensic analysis.,"For the most part, forensic analysis of computer systems requires that one first identify suspicious objects or events, and then examine them in enough detail to form a hypothesis as to their cause and effect. Sadly, while our ability to gather vast amounts of data has improved significantly over the past two decades, it is all too often the case that we tend to lack detailed information just when we need it the most. Simply put, the current state of computer forensics leaves much to be desired. In this paper, we attempt to improve on the state of the art by providing a forensic platform that transparently monitors and records data access events within a virtualized environment using only the abstractions exposed by the hypervisor. Our approach monitors accesses to objects on disk and follows the causal chain of these accesses across processes, even after the objects are copied into memory. Our forensic layer records these transactions in a version-based audit log that allows for faithful, and efficient, reconstruction of the recorded events and the changes they induced. To demonstrate the utility of our approach, we provide an extensive empirical evaluation, including a real-world case study demonstrating how our platform can be used to reconstruct valuable information about the what, when, and how, after a compromised has been detected."
ACM CCS 2010,Timing attacks on PIN input devices.,"Keypads are commonly used to enter personal identification numbers (PIN) which are intended to authenticate a user based on what they know. A number of those keypads such as ATM inputs and door keypads provide an audio feedback to the user for each button pressed. Such audio feedback are observable from a modest distance. We are looking at quantifying the information leaking from delays between acoustic feedback pulses. Preliminary experiments suggest that by using a Hidden Markov Model, it might be possible to substantially narrow the search space. A subsequent brute force search on the reduced search space could be possible with- out triggering alerts, lockouts or other mechanisms design to thwart plain brute force attempts."
ACM CCS 2010,Accountability - definition and relationship to verifiability.,"Many cryptographic tasks and protocols, such as non-repudiation, contract-signing, voting, auction, identity-based encryption, and certain forms of secure multi-party computation, involve the use of (semi-)trusted parties, such as notaries and authorities. It is crucial that such parties can be held accountable in case they misbehave as this is a strong incentive for such parties to follow the protocol. Unfortunately, there does not exist a general and convincing definition of accountability that would allow to assess the level of accountability a protocol provides."
ACM CCS 2010,AccessMiner - using system-centric models for malware protection.,"Models based on system calls are a popular and common approach to characterize the run-time behavior of programs. For example, system calls are used by intrusion detection systems to detect software exploits. As another example, policies based on system calls are used to sandbox applications or to enforce access control. Given that malware represents a significant security threat for today's computing infrastructure, it is not surprising that system calls were also proposed to distinguish between benign processes and malicious code."
ACM CCS 2010,SecTag - a multi-policy supported secure web tag framework.,"Traditional web application development often encounters tight coupling problem between access control logic and business logic. It is hard to configure and modify access control policies after a system has been deployed. In this demonstration, we present SecTag, a multi-policy supported secure web tag framework, to address this problem. We define a series of general-purpose secure attributes that meet the demand of fine-grained access control in web presentation layer. We also design a set of high interactive secure tags, which encapsulate secure features to provide reusable secure components for web development. A running example of SecTag is presented to demonstrate the effectiveness of the proposed framework."
ACM CCS 2010,Dialog-based payload aggregation for intrusion detection.,"Network-based Intrusion Detection Systems (IDSs) such as Snort or Bro that have to analyze the packet payload for all the received data show severe performance problems if used in high-speed networks. Recent research results improve pattern matchers based on efficient algorithms or using specialized hardware. We approach the problem in a completely different way by considerably reducing the amount of data to be analyzed with only marginal impact on the detection quality. Dialog-based Payload Aggregation (DPA) uses TCP sequence numbers to decide which parts of the payload need to be analyzed by the IDS. Whenever a connection starts, or if the direction of the data transmission between peers changes, we forward the next N bytes of traffic to an attached IDS. All data transferred after the window is discarded. Our analysis using live network traffic and multiple Snort rulesets shows that most of the pattern matches occur at the beginning of connections or directly after direction changes in the data streams. According to our experimental results, our method reduces the data rate to be processed to around 1% in a typical network while retaining more than 98% of all detected events. Assuming a linear relationship between the data rate and processing time of an IDS, this results in a speedup of two magnitudes in the best case."
ACM CCS 2010,BLADE - an attack-agnostic approach for preventing drive-by malware infections.,"Web-based surreptitious malware infections (i.e., drive-by downloads) have become the primary method used to deliver malicious software onto computers across the Internet. To address this threat, we present a browser independent operating system kernel extension designed to eliminate driveby malware installations. The BLADE (Block All Drive-by download Exploits) system asserts that all executable files delivered through browser downloads must result from explicit user consent and transparently redirects every unconsented browser download into a nonexecutable secure zone of disk. BLADE thwarts the ability of browser-based exploits to surreptitiously download and execute malicious content by remapping to the file system only those browser downloads to which a programmatically inferred user-consent is correlated, BLADE provides its protection without explicit knowledge of any exploits and is thus resilient against code obfuscation and zero-day threats that directly contribute to the pervasiveness of today's drive-by malware. We present the design of our BLADE prototype implementation for the Microsoft Windows platform, and report results from as extensive empirical evaluation of its effectiveness on popular browsers. Our evaluation includes multiple versions of IE and Firefox, against 1,934 active malicious URLs, representing a broad spectrum of web-based exploits not plaguing the Internet. BLADE successfully blocked all drive-by malware install attempts with zero false positives and a 3% worst-case performance cost."
ACM CCS 2010,On the soundness of authenticate-then-encrypt - formalizing the malleability of symmetric encryption.,"A communication channel from an honest sender A to an honest receiver B can be described as a system with three interfaces labeled A, B, and E (the adversary), respectively, where the security properties of the channel are characterized by the capabilities provided at the E-interface."
ACM CCS 2010,Protecting location privacy against inference attacks.,"GPS-enabled mobile devices are a quickly growing market and users are starting to share their location information with each other through services such as Google Latitude. Location information, however, is very privacy-sensitive since it can be used to infer activities, preferences, relationships, and other personal information, and thus access to it must be carefully protected. We provide a formal definition of location privacy that incorporates an adversary's ability to predict location and discuss possible implementation of access control mechanisms that satisfy this definition. To support our reasoning, we analyze a preliminary data set to evaluate the accuracy of location prediction."
ACM CCS 2010,Abstraction by set-membership - verifying security protocols and web services with databases.,"The abstraction and over-approximation of protocols and web services by a set of Horn clauses is a very successful method in practice. It has however limitations for protocols and web services that are based on databases of keys, contracts, or even access rights, where revocation is possible, so that the set of true facts does not monotonically grow with state transitions. We extend the scope of these over-approximation methods by defining a new way of abstraction that can handle such databases, and we formally prove that the abstraction is sound. We realize a translator from a convenient specification language to standard Horn clauses and use the verifier ProVerif and the theorem prover SPASS to solve them. We show by a number of examples that this approach is practically feasible for wide variety of verification problems of security protocols and web services"
