conference,title,abstract
ACM CCS 2017,"CCCP - Closed Caption Crypto Phones to Resist MITM Attacks, Human Errors and Click-Through.","Crypto Phones aim to establish end-to-end secure voice (and text) communications based on human-centric (usually) short checksum validation. They require end users to perform: (1) checksum comparison to detect traditional data-based man-in-the-middle (data MITM) attacks, and, optionally, (2) speaker verification to detect sophisticated voice-based man-in-the-middle (voice MITM) attacks. However, research shows that both tasks are prone to human errors making Crypto Phones highly vulnerable to MITM attacks, especially to data MITM given the prominence of these attacks. Further, human errors under benign settings undermine usability since legitimate calls would often need to be rejected."
ACM CCS 2017,Rise of the HaCRS - Augmenting Autonomous Cyber Reasoning Systems with Human Assistance.,"Software permeates every aspect of our world, from our homes to the infrastructure that provides mission-critical services."
ACM CCS 2017,Detecting Structurally Anomalous Logins Within Enterprise Networks.,"Many network intrusion detection systems use byte sequences to detect lateral movements that exploit remote vulnerabilities. Attackers bypass such detection by stealing valid credentials and using them to transmit from one computer to another without creating abnormal network traffic. We call this method Credential-based Lateral Movement. To detect this type of lateral movement, we develop the concept of a Network Login Structure that specifies normal logins within a given network. Our method models a network login structure by automatically extracting a collection of login patterns by using a variation of the market-basket algorithm. We then employ an anomaly detection approach to detect malicious logins that are inconsistent with the enterprise network's login structure. Evaluations show that the proposed method is able to detect malicious logins in a real setting. In a simulated attack, our system was able to detect 82% of malicious logins, with a 0.3% false positive rate. We used a real dataset of millions of logins over the course of five months within a global financial company for evaluation of this work."
ACM CCS 2017,FreeGuard - A Faster Secure Heap Allocator.,"In spite of years of improvements to software security, heap-related attacks still remain a severe threat. One reason is that many existing memory allocators fall short in a variety of aspects. For instance, performance-oriented allocators are designed with very limited countermeasures against attacks, but secure allocators generally suffer from significant performance overhead, e.g., running up to 10x slower. This paper, therefore, introduces FreeGuard, a secure memory allocator that prevents or reduces a wide range of heap-related security attacks, such as heap overflows, heap over-reads, use-after-frees, as well as double and invalid frees. FreeGuard has similar performance to the default Linux allocator, with less than 2% overhead on average, but provides significant improvement to security guarantees."
ACM CCS 2017,DEMO - Akatosh - Automated Cyber Incident Verification and Impact Analysis.,"Akatosh, a U.S. Department of Homeland Security Transition to Practice Program (TTP) project developed by Oak Ridge National Laboratory with industry and academic partnership, enables automated, real-time forensic analysis of endpoints after malware-attacks and other cyber security incidents by automatically maintaining detailed snapshots of host-level activity on endpoints over time. It achieves this by integrating intrusion detection systems (IDS) with forensic tools. The combination allows Akatosh to collect vast amounts of endpoint data and assists in verifying, tracking, and analyzing endpoints in real time. This provides operations personnel and analysts as well as managers and executives with continuous feedback on the impact of malicious software and other security incidents on endpoints in their network."
ACM CCS 2017,Most Websites Don&apos;t Need to Vibrate - A Cost-Benefit Approach to Improving Browser Security.,"Modern web browsers have accrued an incredibly broad set of features since being invented for hypermedia dissemination in 1990. Many of these features benefit users by enabling new types of web applications. However, some features also bring risk to users' privacy and security, whether through implementation error, unexpected composition, or unintended use. Currently there is no general methodology for weighing these costs and benefits. Restricting access to only the features which are necessary for delivering desired functionality on a given website would allow users to enforce the principle of lease privilege on use of the myriad APIs present in the modern web browser."
ACM CCS 2017,Machine Learning Models that Remember Too Much.,"Machine learning (ML) is becoming a commodity. Numerous ML frameworks and services are available to data holders who are not ML experts but want to train predictive models on their data. It is important that ML models trained on sensitive inputs (e.g., personal images or documents) not leak too much information about the training data."
ACM CCS 2017,A Formal Foundation for Secure Remote Execution of Enclaves.,"Recent proposals for trusted hardware platforms, such as Intel SGX and the MIT Sanctum processor, offer compelling security features but lack formal guarantees. We introduce a verification methodology based on a trusted abstract platform (TAP), a formalization of idealized enclave platforms along with a parameterized adversary. We also formalize the notion of secure remote execution and present machine-checked proofs showing that the TAP satisfies the three key security properties that entail secure remote execution: integrity, confidentiality and secure measurement. We then present machine-checked proofs showing that SGX and Sanctum are refinements of the TAP under certain parameterizations of the adversary, demonstrating that these systems implement secure enclaves for the stated adversary models."
ACM CCS 2017,Herding Vulnerable Cats - A Statistical Approach to Disentangle Joint Responsibility for Web Security in Shared Hosting.,"Hosting providers play a key role in fighting web compromise, but their ability to prevent abuse is constrained by the security practices of their own customers. Shared hosting, offers a unique perspective since customers operate under restricted privileges and providers retain more control over configurations. We present the first empirical analysis of the distribution of web security features and software patching practices in shared hosting providers, the influence of providers on these security practices, and their impact on web compromise rates. We construct provider-level features on the global market for shared hosting -- containing 1,259 providers -- by gathering indicators from 442,684 domains. Exploratory factor analysis of 15 indicators identifies four main latent factors that capture security efforts: content security, webmaster security, web infrastructure security and web application security. We confirm, via a fixed-effect regression model, that providers exert significant influence over the latter two factors, which are both related to the software stack in their hosting environment. Finally, by means of GLM regression analysis of these factors on phishing and malware abuse, we show that the four security and software patching factors explain between 10% and 19% of the variance in abuse at providers, after controlling for size. For web-application security for instance, we found that when a provider moves from the bottom 10% to the best-performing 10%, it would experience 4 times fewer phishing incidents. We show that providers have influence over patch levels--even higher in the stack, where CMSes can run as client-side software--and that this influence is tied to a substantial reduction in abuse levels."
ACM CCS 2017,On the Power of Optical Contactless Probing - Attacking Bitstream Encryption of FPGAs.,"Modern Integrated Circuits (ICs) employ several classes of countermeasures to mitigate physical attacks. Recently, a powerful semi-invasive attack relying on optical contactless probing has been introduced, which can assist the attacker in circumventing the integrated countermeasures and probe the secret data on a chip. This attack can be mounted using IC debug tools from the backside of the chip. The first published attack based on this technique was conducted against a proof-of-concept hardware implementation on a Field Programmable Gate Array (FPGA). Therefore, the success of optical probing techniques against a real commercial device without any knowledge of the hardware implementation is still questionable. The aim of this work is to assess the threat of optical contactless probing in a real attack scenario. To this end, we conduct an optical probing attack against the bitstream encryption feature of a common FPGA. We demonstrate that the adversary is able to extract the plaintext data containing sensitive design information and intellectual property (IP). In contrast to previous optical attacks from the IC backside, our attack does not require any device preparation or silicon polishing, which makes it a non-invasive attack. Additionally, we debunk the myth that small technology sizes are unsusceptible to optical attacks, as we use an optical resolution of about 1 um to successfully attack a 28 nm device. Based on our time measurements, an attacker needs less than 10 working days to conduct the optical analysis and reverse-engineer the security-related parts of the hardware. Finally, we propose and discuss potential countermeasures, which could make the attack more challenging."
ACM CCS 2017,"Data Breaches, Phishing, or Malware? - Understanding the Risks of Stolen Credentials.","In this paper, we present the first longitudinal measurement study of the underground ecosystem fueling credential theft and assess the risk it poses to millions of users. Over the course of March, 2016--March, 2017, we identify 788,000 potential victims of off-the-shelf keyloggers; 12.4 million potential victims of phishing kits; and 1.9 billion usernames and passwords exposed via data breaches and traded on blackmarket forums. Using this dataset, we explore to what degree the stolen passwords---which originate from thousands of online services---enable an attacker to obtain a victim's valid email credentials---and thus complete control of their online identity due to transitive trust. Drawing upon Google as a case study, we find 7--25% of exposed passwords match a victim's Google account. For these accounts, we show how hardening authentication mechanisms to include additional risk signals such as a user's historical geolocations and device profiles helps to mitigate the risk of hijacking. Beyond these risk metrics, we delve into the global reach of the miscreants involved in credential theft and the blackhat tools they rely on. We observe a remarkable lack of external pressure on bad actors, with phishing kit playbooks and keylogger capabilities remaining largely unchanged since the mid-2000s."
ACM CCS 2017,Certified Verification of Algebraic Properties on Low-Level Mathematical Constructs in Cryptographic Programs.,"Mathematical constructs are necessary for computation on the underlying algebraic structures of cryptosystems. They are often written in assembly language and optimized manually for efficiency. We develop a certified technique to verify low-level mathematical constructs in X25519, the default elliptic curve Diffie-Hellman key exchange protocol used in OpenSSH. Our technique translates an algebraic specification of mathematical constructs into an algebraic problem. The algebraic problem in turn is solved by the computer algebra system Singular. The proof assistant Coq certifies the translation and solution to algebraic problems. Specifications about output ranges and potential program overflows are translated to SMT problems and verified by SMT solvers. We report our case studies on verifying arithmetic computation over a large finite field and the Montgomery Ladderstep, a crucial loop in X25519."
ACM CCS 2017,Key Reinstallation Attacks - Forcing Nonce Reuse in WPA2.,"We introduce the key reinstallation attack. This attack abuses design or implementation flaws in cryptographic protocols to reinstall an already-in-use key. This resets the key's associated parameters such as transmit nonces and receive replay counters. Several types of cryptographic Wi-Fi handshakes are affected by the attack. All protected Wi-Fi networks use the 4-way handshake to generate a fresh session key. So far, this 14-year-old handshake has remained free from attacks, and is even proven secure. However, we show that the 4-way handshake is vulnerable to a key reinstallation attack. Here, the adversary tricks a victim into reinstalling an already-in-use key. This is achieved by manipulating and replaying handshake messages. When reinstalling the key, associated parameters such as the incremental transmit packet number (nonce) and receive packet number (replay counter) are reset to their initial value. Our key reinstallation attack also breaks the PeerKey, group key, and Fast BSS Transition (FT) handshake. The impact depends on the handshake being attacked, and the data-confidentiality protocol in use. Simplified, against AES-CCMP an adversary can replay and decrypt (but not forge) packets. This makes it possible to hijack TCP streams and inject malicious data into them. Against WPA-TKIP and GCMP the impact is catastrophic: packets can be replayed, decrypted, and forged. Because GCMP uses the same authentication key in both communication directions, it is especially affected. Finally, we confirmed our findings in practice, and found that every Wi-Fi device is vulnerable to some variant of our attacks. Notably, our attack is exceptionally devastating against Android 6.0: it forces the client into using a predictable all-zero encryption key."
ACM CCS 2017,The Dynamics of Innocent Flesh on the Bone - Code Reuse Ten Years Later.,"In 2007, Shacham published a seminal paper on Return-Oriented Programming (ROP), the first systematic formulation of code reuse. The paper has been highly influential, profoundly shaping the way we still think about code reuse today: an attacker analyzes the ""geometry"" of victim binary code to locate gadgets and chains these to craft an exploit. This model has spurred much research, with a rapid progression of increasingly sophisticated code reuse attacks and defenses over time. After ten years, the common perception is that state-of-the-art code reuse defenses are effective in significantly raising the bar and making attacks exceedingly hard."
ACM CCS 2017,The Wolf of Name Street - Hijacking Domains Through Their Nameservers.,"The functionality and security of all domain names are contingent upon their nameservers. When these nameservers, or requests to them, are compromised, all domains that rely on them are affected. In this paper, we study the exploitation of configuration issues (typosquatting and outdated WHOIS records) and hardware errors (bitsquatting) to seize control over nameservers' requests to hijack domains. We perform a large-scale analysis of 10,000 popular nameserver domains, in which we map out existing abuse and vulnerable entities. We confirm the capabilities of these attacks through real-world measurements. Overall, we find that over 12,000 domains are susceptible to near-immediate compromise, while 52.8M domains are being targeted by nameserver bitsquatters that respond with rogue IP addresses. Additionally, we determine that 1.28M domains are at risk of a denial-of-service attack by relying on an outdated nameserver."
ACM CCS 2017,Full Accounting for Verifiable Outsourcing.,"Systems for verifiable outsourcing incur costs for a prover, a verifier, and precomputation; outsourcing makes sense when the combination of these costs is cheaper than not outsourcing. Yet, when prior works impose quantitative thresholds to analyze whether outsourcing is justified, they generally ignore prover costs. Verifiable ASICs (VA)---in which the prover is a custom chip---is the other way around: its cost calculations ignore precomputation."
ACM CCS 2017,Leaky Cauldron on the Dark Land - Understanding Memory Side-Channel Hazards in SGX.,"Side-channel risks of Intel SGX have recently attracted great attention. Under the spotlight is the newly discovered page-fault attack, in which an OS-level adversary induces page faults to observe the page-level access patterns of a protected process running in an SGX enclave. With almost all proposed defense focusing on this attack, little is known about whether such efforts indeed raise the bar for the adversary, whether a simple variation of the attack renders all protection ineffective, not to mention an in-depth understanding of other attack surfaces in the SGX system. In the paper, we report the first step toward systematic analyses of side-channel threats that SGX faces, focusing on the risks associated with its memory management. Our research identifies 8 potential attack vectors, ranging from TLB to DRAM modules. More importantly, we highlight the common misunderstandings about SGX memory side channels, demonstrating that high frequent AEXs can be avoided when recovering EdDSA secret key through a new page channel and fine-grained monitoring of enclave programs (at the level of 64B) can be done through combining both cache and cross-enclave DRAM channels. Our findings reveal the gap between the ongoing security research on SGX and its side-channel weaknesses, redefine the side-channel threat model for secure enclaves, and can provoke a discussion on when to use such a system and how to use it securely."
ACM CCS 2017,Authenticated Garbling and Efficient Maliciously Secure Two-Party Computation.,"We propose a simple and efficient framework for obtaining efficient constant-round protocols for maliciously secure two-party computation. Our framework uses a function-independent preprocessing phase to generate authenticated information for the two parties; this information is then used to construct a single ""authenticated"" garbled circuit which is transmitted and evaluated. We also show how to efficiently instantiate the preprocessing phase with a new, highly optimized version of the TinyOT protocol by Nielsen et al."
ACM CCS 2017,Global-Scale Secure Multiparty Computation.,"We propose a new, constant-round protocol for multi-party computation of boolean circuits that is secure against an arbitrary number of malicious corruptions. At a high level, we extend and generalize recent work of Wang et al. in the two-party setting. Namely, we design an efficient preprocessing phase that allows the parties to generate authenticated information; we then show how to use this information to distributively construct a single ""authenticated"" garbled circuit that is evaluated by one party."
ACM CCS 2017,Object Flow Integrity.,"Object flow integrity (OFI) augments control-flow integrity (CFI) and software fault isolation (SFI) protections with secure, first-class support for binary object exchange across inter-module trust boundaries. This extends both source-aware and source-free CFI and SFI technologies to a large class of previously unsupported software: those containing immutable system modules with large, object-oriented APIs---which are particularly common in component-based, event-driven consumer software. It also helps to protect these inter-module object exchanges against confused deputy-assisted vtable corruption and counterfeit object-oriented programming attacks."
ACM CCS 2017,Cryptographically Secure Information Flow Control on Key-Value Stores.,"We present Clio, an information flow control (IFC) system that transparently incorporates cryptography to enforce confidentiality and integrity policies on untrusted storage. Clio insulates developers from explicitly manipulating keys and cryptographic primitives by leveraging the policy language of the IFC system to automatically use the appropriate keys and correct cryptographic operations. We prove that Clio is secure with a novel proof technique that is based on a proof style from cryptography together with standard programming languages results. We present a prototype Clio implementation and a case study that demonstrates Clio's practicality."
ACM CCS 2017,STACCO - Differentially Analyzing Side-Channel Traces for Detecting SSL/TLS Vulnerabilities in Secure Enclaves.,"Intel Software Guard Extension (SGX) offers software applications a shielded execution environment, dubbed enclave, to protect their confidentiality and integrity from malicious operating systems. As processors with this extended feature become commercially available, many new software applications are developed to enrich to the SGX-enabled ecosystem. One important primitive for these applications is a secure communication channel between the enclave and a remote trusted party. The SSL/TLS protocol, which is the de facto standard for protecting transport-layer network communications, has been broadly regarded a natural choice for such purposes. However, in this paper, we show that the marriage between SGX and SSL may not be smooth sailing."
ACM CCS 2017,Designing New Operating Primitives to Improve Fuzzing Performance.,"Fuzzing is a software testing technique that finds bugs by repeatedly injecting mutated inputs to a target program. Known to be a highly practical approach, fuzzing is gaining more popularity than ever before. Current research on fuzzing has focused on producing an input that is more likely to trigger a vulnerability."
ACM CCS 2017,Neural Network-based Graph Embedding for Cross-Platform Binary Code Similarity Detection.,"The problem of cross-platform binary code similarity detection aims at detecting whether two binary functions coming from different platforms are similar or not. It has many security applications, including plagiarism detection, malware detection, vulnerability search, etc. Existing approaches rely on approximate graph-matching algorithms, which are inevitably slow and sometimes inaccurate, and hard to adapt to a new task. To address these issues, in this work, we propose a novel neural network-based approach to compute the embedding, i.e., a numeric vector, based on the control flow graph of each binary function, then the similarity detection can be done efficiently by measuring the distance between the embeddings for two functions. We implement a prototype called Gemini. Our extensive evaluation shows that Gemini outperforms the state-of-the-art approaches by large margins with respect to similarity detection accuracy. Further, Gemini can speed up prior art's embedding generation time by 3 to 4 orders of magnitude and reduce the required training time from more than 1 week down to 30 minutes to 10 hours. Our real world case studies demonstrate that Gemini can identify significantly more vulnerable firmware images than the state-of-the-art, i.e., Genius. Our research showcases a successful application of deep learning on computer security problems."
ACM CCS 2017,Automated Crowdturfing Attacks and Defenses in Online Review Systems.,"Malicious crowdsourcing forums are gaining traction as sources of spreading misinformation online, but are limited by the costs of hiring and managing human workers. In this paper, we identify a new class of attacks that leverage deep learning language models (Recurrent Neural Networks or RNNs) to automate the generation of fake online reviews for products and services. Not only are these attacks cheap and therefore more scalable, but they can control rate of content output to eliminate the signature burstiness that makes crowdsourced campaigns easy to detect."
ACM CCS 2017,Provably-Secure Logic Locking - From Theory To Practice.,"Logic locking has been conceived as a promising proactive defense strategy against intellectual property (IP) piracy, counterfeiting, hardware Trojans, reverse engineering, and overbuilding attacks. Yet, various attacks that use a working chip as an oracle have been launched on logic locking to successfully retrieve its secret key, undermining the defense of all existing locking techniques. In this paper, we propose stripped-functionality logic locking (SFLL), which strips some of the functionality of the design and hides it in the form of a secret key(s), thereby rendering on-chip implementation functionally different from the original one. When loaded onto an on-chip memory, the secret keys restore the original functionality of the design. Through security-aware synthesis that creates a controllable mismatch between the reverse-engineered netlist and original design, SFLL provides a quantifiable and provable resilience trade-off between all known and anticipated attacks. We demonstrate the application of SFLL to large designs (>100K gates) using a computer-aided design (CAD) framework that ensures attaining the desired security level at minimal implementation cost, 8%, 5%, and 0.5% for area, power, and delay, respectively. In addition to theoretical proofs and simulation confirmation of SFLL's security, we also report results from the silicon implementation of SFLL on an ARM Cortex-M0 microprocessor in 65nm technology."
