conference,title,abstract
ACM CCS 2010,"Synchronized aggregate signatures - new definitions, constructions and applications.","An aggregate signature scheme is a digital signature scheme where anyone given n signatures on n messages from n users can aggregate all these signatures into a single short signature. Unfortunately, no ""fully non-interactive"" aggregate signature schemes are known outside of the random oracle heuristic; that is, signers must pass messages between themselves, sequentially or otherwise, to generate the signature. Interaction is too costly for some interesting applications."
ACM CCS 2010,Predictive black-box mitigation of timing channels.,"We investigate techniques for general black-box mitigation of timing channels. The source of events is wrapped by a timing mitigator that delays output events so that they contain only a bounded amount of information. We introduce a general class of timing mitigators that can achieve any given bound on timing channel leakage, with a tradeoff in system performance. We show these mitigators compose well with other mechanisms for information flow control, and demonstrate they are effective against some known timing attacks."
ACM CCS 2010,HyperSentry - enabling stealthy in-context measurement of hypervisor integrity.,"This paper presents HyperSentry, a novel framework to enable integrity measurement of a running hypervisor (or any other highest privileged software layer on a system). Unlike existing solutions for protecting privileged software, HyperSentry does not introduce a higher privileged software layer below the integrity measurement target, which could start another race with malicious attackers in obtaining the highest privilege in the system. Instead, HyperSentry introduces a software component that is properly isolated from the hypervisor to enable stealthy and in-context measurement of the runtime integrity of the hypervisor. While stealthiness is necessary to ensure that a compromised hypervisor does not have a chance to hide the attack traces upon detecting an up-coming measurement, in-context measurement is necessary to retrieve all the needed inputs for a successful integrity measurement."
ACM CCS 2010,Computationally sound verification of source code.,"Increasing attention has recently been given to the formal verification of the source code of cryptographic protocols. The standard approach is to use symbolic abstractions of cryptography that make the analysis amenable to automation. This leaves the possibility of attacks that exploit the mathematical properties of the cryptographic algorithms themselves. In this paper, we show how to conduct the protocol analysis on the source code level (F# in our case) in a computationally sound way, i.e., taking into account cryptographic security definitions."
ACM CCS 2010,PinDr0p - using single-ended audio features to determine call provenance.,"The recent diversification of telephony infrastructure allows users to communicate through landlines, mobile phones and VoIP phones. However, call metadata such as Caller-ID is either not transferred or transferred without verification across these networks, allowing attackers to maliciously alter it. In this paper, we develop PinDr0p, a mechanism to assist users in determining call provenance - the source and the path taken by a call. Our techniques detect and measure single-ended audio features to identify all of the applied voice codecs, calculate packet loss and noise profiles, while remaining agnostic to characteristics of the speaker's voice (as this may legitimately change when interacting with a large organization). In the absence of verifiable call metadata, these features in combination with machine learning allow us to determine the traversal of a call through as many as three different providers (e.g., cellular, then VoIP, then PSTN and all combinations and subsets thereof) with 91.6% accuracy. Moreover, we show that once we identify and characterize the networks traversed, we can create detailed fingerprints for a call source. Using these fingerprints we show that we are able to distinguish between calls made using specific PSTN, cellular, Vonage, Skype and other hard and soft phones from locations across the world with over 90% accuracy. In so doing, we provide a first step in accurately determining the provenance of a call."
ACM CCS 2010,A methodology for empirical analysis of permission-based security models and its application to android.,"Permission-based security models provide controlled access to various system resources. The expressiveness of the permission set plays an important role in providing the right level of granularity in access control. In this work, we present a methodology for the empirical analysis of permission-based security models which makes novel use of the Self-Organizing Map (SOM) algorithm of Kohonen (2001). While the proposed methodology may be applicable to a wide range of architectures, we analyze 1,100 Android applications as a case study. Our methodology is of independent interest for visualization of permission-based systems beyond our present Android-specific empirical analysis. We offer some discussion identifying potential points of improvement for the Android permission model attempting to increase expressiveness where needed without increasing the total number of permissions or overall complexity."
ACM CCS 2010,Computational indistinguishability logic.,"Computational Indistinguishability Logic (CIL) is a logic for reasoning about cryptographic primitives in computational models. It captures reasoning patterns that are common in provable security, such as simulations and reductions. CIL is sound for the standard model, but also supports reasoning in the random oracle and other idealized models."
ACM CCS 2010,Enhancing resilience of probabilistic key pre-distribution schemes for WSNs through hash chaining.,"We propose, in this paper, a novel class of probabilistic key pre-distribution schemes highly resilient against node capture. We introduce a new approach to enhance resilience by concealing keys through the use of a simple hash chaining mechanism. We provide analytical analysis which shows that our solution enhances the network resilience against node capture without introducing a new overhead comparatively to similar solutions in the literature."
ACM CCS 2010,NoTamper - automatic blackbox detection of parameter tampering opportunities in web applications.,"Web applications rely heavily on client-side computation to examine and validate form inputs that are supplied by a user (e.g., ""credit card expiration date must be valid""). This is typically done for two reasons: to reduce burden on the server and to avoid latencies in communicating with the server. However, when a server fails to replicate the validation performed on the client, it is potentially vulnerable to attack. In this paper, we present a novel approach for automatically detecting potential server-side vulnerabilities of this kind in existing (legacy) web applications through blackbox analysis. We discuss the design and implementation of NoTamper, a tool that realizes this approach. NoTamper has been employed to discover several previously unknown vulnerabilities in a number of open-source web applications and live web sites."
ACM CCS 2010,TAPS - automatically preparing safe SQL queries.,We present the first sound program transformation approach for automatically transforming the code of a legacy web application to employ PREPARE statements in place of unsafe SQL queries. Our approach therefore opens the way for eradicating the SQL injection threat vector from legacy web applications. This extended abstract is based on our paper[4] that appeared in the Financial Cryptography and Data Security (FC'2010) conference.
ACM CCS 2010,Algebraic pseudorandom functions with improved efficiency from the augmented cascade.,"We construct an algebraic pseudorandom function (PRF) that is more efficient than the classic Naor-Reingold algebraic PRF. Our PRF is the result of adapting the cascade construction, which is the basis of HMAC, to the algebraic settings. To do so we define an augmented cascade and prove it secure when the underlying PRF satisfies a property called parallel security. We then use the augmented cascade to build new algebraic PRFs. The algebraic structure of our PRF leads to an efficient large-domain Verifiable Random Function (VRF) and a large-domain simulatable VRF."
ACM CCS 2010,Attacking and fixing PKCS#11 security tokens.,"We show how to extract sensitive cryptographic keys from a variety of commercially available tamper resistant cryptographic security tokens, exploiting vulnerabilities in their RSA PKCS#11 based APIs. The attacks are performed by Tookan, an automated tool we have developed, which reverse-engineers the particular token in use to deduce its functionality, constructs a model of its API for a model checker, and then executes any attack trace found by the model checker directly on the token. We describe the operation of Tookan and give results of testing the tool on 17 commercially available tokens: 9 were vulnerable to attack, while the other 8 had severely restricted functionality. One of the attacks found by the model checker has not previously appeared in the literature. We show how Tookan may be used to verify patches to insecure devices, and give a secure configuration that we have implemented in a patch to a software token simulator. This is the first such configuration to appear in the literature that does not require any new cryptographic mechanisms to be added to the standard. We comment on lessons for future key management APIs."
ACM CCS 2010,Protecting portable storage with host validation.,"Portable storage devices, such as key-chain USB devices, are ubiquitous and used everywhere; users repeatedly use the same storage device in open computer laboratories, Internet cafes, and on office and home computers. Consequently, they are the target of malware that exploit the data present or use them as a means to propagate malicious software., e.g., Conficker and Agent.bz. We present the Kells mobile storage system, which limits untrusted or unknown systems from accessing sensitive data by continuously validating the accessing host's integrity state. We explore the design and operation of Kells, and implement a proof-of-concept USB 2.0 storage device of experimental hardware. Our experiments indicate nominal overheads associated with host validation, with a worst-case throughput overhead of 1.22% for reads and 2.78% for writes."
ACM CCS 2010,Input generation via decomposition and re-stitching - finding bugs in Malware.,"Attackers often take advantage of vulnerabilities in benign software, and the authors of benign software must search their code for bugs in hopes of finding vulnerabilities before they are exploited. But there has been little research on the converse question of whether defenders can turn the tables by finding vulnerabilities in malware. We provide a first affirmative answer to that question. We introduce a new technique, stitched dynamic symbolic execution, that makes it possible to use exploration techniques based on symbolic execution in the presence of functionalities that are common in malware and otherwise hard to analyze, such as decryption and checksums. The technique is based on decomposing the constraints induced by a program, solving only a subset, and then re-stitching the constraint solution into a complete input. We implement the approach in a system for x86 binaries, and apply it to 4 prevalent families of bots and other malware. We find 6 bugs that could be exploited by a network attacker to terminate or subvert the malware. These bugs have persisted across malware revisions for months, and even years. We discuss the possible applications and ethical considerations of this new capability"
ACM CCS 2010,Virtual browser - a web-level sandbox to secure third-party JavaScript without sacrificing functionality.,"Third-party JavaScript offers much more diversity to Web and its applications but also introduces new threats. Those scripts cannot be completely trusted and executed with the privileges given to host web sites. Due to incomplete virtualization and lack of tracking all the data flows, all the existing works in this area can secure only a subset of third-party JavaScript. At the same time, because of the existence of not so well documented browser quirks, attacks may be encoded in non standard HTML/JavaScript so that they can bypass existing approaches as these approaches will parse third-party JavaScript twice, at both server and client side."
ACM CCS 2010,Retaining sandbox containment despite bugs in privileged memory-safe code.,"Flaws in the standard libraries of secure sandboxes represent a major security threat to billions of devices worldwide. The standard libraries are hard to secure because they frequently need to perform low-level operations that are forbidden in untrusted application code. Existing designs have a single, large trusted computing base that contains security checks at the boundaries between trusted and untrusted code. Unfortunately, flaws in the standard library often allow an attacker to escape the security protections of the sandbox."
ACM CCS 2010,Platform-independent programs.,"Given a single program (i.e., bit string), one may assume that the program's behaviors can be determined by first identifying the native runtime architecture and then executing the program on that architecture. In this paper, we challenge the notion that programs run on a single architecture by developing techniques that automatically create a single program string that a) runs on different architectures, and b) potentially has different behaviors depending upon which architecture it runs on. At a high level, a primary security implication is that any program analysis done on a program must only be considered valid for the assumed architecture. Our techniques also introduce a new type of steganography that hides execution behaviors. In order to demonstrate our techniques, we implement a system for generating platform-independent programs for x86, ARM, and MIPS. We use our system to generate real platform-independent programs."
ACM CCS 2010,CardSpace in the cloud.,"This paper describes a web based federated identity management system which is based on the user centric approach of the Information Card model, and has been enhanced to remove many of the problems inherent in Microsoft's original design. Furthermore the new design is adapted to interwork with existing SAML 2 federations. Our model supports not only improved user mobility and the aggregation of claims from multiple identity providers (IdPs), but also user authentication via just one of the IdPs without placing any constraints on the authentication mechanism that is used. This is achieved by introducing a new component, the Linking Identity Selector, which allows the user to select multiple cards at service provision time. Users can then use the combined set of credentials to access a wider range of web based resources. We describe our first example application which allows the user to present a credit card, a self asserted card, a hotel loyalty card and a frequent flyer card in order to make an online hotel booking, using voice biometrics for authentication."
ACM CCS 2010,Secure latency estimation with treeple.,"A network latency estimation scheme associates a ""position"" to every peer in a distributed network such that the latency between any two nodes can be accurately estimated from their positions. Applications for these schemes include efficient overlay construction, compact routing, anonymous route selection, and efficient byzantine agreement. We present a new latency estimation scheme, Treeple. Our scheme is different from existing ones in several aspects: Treeple is provably secure, rather than being able to resist known attacks; positions in Treeple are not Euclidean coordinates and reflect the underlying network topology; finally, positions in Treeple are accurate, stable, and can be assigned to peers not participating in the system."
ACM CCS 2010,Symbolic security analysis of ruby-on-rails web applications.,"Many of today's web applications are built on frameworks that include sophisticated defenses against malicious adversaries. However, mistakes in the way developers deploy those defenses could leave applications open to attack. To address this issue, we introduce Rubyx, a symbolic executor that we use to analyze Ruby-on-Rails web applications for security vulnerabilities. Rubyx specifications can easily be adapted to variety of properties, since they are built from general assertions, assumptions, and object invariants. We show how to write Ruby specifications to detect susceptibility to cross-site scripting and cross-site request forgery, insufficient authentication, leaks of secret information, insufficient access control, as well as application-specific security properties. We used Rubyx to check seven web applications from various sources against out specifications. We found many vulnerabilities, and each application was subject to at least one critical attack. Encouragingly, we also found that it was relatively easy to fix most vulnerabilities, and that Rubyx showed the absence of attacks after our fixes. Our results suggest that Rubyx is a promising new way to discover security vulnerabilities in Ruby-on-Rails web applications."
ACM CCS 2010,Return-oriented programming without returns.,"We show that on both the x86 and ARM architectures it is possible to mount return-oriented programming attacks without using return instructions. Our attacks instead make use of certain instruction sequences that behave like a return, which occur with sufficient frequency in large libraries on (x86) Linux and (ARM) Android to allow creation of Turing-complete gadget sets."
ACM CCS 2010,Inference and analysis of formal models of botnet command and control protocols.,"We propose a novel approach to infer protocol state machines in the realistic high-latency network setting, and apply it to the analysis of botnet Command and Control (C &C) protocols. Our proposed techniques enable an order of magnitude reduction in the number of queries and time needed to learn a botnet C &C protocol compared to classic algorithms (from days to hours for inferring the MegaD C &C protocol). We also show that the computed protocol state machines enable formal analysis for botnet defense, including finding the weakest links in a protocol, uncovering protocol design flaws, inferring the existence of unobservable communication back-channels among botnet servers, and finding deviations of protocol implementations which can be used for fingerprinting. We validate our technique by inferring the protocol state-machine from Postfix's SMTP implementation and comparing the inferred state-machine to the SMTP standard. Further, our experimental results offer new insights into MegaD's C &C, showing our technique can be used as a powerful tool for defense against botnets."
ACM CCS 2010,Practical leakage-resilient identity-based encryption from simple assumptions.,"We design the first Leakage-Resilient Identity-Based Encryption (LR-IBE) systems from static assumptions in the standard model. We derive these schemes by applying a hash proof technique from Alwen et.al. (Eurocrypt '10) to variants of the existing IBE schemes of Boneh-Boyen, Waters, and Lewko-Waters. As a result, we achieve leakage-resilience under the respective static assumptions of the original systems in the standard model, while also preserving the efficiency of the original schemes. Moreover, our results extend to the Bounded Retrieval Model (BRM), yielding the first regular and identity-based BRM encryption schemes from static assumptions in the standard model."
ACM CCS 2010,Dissecting one click frauds.,"""One Click Fraud"" is an online confidence scam that has been plaguing an increasing number of Japanese Internet users, in spite of new laws and the mobilization of police task forces. In this scam, the victim clicks on a link presented to them, only to be informed that they just entered a binding contract and are required to pay a registration fee for a service. Even though no money is legally owed, a large number of users prefer to pay up, because of potential embarrassment due to the type of service ""requested"" (e.g., pornographic goods)."
ACM CCS 2010,Dissent - accountable anonymous group messaging.,"Users often wish to participate in online groups anonymously, but misbehaving users may abuse this anonymity to disrupt the group's communication. Existing messaging protocols such as DC-nets leave groups vulnerable to denial-of-service and Sybil attacks, Mix-nets are difficult to protect against traffic analysis, and accountable voting protocols are unsuited to general anonymous messaging."
ACM CCS 2010,TEE - a virtual DRTM based execution environment for secure cloud-end computing.,"Cloud computing is believed to be the next major paradigm of computing because it will substantially reduce the cost of IT systems. Ensuring security in the cloud-end is necessary because customers' data are stored and processed there. Previous studies have mainly focused on secure cloud-end storage, whereas secure cloud-end computing is much less investigated. The current practice is solely based on Virtual Machines (VM), and cannot offer adequate security because the guest Operating Systems (OS) often can be easily breached (e.g., by exploiting their vulnerabilities). This motivates the need of solutions for more secure cloud-end computing. This poster presents the design, implementation and analysis of a candidate solution, called Trusted Execution Environment (TEE), which takes advantage of both virtualization and trusted computing technologies simultaneously. The novelty behind TEE is the virtualization of the Dynamic Root of Trust for Measurement (DRTM)."
ACM CCS 2010,On the (in)security of IPsec in MAC-then-encrypt configurations.,"IPsec allows a huge amount of flexibility in the ways in which its component cryptographic mechanisms can be combined to build a secure communications service. This may be good for supporting different security requirements but is potentially bad for security. We demonstrate the reality of this by describing efficient, plaintext-recovering attacks against all configurations of IPsec in which integrity protection is applied {\em prior} to encryption -- so-called MAC-then-encrypt configurations. We report on the implementation of our attacks against a specific IPsec implementation, and reflect on the implications of our attacks for real-world IPsec deployments as well as for theoretical cryptography."
ACM CCS 2010,Laptop theft - a case study on the effectiveness of security mechanisms in open organizations.,"Organizations rely on physical, technical and procedural mechanisms to protect their IT systems. Of all IT systems, laptops are the probably the most troublesome to protect, since they are easy to remove and conceal. When the thief has physical possession of the laptop, it is difficult to protect the data inside. Organizations open to the public, such as hospitals and universities, are easy targets for laptop thieves, since every day many people wander in the premises."
ACM CCS 2010,Information security for sensors by overwhelming random sequences and permutations.,"We propose efficient schemes for information-theoretically secure key exchange in the Bounded Storage Model (BSM), where the adversary is assumed to have limited storage. Our schemes generate a secret One Time Pad (OTP) shared by the sender and the receiver,from a large number of public random bits produced by the sender or by an external source. Our schemes initially generate a small number of shared secret bits, using known techniques. We introduce a new method to expand a small number of shared bits to a much longer, shared key."
ACM CCS 2010,On verifying stateful dataflow processing services in large-scale cloud systems.,"Cloud computing needs to provide integrity assurance in order to support security sensitive application services such as critical dataflow processing. In this paper, we present a novel RObust Service Integrity Attestation (ROSIA) framework that can efficiently verify the integrity of stateful dataflow processing services and pinpoint malicious service providers within a large-scale cloud system. ROSIA achieves robustness by supporting stateful dataflow services such as windowed stream operators, and performing integrated consistency check to detect colluding attacks. We have implemented ROSIA on top of the IBM System S dataflow processing system and tested it on the NCSU virtual computing lab. Our experimental results show that our scheme is feasible and efficient for large-scale cloud systems."
