conference,title,abstract
ACM CCS 2010,An empirical study of privacy-violating information flows in JavaScript web applications.,"The dynamic nature of JavaScript web applications has given rise to the possibility of privacy violating information flows. We present an empirical study of the prevalence of such flows on a large number of popular websites. We have (1) designed an expressive, fine-grained information flow policy language that allows us to specify and detect different kinds of privacy-violating flows in JavaScript code,(2) implemented a new rewriting-based JavaScript information flow engine within the Chrome browser, and (3) used the enhanced browser to conduct a large-scale empirical study over the Alexa global top 50,000 websites of four privacy-violating flows: cookie stealing, location hijacking, history sniffing, and behavior tracking. Our survey shows that several popular sites, including Alexa global top-100 sites, use privacy-violating flows to exfiltrate information about users' browsing behavior. Our findings show that steps must be taken to mitigate the privacy threat from covert flows in browsers."
ACM CCS 2010,Recruiting new tor relays with BRAIDS.,"Tor, a distributed Internet anonymizing system, relies on volunteers who run dedicated relays. Other than altruism, these volunteers have no incentive to run relays, causing a large disparity between the number of users and available relays. We introduce BRAIDS, a set of practical mechanisms that encourages users to run Tor relays, allowing them to earn credits redeemable for improved performance of both interactive and non-interactive Tor traffic. These performance incentives will allow Tor to support increasing resource demands with almost no loss in anonymity: BRAIDS is robust to well-known attacks. Using a simulation of 20,300 Tor nodes, we show that BRAIDS allows relays to achieve 75% lower latency than non-relays for interactive traffic, and 90% higher bandwidth utilization for non-interactive traffic."
ACM CCS 2010,Designing router scheduling policies - a privacy perspective.,"We examine a queuing side channel which results from a shared resource between two users in the context of packet networks. We consider the scenario where one of them is a legitimate user and the other is an attacker who is trying to learn about the former's activities. We show that the waiting time of an adversary sending a small but frequent probe stream to the shared resource (e.g., a router) is highly correlated with traffic pattern of the user."
ACM CCS 2010,Secure text processing with applications to private DNA matching.,"Motivated by the problem of private DNA matching, we consider the design of efficient protocols for secure text processing. Here, informally, a party P1 holds a text T and a party P2 holds a pattern p and some additional information y, and P2 wants to learn {f(T,j,y)} for all locations j where p is found as a substring in T. (In particular, this generalizes the basic pattern matching problem.) We aim for protocols with full security against a malicious P2 that also preserve privacy against a malicious P1 (i.e., one-sided security). We show how to modify Yao's garbled circuit approach to obtain a protocol where the size of the garbled circuit is linear in the number of occurrences of p in T (rather than linear in $|T|$). Along the way we show a new keyword search protocol that may be of independent interest."
ACM CCS 2010,CRAFT - a new secure congestion control architecture.,"Congestion control algorithms seek to optimally utilize network resources by allocating a certain rate for each user. However, malicious clients can disregard the congestion control algorithms implemented at the clients and induce congestion at bottleneck links. Thus, in an adversarial environment, the network must enforce the congestion control algorithm in order to attain the optimal network utilization offered by the algorithm. Prior work protects only a single link incident on the enforcement routers neglecting damage inflicted upon other downstream links. We present CRAFT, a capability-based scheme to secure all downstream links of a deploying router. Our goal is to enforce a network-wide congestion control algorithm on all flows. As a reference design, we develop techniques to enforce the TCP congestion control. Our design regulates all flows to share bandwidth resources in a TCP-fair manner by emulating the TCP state machine in a CRAFT router. As a result, once a flow passes a single CRAFT router, it is TCP-fair on all downstream links of that router."
ACM CCS 2010,Trail of bytes - efficient support for forensic analysis.,"For the most part, forensic analysis of computer systems requires that one first identify suspicious objects or events, and then examine them in enough detail to form a hypothesis as to their cause and effect. Sadly, while our ability to gather vast amounts of data has improved significantly over the past two decades, it is all too often the case that we tend to lack detailed information just when we need it the most. Simply put, the current state of computer forensics leaves much to be desired. In this paper, we attempt to improve on the state of the art by providing a forensic platform that transparently monitors and records data access events within a virtualized environment using only the abstractions exposed by the hypervisor. Our approach monitors accesses to objects on disk and follows the causal chain of these accesses across processes, even after the objects are copied into memory. Our forensic layer records these transactions in a version-based audit log that allows for faithful, and efficient, reconstruction of the recorded events and the changes they induced. To demonstrate the utility of our approach, we provide an extensive empirical evaluation, including a real-world case study demonstrating how our platform can be used to reconstruct valuable information about the what, when, and how, after a compromised has been detected."
ACM CCS 2010,Timing attacks on PIN input devices.,"Keypads are commonly used to enter personal identification numbers (PIN) which are intended to authenticate a user based on what they know. A number of those keypads such as ATM inputs and door keypads provide an audio feedback to the user for each button pressed. Such audio feedback are observable from a modest distance. We are looking at quantifying the information leaking from delays between acoustic feedback pulses. Preliminary experiments suggest that by using a Hidden Markov Model, it might be possible to substantially narrow the search space. A subsequent brute force search on the reduced search space could be possible with- out triggering alerts, lockouts or other mechanisms design to thwart plain brute force attempts."
ACM CCS 2010,Accountability - definition and relationship to verifiability.,"Many cryptographic tasks and protocols, such as non-repudiation, contract-signing, voting, auction, identity-based encryption, and certain forms of secure multi-party computation, involve the use of (semi-)trusted parties, such as notaries and authorities. It is crucial that such parties can be held accountable in case they misbehave as this is a strong incentive for such parties to follow the protocol. Unfortunately, there does not exist a general and convincing definition of accountability that would allow to assess the level of accountability a protocol provides."
ACM CCS 2010,AccessMiner - using system-centric models for malware protection.,"Models based on system calls are a popular and common approach to characterize the run-time behavior of programs. For example, system calls are used by intrusion detection systems to detect software exploits. As another example, policies based on system calls are used to sandbox applications or to enforce access control. Given that malware represents a significant security threat for today's computing infrastructure, it is not surprising that system calls were also proposed to distinguish between benign processes and malicious code."
ACM CCS 2010,SecTag - a multi-policy supported secure web tag framework.,"Traditional web application development often encounters tight coupling problem between access control logic and business logic. It is hard to configure and modify access control policies after a system has been deployed. In this demonstration, we present SecTag, a multi-policy supported secure web tag framework, to address this problem. We define a series of general-purpose secure attributes that meet the demand of fine-grained access control in web presentation layer. We also design a set of high interactive secure tags, which encapsulate secure features to provide reusable secure components for web development. A running example of SecTag is presented to demonstrate the effectiveness of the proposed framework."
ACM CCS 2010,Dialog-based payload aggregation for intrusion detection.,"Network-based Intrusion Detection Systems (IDSs) such as Snort or Bro that have to analyze the packet payload for all the received data show severe performance problems if used in high-speed networks. Recent research results improve pattern matchers based on efficient algorithms or using specialized hardware. We approach the problem in a completely different way by considerably reducing the amount of data to be analyzed with only marginal impact on the detection quality. Dialog-based Payload Aggregation (DPA) uses TCP sequence numbers to decide which parts of the payload need to be analyzed by the IDS. Whenever a connection starts, or if the direction of the data transmission between peers changes, we forward the next N bytes of traffic to an attached IDS. All data transferred after the window is discarded. Our analysis using live network traffic and multiple Snort rulesets shows that most of the pattern matches occur at the beginning of connections or directly after direction changes in the data streams. According to our experimental results, our method reduces the data rate to be processed to around 1% in a typical network while retaining more than 98% of all detected events. Assuming a linear relationship between the data rate and processing time of an IDS, this results in a speedup of two magnitudes in the best case."
ACM CCS 2010,BLADE - an attack-agnostic approach for preventing drive-by malware infections.,"Web-based surreptitious malware infections (i.e., drive-by downloads) have become the primary method used to deliver malicious software onto computers across the Internet. To address this threat, we present a browser independent operating system kernel extension designed to eliminate driveby malware installations. The BLADE (Block All Drive-by download Exploits) system asserts that all executable files delivered through browser downloads must result from explicit user consent and transparently redirects every unconsented browser download into a nonexecutable secure zone of disk. BLADE thwarts the ability of browser-based exploits to surreptitiously download and execute malicious content by remapping to the file system only those browser downloads to which a programmatically inferred user-consent is correlated, BLADE provides its protection without explicit knowledge of any exploits and is thus resilient against code obfuscation and zero-day threats that directly contribute to the pervasiveness of today's drive-by malware. We present the design of our BLADE prototype implementation for the Microsoft Windows platform, and report results from as extensive empirical evaluation of its effectiveness on popular browsers. Our evaluation includes multiple versions of IE and Firefox, against 1,934 active malicious URLs, representing a broad spectrum of web-based exploits not plaguing the Internet. BLADE successfully blocked all drive-by malware install attempts with zero false positives and a 3% worst-case performance cost."
ACM CCS 2010,On the soundness of authenticate-then-encrypt - formalizing the malleability of symmetric encryption.,"A communication channel from an honest sender A to an honest receiver B can be described as a system with three interfaces labeled A, B, and E (the adversary), respectively, where the security properties of the channel are characterized by the capabilities provided at the E-interface."
ACM CCS 2010,Protecting location privacy against inference attacks.,"GPS-enabled mobile devices are a quickly growing market and users are starting to share their location information with each other through services such as Google Latitude. Location information, however, is very privacy-sensitive since it can be used to infer activities, preferences, relationships, and other personal information, and thus access to it must be carefully protected. We provide a formal definition of location privacy that incorporates an adversary's ability to predict location and discuss possible implementation of access control mechanisms that satisfy this definition. To support our reasoning, we analyze a preliminary data set to evaluate the accuracy of location prediction."
ACM CCS 2010,Abstraction by set-membership - verifying security protocols and web services with databases.,"The abstraction and over-approximation of protocols and web services by a set of Horn clauses is a very successful method in practice. It has however limitations for protocols and web services that are based on databases of keys, contracts, or even access rights, where revocation is possible, so that the set of true facts does not monotonically grow with state transitions. We extend the scope of these over-approximation methods by defining a new way of abstraction that can handle such databases, and we formally prove that the abstraction is sound. We realize a translator from a convenient specification language to standard Horn clauses and use the verifier ProVerif and the theorem prover SPASS to solve them. We show by a number of examples that this approach is practically feasible for wide variety of verification problems of security protocols and web services"
ACM CCS 2010,Designs to account for trust in social network-based sybil defenses.,"Social network-based Sybil defenses exploit the trust exhibited in social graphs to detect Sybil nodes that disrupt an algorithmic property (i.e., the fast mixing) in these graphs. The performance of these defenses depends on the quality of the algorithmic property and assuming a strong trust model in the underlying graph. While it is natural to think of trust value associated with the social graphs, Sybil defenses have used the social graphs without this consideration. In this paper we study paramagnetic designs to tune the performance of Sybil defenses by accounting for trust in social graphs and modeling the trust as modified random walks. Our designs are motivated by the observed relationship between the algorithmic property required for the defenses to perform well and a hypothesized trust value in the underlying graphs."
ACM CCS 2010,"Secure encounter-based social networks - requirements, challenges, and designs.","In this paper we outline requirements, challenges, and designs for encounter-based mobile social networks, where relationships are based on a temporarily shared location. To illustrate the challenges we examine a recently proposed design, SMILE, against a set of functional and security requirements. We show that SMILE is vulnerable to several attacks such as impersonation, collusion, and privacy breaching, even though it was built with the explicit goal of resisting some of those attacks. With this in mind, we construct a flexible framework for secure mobile social networks, and describe how to use it in order to construct several networks which offer somewhat different security properties. Each of the designs is then examined against the ideal requirements where some are shown to outperform previous work."
ACM CCS 2010,DieHarder - securing the heap.,"Heap-based attacks depend on a combination of memory management error and an exploitable memory allocator. Many allocators include ad hoc countermeasures against particular exploits but their effectiveness against future exploits has been uncertain. This paper presents the first formal treatment of the impact of allocator design on security. It analyzes a range of widely-deployed memory allocators, including those used by Windows, Linux, FreeBSD and OpenBSD, and shows that they remain vulnerable to attack. It them presents DieHarder, a new allocator whose design was guided by this analysis. DieHarder provides the highest degree of security from heap-based attacks of any practical allocator of which we are aware while imposing modest performance overhead. In particular, the Firefox web browser runs as fast with DieHarder as with the Linux allocator."
ACM CCS 2010,Secure online banking on untrusted computers.,"Frauds and attacks for online banking are increasing quickly. The major platform for current online banking, personal computer, has become untrusted especially under malware attacks. In this study, we design a smart card-based solution called secure online banking companion (SOBC) to address this problem. Portability and cost are also highly considered in the design. We have implemented a prototype of the solution on a Java Card simulator, which shows the solution can be implemented easily using current smart card technologies."
ACM CCS 2010,iFriendU - leveraging 3-cliques to enhance infiltration attacks in online social networks.,"Online Social Networks (OSNs) such as Facebook have become ubiquitous in the past few years, counting hundreds of millions of people as members. OSNs allow users to form friendship relationships, join groups, communicate and share information with friends. The tremendous popularity of OSNs has naturally made them an appealing target for privacy compromising attacks. In this abstract we propose a novel attack against tightly knit OSN communities. Such (artificial) communities consist of users that know well each other and that are reluctant to accept other users as friends. Becoming a member of such a community may be only a first milestone for the attacker. Harvesting private information of members of such communities and following up with offline attacks may be the longer term benefit."
ACM CCS 2010,Modeling attacks on physical unclonable functions.,"We show in this paper how several proposed Physical Unclonable Functions (PUFs) can be broken by numerical modeling attacks. Given a set of challenge-response pairs (CRPs) of a PUF, our attacks construct a computer algorithm which behaves indistinguishably from the original PUF on almost all CRPs. This algorithm can subsequently impersonate the PUF, and can be cloned and distributed arbitrarily. This breaks the security of essentially all applications and protocols that are based on the respective PUF. The PUFs we attacked successfully include standard Arbited PUFs and Ring Oscillator PUFs of arbitrary sizes, and XO Arbiter PUFs, Lightweight Secure PUFs, and Feed-Forward Arbiter PUFs of up to a given size and complexity. Our attacks are based upon various machine learning techniques including Logistic Regression and Evolution Strategies. Our work leads to new design requirements for secure electrical PUFs, and will be useful to PUF designers and attackers alike."
ACM CCS 2010,Worry-free encryption - functional encryption with public keys.,"In this work, we put forward the notion of Worry-Free Encryption. This allows Alice to encrypt confidential information under Bob's public key and send it to him, without having to worry about whether Bob has the authority to actually access this information. This is done by encrypting the message under a hidden access policy that only allows Bob to decrypt if his credentials satisfy the policy. Our notion can be seen as a functional encryption scheme but in a public-key setting. As such, we are able to insist that even if the credential authority is corrupted, it should not be able to compromise the security of any honest user."
ACM CCS 2010,Demonstrating cognitive packet network resilience to worm attacks.,"The need for network stability and reliability has led to the growth of autonomic networks that can provide more stable and more reliable communications via on-line measurement, learning and adaptation. A promising architecture is the Cognitive Packet Network (CPN) that rapidly adapts to varying network conditions and user requirements using QoS driven reinforcement learning algorithms that drive the routing control. Contrary to conventional mechanisms, the users rather than the nodes, control the routing by specifying their desired QoS requirements (QoS Goals), such as Minimum Delay, Maximum Bandwidth, Minimum Cost, etc., and the network then routes each user's traffic individually based on their specific needs and on a ""glocal"" view. In CPN the user has the ability to explore the network for its own needs, and evaluate its own impact on the network as a whole and vice-versa, and then take appropriate decisions. CPN routing has been evaluated extensively under normal operating conditions and has proven to be very adaptive to network changes such as congestion. Here we show how CPN can respond and survive to catastrophic node failures caused by the spread of network worms. This survival is based on two complementary approaches that are run concurrently: one the one hand, each user attempts to concurrently and adaptively avoid paths which are infected, and secondly patching algorithms are continuously run to repair the network. Experiments show that this approach assures the stability of network communications throughout the course of an attack."
ACM CCS 2010,Survivable key compromise in software update systems.,"Today's software update systems have little or no defense against key compromise. As a result, key compromises have put millions of software update clients at risk. Here we identify three classes of information whose authenticity and integrity are critical for secure software updates. Analyzing existing software update systems with our framework, we find their ability to communicate this information securely in the event of a key compromise to be weak or nonexistent. We also find that the security problems in current software update systems are compounded by inadequate trust revocation mechanisms. We identify core security principles that allow software update systems to survive key compromise. Using these ideas, we design and implement TUF, a software update framework that increases resilience to key compromise."
ACM CCS 2010,Losing control of the internet - using the data plane to attack the control plane.,"In this work, we introduce the Coordinated Cross Plane Session Termination, or CXPST, attack, a distributed denial of service attack that attacks the control plane of the Internet. CXPST extends previous work that demonstrates a vulnerability in routers that allows an adversary to disconnect a pair of routers using only data plane traffic. By carefully choosing BGP sessions to terminate, CXPST generates a surge of BGP updates that are seen by nearly all core routers on the Internet. This surge of updates surpasses the computational capacity of affected routers, crippling their ability to make routing decisions"
ACM CCS 2010,Size-based scheduling - a recipe for DDOS?,"Internet traffic measurements have shown that the majority of the Internet's flows are short, while a small percentage of the largest flows are responsible for most of the bytes. To exploit this property for performance improvement in routers and Web servers, several studies have proposed size-based schedulings to offer preferential treatment to the shortest flows. In this work, we present analytical and simulation results which confirm that size-based scheduling will ease the task of launching DDOS attacks on the Internet."
ACM CCS 2010,Robusta - taming the native beast of the JVM.,"Java applications often need to incorporate native-code components for efficiency and for reusing legacy code. However, it is well known that the use of native code defeats Java's security model. We describe the design and implementation of Robusta, a complete framework that provides safety and security to native code in Java applications. Starting from software-based fault isolation (SFI), Robusta isolates native code into a sandbox where dynamic linking/loading of libraries in supported and unsafe system modification and confidentiality violations are prevented. It also mediates native system calls according to a security policy by connecting to Java's security manager. Our prototype implementation of Robusta is based onNative Client and OpenJDK. Experiments in this prototype demonstrate Robusta is effective and efficient, with modest runtime overhead on a set of JNI benchmark programs. Robusta can be used to sandbox native libraries used in Java's system classes to prevent attackers from exploiting bugs in the libraries. It can also enable trustworthy execution of mobile Java programs with native libraries. The design of Robusta should also be applicable when other type-safe languages (e.g., C#, Python) want to ensure safe interoperation with native libraries"
