conference,title,abstract
ACM CCS 2017,Security and Machine Learning.,"Machine learning has seen increasing use for a wide range of practical applications. What are the security implications of relying upon machine learning in these settings? Recent research suggests that modern machine learning methods are fragile and easily attacked, which raises concerns about their use in security-critical settings. This talk will explore several attacks on machine learning and survey directions for making machine learning more robust against attack."
ACM CCS 2017,walk2friends - Inferring Social Links from Mobility Profiles.,"The development of positioning technologies has resulted in an increasing amount of mobility data being available. While bringing a lot of convenience to people's life, such availability also raises serious concerns about privacy. In this paper, we concentrate on one of the most sensitive information that can be inferred from mobility data, namely social relationships. We propose a novel social relation inference attack that relies on an advanced feature learning technique to automatically summarize users' mobility features. Compared to existing approaches, our attack is able to predict any two individuals' social relation, and it does not require the adversary to have any prior knowledge on existing social relations. These advantages significantly increase the applicability of our attack and the scope of the privacy assessment. Extensive experiments conducted on a large dataset demonstrate that our inference attack is effective, and achieves between 13% to 20% improvement over the best state-of-the-art scheme. We propose three defense mechanisms -- hiding, replacement and generalization -- and evaluate their effectiveness for mitigating the social link privacy risks stemming from mobility data sharing. Our experimental results show that both hiding and replacement mechanisms outperform generalization. Moreover, hiding and replacement achieve a comparable trade-off between utility and privacy, the former preserving better utility and the latter providing better privacy."
ACM CCS 2017,Bolt - Anonymous Payment Channels for Decentralized Currencies.,"Bitcoin owes its success to the fact that transactions are transparently recorded in the blockchain, a global public ledger that removes the need for trusted parties. Unfortunately, recording every transaction in the blockchain causes privacy, latency, and scalability issues. Building on recent proposals for ""micropayment channels"" --- two party associations that use the ledger only for dispute resolution --- we introduce techniques for constructing anonymous payment channels. Our proposals allow for secure, instantaneous and private payments that substantially reduce the storage burden on the payment network. Specifically, we introduce three channel proposals, including a technique that allows payments via untrusted intermediaries. We build a concrete implementation of our scheme and show that it can be deployed via a soft fork to existing anonymous currencies such as ZCash."
ACM CCS 2017,Cliptography - Post-Snowden Cryptography.,"This tutorial will present a systematic overview of {\em kleptography}: stealing information subliminally from black-box cryptographic implementations; and {\em cliptography}: defending mechanisms that clip the power of kleptographic attacks via specification re-designs (without altering the underlying algorithms). Despite the laudatory history of development of modern cryptography, applying cryptographic tools to reliably provide security and privacy in practice is notoriously difficult. One fundamental practical challenge, guaranteeing security and privacy without explicit trust in the algorithms and implementations that underlie basic security infrastructure, remains. While the dangers of entertaining adversarial implementation of cryptographic primitives seem obvious, the ramifications of such attacks are surprisingly dire: it turns out that -- in wide generality -- adversarial implementations of cryptographic (both deterministic and randomized) algorithms may leak private information while producing output that is statistically indistinguishable from that of a faithful implementation. Such attacks were formally studied in Kleptography. Snowden revelations has shown us how security and privacy can be lost at a very large scale even when traditional cryptography seems to be used to protect Internet communication, when Kleptography was not taken into consideration. We will first explain how the above-mentioned Kleptographic attacks can be carried out in various settings. We will then introduce several simple but rigorous immunizing strategies that were inspired by folklore practical wisdoms to protect different algorithms from implementation subversion. Those strategies can be applied to ensure security of most of the fundamental cryptographic primitives such as PRG, digital signatures, public key encryptions against kleptographic attacks when they are implemented accordingly. Our new design principles may suggest new standardization methods that help reducing the threats of subverted implementation. We also hope our tutorial to stimulate a community-wise efforts to further tackle the fundamental challenge mentioned at the beginning."
ACM CCS 2017,Where the Wild Warnings Are - Root Causes of Chrome HTTPS Certificate Errors.,"HTTPS error warnings are supposed to alert browser users to network attacks. Unfortunately, a wide range of non-attack circumstances trigger hundreds of millions of spurious browser warnings per month. Spurious warnings frustrate users, hinder the widespread adoption of HTTPS, and undermine trust in browser warnings. We investigate the root causes of HTTPS error warnings in the field, with the goal of resolving benign errors."
ACM CCS 2017,Efficient Public Trace and Revoke from Standard Assumptions - Extended Abstract.,"We provide efficient constructions for trace-and-revoke systems with public traceability in the black-box confirmation model. Our constructions achieve adaptive security, are based on standard assumptions and achieve significant efficiency gains compared to previous constructions."
ACM CCS 2017,FAME - Fast Attribute-based Message Encryption.,"Time and again, attribute-based encryption has been shown to be the natural cryptographic tool for building various types of conditional access systems with far-reaching applications, but the deployment of such systems has been very slow. A central issue is the lack of an encryption scheme that can operate on sensitive data very efficiently and, at the same time, provides features that are important in practice."
ACM CCS 2017,Economic Factors of Vulnerability Trade and Exploitation.,"Cybercrime markets support the development and diffusion of new attack technologies, vulnerability exploits, and malware. Whereas the revenue streams of cyber attackers have been studied multiple times in the literature, no quantitative account currently exists on the economics of attack acquisition and deployment. Yet, this understanding is critical to characterize the production of (traded) exploits, the economy that drives it, and its effects on the overall attack scenario. In this paper we provide an empirical investigation of the economics of vulnerability exploitation, and the effects of market factors on likelihood of exploit. Our data is collected first-handedly from a prominent Russian cybercrime market where the trading of the most active attack tools reported by the security industry happens. Our findings reveal that exploits in the underground are priced similarly or above vulnerabilities in legitimate bug-hunting programs, and that the refresh cycle of exploits is slower than currently often assumed. On the other hand, cybercriminals are becoming faster at introducing selected vulnerabilities, and the market is in clear expansion both in terms of players, traded exploits, and exploit pricing. We then evaluate the effects of these market variables on likelihood of attack realization, and find strong evidence of the correlation between market activity and exploit deployment. We discuss implications on vulnerability metrics, economics, and exploit measurement."
ACM CCS 2017,Jasmin - High-Assurance and High-Speed Cryptography.,"Jasmin is a framework for developing high-speed and high-assurance cryptographic software. The framework is structured around the Jasmin programming language and its compiler. The language is designed for enhancing portability of programs and for simplifying verification tasks. The compiler is designed to achieve predictability and efficiency of the output code (currently limited to x64 platforms), and is formally verified in the Coq proof assistant. Using the supercop framework, we evaluate the Jasmin compiler on representative cryptographic routines and conclude that the code generated by the compiler is as efficient as fast, hand-crafted, implementations. Moreover, the framework includes highly automated tools for proving memory safety and constant-time security (for protecting against cache-based timing attacks). We also demonstrate the effectiveness of the verification tools on a large set of cryptographic routines."
ACM CCS 2017,A Fast and Verified Software Stack for Secure Function Evaluation.,"We present a high-assurance software stack for secure function evaluation (SFE). Our stack consists of three components: i. a verified compiler (CircGen) that translates C programs into Boolean circuits; ii. a verified implementation of Yao's SFE protocol based on garbled circuits and oblivious transfer; and iii. transparent application integration and communications via FRESCO, an open-source framework for secure multiparty computation (MPC). CircGen is a general purpose tool that builds on CompCert, a verified optimizing compiler for C. It can be used in arbitrary Boolean circuit-based cryptography deployments. The security of our SFE protocol implementation is formally verified using EasyCrypt, a tool-assisted framework for building high-confidence cryptographic proofs, and it leverages a new formalization of garbled circuits based on the framework of Bellare, Hoang, and Rogaway (CCS 2012). We conduct a practical evaluation of our approach, and conclude that it is competitive with state-of-the-art (unverified) approaches. Our work provides concrete evidence of the feasibility of building efficient, verified, implementations of higher-level cryptographic systems. All our development is publicly available."
ACM CCS 2017,Practical Graphs for Optimal Side-Channel Resistant Memory-Hard Functions.,"A memory-hard function (MHF) ƒn with parameter n can be computed in sequential time and space n. Simultaneously, a high amortized parallel area-time complexity (aAT) is incurred per evaluation. In practice, MHFs are used to limit the rate at which an adversary (using a custom computational device) can evaluate a security sensitive function that still occasionally needs to be evaluated by honest users (using an off-the-shelf general purpose device). The most prevalent examples of such sensitive functions are Key Derivation Functions (KDFs) and password hashing algorithms where rate limits help mitigate off-line dictionary attacks. As the honest users' inputs to these functions are often (low-entropy) passwords special attention is given to a class of side-channel resistant MHFs called iMHFs."
ACM CCS 2017,Attribute-Based Encryption in the Generic Group Model - Automated Proofs and New Constructions.,"Attribute-based encryption (ABE) is a cryptographic primitive which supports fine-grained access control on encrypted data, making it an appealing building block for many applications. In this paper, we propose, implement, and evaluate fully automated methods for proving security of ABE in the Generic Bilinear Group Model (Boneh, Boyen, and Goh, 2005, Boyen, 2008), an idealized model which admits simpler and more efficient constructions, and can also be used to find attacks. Our method is applicable to Rational-Fraction Induced ABE, a large class of ABE that contains most of the schemes from the literature, and relies on a Master Theorem, which reduces security in the GGM to a (new) notion of symbolic security, which is amenable to automated verification using constraint-based techniques. We relate our notion of symbolic security for Rational-Fraction Induced ABE to prior notions for Pair Encodings. Finally, we present several applications, including automated proofs for new schemes."
ACM CCS 2017,Ligero - Lightweight Sublinear Arguments Without a Trusted Setup.,"We design and implement a simple zero-knowledge argument protocol for NP whose communication complexity is proportional to the square-root of the verification circuit size. The protocol can be based on any collision-resistant hash function. Alternatively, it can be made non-interactive in the random oracle model, yielding concretely efficient zk-SNARKs that do not require a trusted setup or public-key cryptography."
ACM CCS 2017,"Identity Related Threats, Vulnerabilities and Risk Mitigation in Online Social Networks - A Tutorial.","This tutorial provides a thorough review of the main research directions in the field of identity management and identity related security threats in Online Social Networks (OSNs). The continuous increase in the numbers and sophistication levels of fake accounts constitutes a big threat to the privacy and to the security of honest OSN users. Uninformed OSN users could be easily fooled into accepting friendship links with fake accounts, giving them by that access to personal information they intend to exclusively share with their real friends. Moreover, these fake accounts subvert the security of the system by spreading malware, connecting with honest users for nefarious goals such as sexual harassment or child abuse, and make the social computing environment mostly untrustworthy. The tutorial introduces the main available research results available in this area, and presents our work on collaborative identity validation techniques to estimate OSN profiles trustworthiness."
ACM CCS 2017,Defending Against Key Exfiltration - Efficiency Improvements for Big-Key Cryptography via Large-Alphabet Subkey Prediction.,"Towards advancing the use of big keys as a practical defense against key exfiltration, this paper provides efficiency improvements for cryptographic schemes in the bounded retrieval model (BRM). We identify probe complexity (the number of scheme accesses to the slow storage medium storing the big key) as the dominant cost. Our main technical contribution is what we call the large-alphabet subkey prediction lemma. It gives good bounds on the predictability under leakage of a random sequence of blocks of the big key, as a function of the block size. We use it to significantly reduce the probe complexity required to attain a given level of security. Together with other techniques, this yields security-preserving performance improvements for BRM symmetric encryption schemes and BRM public-key identification schemes."
ACM CCS 2017,Identity-Based Format-Preserving Encryption.,"We introduce identity-based format-preserving encryption (IB-FPE) as a way to localize and limit the damage to format-preserving encryption (FPE) from key exposure. We give definitions, relations between them, generic attacks and two transforms of FPE schemes to IB-FPE schemes. As a special case, we introduce and cover identity-based tweakable blockciphers. We apply all this to analyze DFF, an FPE scheme proposed to NIST for standardization."
ACM CCS 2017,Better Than Advertised - Improved Collision-Resistance Guarantees for MD-Based Hash Functions.,"The MD transform that underlies the MD and SHA families iterates a compression function h to get a hash function H. The question we ask is, what property X of h guarantees collision resistance (CR) of H? The classical answer is that X itself be CR. We show that weaker conditions X, in particular forms of what we call constrained-CR, suffice. This reduces demands on compression functions, to the benefit of security, and also, forensically, explains why collision-finding attacks on compression functions have not, historically, lead to immediate breaks of the corresponding hash functions. We obtain our results via a definitional framework called RS security, and a parameterized treatment of MD, that also serve to unify prior work and variants of the transform."
ACM CCS 2017,Algorithm Substitution Attacks from a Steganographic Perspective.,"The goal of an algorithm substitution attack (ASA), also called a subversion attack (SA), is to replace an honest implementation of a cryptographic tool by a subverted one which allows to leak private information while generating output indistinguishable from the honest output. Bellare, Paterson, and Rogaway provided at CRYPTO '14 a formal security model to capture this kind of attacks and constructed practically implementable ASAs against a large class of symmetric encryption schemes. At CCS'15, Ateniese, Magri, and Venturi extended this model to allow the attackers to work in a fully-adaptive and continuous fashion and proposed subversion attacks against digital signature schemes. Both papers also showed the impossibility of ASAs in cases where the cryptographic tools are deterministic. Also at CCS'15, Bellare, Jaeger, and Kane strengthened the original model and proposed a universal ASA against sufficiently random encryption schemes. In this paper we analyze ASAs from the perspective of steganography - the well known concept of hiding the presence of secret messages in legal communications. While a close connection between ASAs and steganography is known, this lacks a rigorous treatment. We consider the common computational model for secret-key steganography and prove that successful ASAs correspond to secure stegosystems on certain channels and vice versa. This formal proof allows us to conclude that ASAs are stegosystems and to ""rediscover"" several results concerning ASAs known in the steganographic literature."
ACM CCS 2017,Web Tracking Technologies and Protection Mechanisms.,"Billions of users browse the Web on a daily basis, leaving their digital traces on millions of websites. Every such visit, every mouse move or button click may trigger a wide variety of hidden data exchanges across multiple tracking companies. As a result, these companies collect a vast amount of user's data, preferences and habits, that are extremely useful for online advertisers and profitable for data brokers, however very worrisome for the privacy of the users. In this \emph{3-hours tutorial} we will cover the vide variety of Web tracking technologies, ranging from simple cookies to advanced cross-device fingerprinting. We will describe the main mechanisms behind web tracking and what users can do to protect themselves. Moreover, we will discuss solutions Web developers can use to automatically eliminate tracking from the third-party content they include in their applications. This tutorial will be of interest to a \emph{general audience} of computer scientists, and \emph{we do not require any specific prerequisite knowledge} for attendees. We will cover the following tracking mechanisms: \begin{itemize} \item third-party cookie tracking, and other stateful tracking techniques that enables tracking across multiple websites, \item cookie respawning that is used to re-create deleted user cookies, \item cookie synching that allows trackers and ad agencies to synchronise user IDs across different companies, \item browser fingerprinting, including Canvas, WebRTC and AudioContext fingerprinting \item cross-browser device fingerprinting, allowing trackers to recognise users across several devices. \end{itemize} We will then demonstrate prevalence of such techniques on the Web, based on previous research. We will present the advertisement ecosystem and explain how Web technologies are used in advertisement, in particular in Real-Time-Bidding (RTB). We will explain how cookie synching is used in RTB and present recent analysis on how much a user's tracking data is worth. We will discuss the mechanisms the website owners use to automatically interact with the ad agencies, and explain its consequences on user's security and privacy. To help users protect themselves from Web tracking, we will give an overview of existing solutions. We'll start with the browser settings, and show that basic third-party cookie tracking is still possible even in the private browser mode of most common Web browsers. We then present privacy-protecting browser extensions and compare how efficient they are in protection from Web tracking. Then, we'll present possible protection mechanisms based on browser randomisation to protect from advanced fingerprinting techniques. Finally, we will present solutions for Web developers, who want to include third-party content in their websites, but would like to automatically remove any tracking of their users. In particular, we will discuss simple solutions that exist today for social plugins integration, and propose more advanced server-side based solutions that are a result of our own research."
ACM CCS 2017,RiskTeller - Predicting the Risk of Cyber Incidents.,"The current evolution of the cyber-threat ecosystem shows that no system can be considered invulnerable. It is therefore important to quantify the risk level within a system and devise risk prediction methods such that proactive measures can be taken to reduce the damage of cyber attacks. We present RiskTeller, a system that analyzes binary file appearance logs of machines to predict which machines are at risk of infection months in advance. Risk prediction models are built by creating, for each machine, a comprehensive profile capturing its usage patterns, and then associating each profile to a risk level through both fully and semi-supervised learning methods. We evaluate RiskTeller on a year-long dataset containing information about all the binaries appearing on machines of 18 enterprises. We show that RiskTeller can use the machine profile computed for a given machine to predict subsequent infections with the highest prediction precision achieved to date."
ACM CCS 2017,Directed Greybox Fuzzing.,"Existing Greybox Fuzzers (GF) cannot be effectively directed, for instance, towards problematic changes or patches, towards critical system calls or dangerous locations, or towards functions in the stack-trace of a reported vulnerability that we wish to reproduce. In this paper, we introduce Directed Greybox Fuzzing (DGF) which generates inputs with the objective of reaching a given set of target program locations efficiently. We develop and evaluate a simulated annealing-based power schedule that gradually assigns more energy to seeds that are closer to the target locations while reducing energy for seeds that are further away. Experiments with our implementation AFLGo demonstrate that DGF outperforms both directed symbolic-execution-based whitebox fuzzing and undirected greybox fuzzing. We show applications of DGF to patch testing and crash reproduction, and discuss the integration of AFLGo into Google's continuous fuzzing platform OSS-Fuzz. Due to its directedness, AFLGo could find 39 bugs in several well-fuzzed, security-critical projects like LibXML2. 17 CVEs were assigned."
ACM CCS 2017,Practical Secure Aggregation for Privacy-Preserving Machine Learning.,"We design a novel, communication-efficient, failure-robust protocol for secure aggregation of high-dimensional data. Our protocol allows a server to compute the sum of large, user-held data vectors from mobile devices in a secure manner (i.e. without learning each user's individual contribution), and can be used, for example, in a federated learning setting, to aggregate user-provided model updates for a deep neural network. We prove the security of our protocol in the honest-but-curious and active adversary settings, and show that security is maintained even if an arbitrarily chosen subset of users drop out at any time. We evaluate the efficiency of our protocol and show, by complexity analysis and a concrete implementation, that its runtime and communication overhead remain low even on large data sets and client pools. For 16-bit input values, our protocol offers $1.73 x communication expansion for 210 users and 220-dimensional vectors, and 1.98 x expansion for 214 users and 224-dimensional vectors over sending data in the clear."
ACM CCS 2017,Forward and Backward Private Searchable Encryption from Constrained Cryptographic Primitives.,"Using dynamic Searchable Symmetric Encryption, a user with limited storage resources can securely outsource a database to an untrusted server, in such a way that the database can still be searched and updated efficiently. For these schemes, it would be desirable that updates do not reveal any information a priori about the modifications they carry out, and that deleted results remain inaccessible to the server a posteriori. If the first property, called forward privacy, has been the main motivation of recent works, the second one, backward privacy, has been overlooked."
ACM CCS 2017,Homomorphic Secret Sharing - Optimizations and Applications.,"We continue the study of Homomorphic Secret Sharing (HSS), recently introduced by Boyle et al. (Crypto 2016, Eurocrypt 2017). A (2-party) HSS scheme splits an input x into shares (x0,x1) such that (1) each share computationally hides x, and (2) there exists an efficient homomorphic evaluation algorithm $\Eval$ such that for any function (or ""program"")  from a given class it holds that Eval(x0,P)+Eval(x1,P)=P(x). Boyle et al. show how to construct an HSS scheme for branching programs, with an inverse polynomial error, using discrete-log type assumptions such as DDH."
